concept_id	concept_synonym_name	language_concept_id
44789384	Mucopolysaccharidosis type VII screening test (procedure)	4180186
44789388	GM1 gangliosidosis screening test (procedure)	4180186
44789390	Alpha-mannosidosis screening test (procedure)	4180186
44789390	a-mannosidosis screening test	4180186
44789391	alpha-Aminobutyrate measurement (procedure)	4180186
44789396	Anti-skeletal muscle antibody measurement (procedure)	4180186
44789398	Discussion about contraception injection (procedure)	4180186
44789399	Uses wheelchair indoors (finding)	4180186
44789400	Uses wheelchair outdoors (finding)	4180186
44789405	Arabic language interpreter needed (finding)	4180186
44789408	Spirometry indicated (situation)	4180186
44789411	Thyroid monitoring call third letter (procedure)	4180186
44789413	Discussion about maternal wellbeing - alcohol (procedure)	4180186
44789415	Discussion about maternal wellbeing - dental health (procedure)	4180186
44789416	Discussion about maternal wellbeing - exercise (procedure)	4180186
44789417	Discussion about maternal wellbeing - postnatal depression (procedure)	4180186
44789418	Discussion about maternal wellbeing - drugs (procedure)	4180186
44789420	Alleged perpetrator of physical abuse (finding)	4180186
44789421	Alleged perpetrator of sexual abuse (finding)	4180186
44789422	Alleged perpetrator of emotional abuse (finding)	4180186
44789423	Alleged perpetrator of domestic violence (finding)	4180186
44789426	Advice on foreign travel - health insurance (procedure)	4180186
44789428	Italian language interpreter needed (finding)	4180186
44789430	Croatian language interpreter needed (finding)	4180186
44789430	Serbo-Croatian language interpreter needed	4180186
44789431	Czech language interpreter needed (finding)	4180186
44789433	Persian language interpreter needed	4180186
44789433	Persian language interpreter needed (finding)	4180186
44789437	Signing of temporary resident claim (more than 15 days) (procedure)	4180186
44789440	Igbo language interpreter needed (finding)	4180186
44789442	German language interpreter needed (finding)	4180186
44789446	Hindi language interpreter needed (finding)	4180186
44789447	Xray report received	4180186
44789447	X-ray report received (finding)	4180186
44789449	Consultant letter from: (finding)	4180186
44789450	Korean language interpreter needed (finding)	4180186
44789451	Kurdish language interpreter needed (finding)	4180186
44789455	Insertion of drug-eluting coronary artery stent (procedure)	4180186
44789456	Endovascular laser ablation of varicose vein of leg (procedure)	4180186
44789458	Phenolisation of nail bed of great toe (procedure)	4180186
44789459	Referred to heart failure education group (finding)	4180186
44789460	Ganda language interpreter needed (finding)	4180186
44789462	Mandarin language interpreter needed (finding)	4180186
44789463	Norwegian language interpreter needed (finding)	4180186
44789465	Prescription sent to patient (finding)	4180186
44789466	Congested larynx (disorder)	4180186
44789468	Polish language interpreter needed (finding)	4180186
44789469	Did not attend initial appointment (finding)	4180186
44789470	Vasectomy scar (finding)	4180186
44789471	Skin thickening of breast (finding)	4180186
44789473	Risks to Care Professional or Third Party - Care Record Element	4180186
44789473	Risks to care professional or third party - care record element (record artifact)	4180186
44789474	Primary and Community Care Event - FocusActOrEvent (record artifact)	4180186
44789475	Russian language interpreter needed (finding)	4180186
44789476	Serbian language interpreter needed (finding)	4180186
44789476	Serbo-Croatian language interpreter needed	4180186
44789478	Sinhala language interpreter needed (finding)	4180186
44789480	Spanish language interpreter needed (finding)	4180186
44789481	Swahili language interpreter needed (finding)	4180186
44789483	[D]Hyperferritinaemia (situation)	4180186
44789485	Letter sent to consultant (finding)	4180186
44789486	Tagalog language interpreter needed (finding)	4180186
44789488	Tamil language interpreter needed (finding)	4180186
44789490	Thai language interpreter needed (finding)	4180186
44789492	Entry to Mental Health Services - FocusActOrEvent (record artifact)	4180186
44789494	Turkish language interpreter needed (finding)	4180186
44789495	Ukrainian language interpreter needed (finding)	4180186
44789496	Urdu language interpreter needed (finding)	4180186
44789497	Vietnamese language interpreter needed (finding)	4180186
44789499	Yoruba language interpreter needed (finding)	4180186
44789501	Astrovirus nucleic acid detection (procedure)	4180186
44789502	Avian influenza virus nucleic acid detection (procedure)	4180186
44789503	BK polyomavirus nucleic acid detection (procedure)	4180186
44789505	Poor nutrition (finding)	4180186
44789506	Under care of care programme approach worker (finding)	4180186
44789508	British Sign Language interpreter needed (finding)	4180186
44789509	Makaton Sign Language interpreter needed (finding)	4180186
44789511	Histopathology report received (finding)	4180186
44789512	International cholera certificate fee due (finding)	4180186
44789513	Coxiella burnetii (Q fever) nucleic acid detection (procedure)	4180186
44789516	Seen in child and family unit (finding)	4180186
44789517	EBV nucleic acid detection	4180186
44789517	Epstein-Barr virus nucleic acid detection (procedure)	4180186
44789518	Hepatitis E nucleic acid detection (procedure)	4180186
44789519	Human metapneumovirus nucleic acid detection (procedure)	4180186
44789519	Human MPV (metapneumovirus) nucleic acid detection	4180186
44789521	JC virus nucleic acid detection (procedure)	4180186
44789522	Measles virus nucleic acid detection (procedure)	4180186
44789523	Discussion about information sharing (procedure)	4180186
44789525	Mumps virus nucleic acid detection (procedure)	4180186
44789526	Mycoplasma nucleic acid detection (procedure)	4180186
44789529	Rhinovirus nucleic acid detection (procedure)	4180186
44789531	Out of Hours Event - FocusActOrEvent (record artifact)	4180186
44789532	Immunisation summary certificate fee due (finding)	4180186
44789534	Respiratory syncytial virus nucleic acid detection (procedure)	4180186
44789535	Sapovirus nucleic acid detection (procedure)	4180186
44789536	Rubella virus nucleic acid detection (procedure)	4180186
44789543	Anticoagulant therapy stopped (situation)	4180186
44789545	Hepatitis C screening counselling (procedure)	4180186
44789548	Reads Hausa (finding)	4180186
44789549	Reads Chinese - Simplified (finding)	4180186
44789553	Reads Yoruba (finding)	4180186
44789555	Reads Italian (finding)	4180186
44789556	Reads German (finding)	4180186
44789557	Reads Albanian (finding)	4180186
44789559	Reads Greek (finding)	4180186
44789561	Reads Turkish (finding)	4180186
44789562	Reads Vietnamese (finding)	4180186
44789566	Reads Sinhala (finding)	4180186
44789567	Reads Bulgarian (finding)	4180186
44789568	Reads Chechen (finding)	4180186
44789570	Reads Kinyarwanda (finding)	4180186
44789573	Reads Malay (finding)	4180186
44789576	Suspected chronic obstructive pulmonary disease (situation)	4180186
44789576	Suspected COPD	4180186
44789580	Carer has insight of patients illness (finding)	4180186
44789582	Eastern Catholic religion (religion/philosophy)	4180186
44789584	Patient religion unknown (finding)	4180186
44789585	Letter sent to patient (finding)	4180186
44789586	Hypothyroidism review (regime/therapy)	4180186
44789587	New Zealand major joint replacement priority score (assessment scale)	4180186
44789589	Victim of domestic violence (finding)	4180186
44789591	Collagen/EPI closure time	4180186
44789591	Collagen/epinephrine closure time (procedure)	4180186
44789593	Bronchial casts (finding)	4180186
44789594	Opiate dependence detoxification (regime/therapy)	4180186
44789595	On examination vagal nerve stimulator (finding)	4180186
44789597	Paroxysmal dyskinesia (finding)	4180186
44789599	Case management risk assessment score (assessment scale)	4180186
44789600	Injection for tenosynovitis of wrist (procedure)	4180186
44789603	Drug Ca-Cd (navigational concept)	4180186
44789605	Bengali as a second language (finding)	4180186
44789609	Dutch as a second language (finding)	4180186
44789610	French as a second language (finding)	4180186
44789617	Igbo as a second language (finding)	4180186
44789618	Intermediate and first response care enhanced services administration (procedure)	4180186
44789619	Drug Da-Dh (navigational concept)	4180186
44789622	Drug Ma-Me (navigational concept)	4180186
44789623	Drug Mf-Mz (navigational concept)	4180186
44789628	Drug Ta-Th (navigational concept)	4180186
44789630	Multiple sclerosis multidisciplinary review (regime/therapy)	4180186
44789631	TAG score: none	4180186
44789631	Threshold assessment grid score: none (finding)	4180186
44789633	TAG score: very severe	4180186
44789633	Threshold assessment grid score: very severe (finding)	4180186
44789636	Lithuanian as a second language (finding)	4180186
44789638	Portuguese as a second language (finding)	4180186
44789640	Serbian as a second language (finding)	4180186
44789641	Somali as a second language (finding)	4180186
44789643	Swahili as a second language (finding)	4180186
44789644	Tagalog as a second language (finding)	4180186
44789646	Abnormal stereoscopic vision (finding)	4180186
44789647	Hospital transport booked (finding)	4180186
44789652	Pentaporphyrin level (procedure)	4180186
44789654	High risk drug monitoring - primary care (finding)	4180186
44789655	High risk drug monitoring - shared care (finding)	4180186
44789656	High risk drug monitoring - secondary care (finding)	4180186
44789657	Referred by Prolific Offending team (finding)	4180186
44789664	11 oxo-pregnanetriol:creatinine ratio (procedure)	4180186
44789665	17 alpha hyd pregnan:creat rat	4180186
44789665	17 alpha hydroxy pregnanolone:creatinine ratio (procedure)	4180186
44789667	Androsterone:creatinine ratio (procedure)	4180186
44789668	Androsterone excretion (procedure)	4180186
44789671	SC2 self certificate given (finding)	4180186
44789673	Email received from consultant	4180186
44789673	E-mail received from consultant (procedure)	4180186
44789675	Ecstasy misuse (finding)	4180186
44789677	Heroin misuse (finding)	4180186
44789679	German as a second language (finding)	4180186
44789684	Waterlow medication score (observable entity)	4180186
44789685	Waterlow mobility score (observable entity)	4180186
44789686	Waterlow neurological deficit score (observable entity)	4180186
44789687	Waterlow build/weight for height score (observable entity)	4180186
44789692	Waterlow age score (observable entity)	4180186
44789694	Drug addiction maintenance therapy - buprenorphine (regime/therapy)	4180186
44789696	Priority context values (qualifier value)	4180186
44789697	Personal Demographics - Care Record Element	4180186
44789697	Personal demographics - care record element (record artifact)	4180186
44789698	Care Events - Care Record Element	4180186
44789698	Care events - care record element (record artifact)	4180186
44789700	Lingala as a second language (finding)	4180186
44789703	Norwegian as a second language (finding)	4180186
44789704	Thai as a second language (finding)	4180186
44789706	Turkish as a second language (finding)	4180186
44789711	Patient paper record not available (finding)	4180186
44789712	Wants to stop smoking (finding)	4180186
44789716	Drug addiction detoxification therapy - buprenorphine (regime/therapy)	4180186
44789718	In-house orthopaedic follow-up appointment (procedure)	4180186
44789719	In-house cardiology first appointment (procedure)	4180186
44789720	In-house cardiology follow-up appointment (procedure)	4180186
44789723	Informed consent to see school nurse given (finding)	4180186
44789724	Letter sent to outside agency (finding)	4180186
44789725	Night visit paid-lower rate	4180186
44789725	Night visit paid - lower rate (finding)	4180186
44789727	Letter sent to solicitor (finding)	4180186
44789728	Scottish certification visual handicap - likely to improve (procedure)	4180186
44789732	Letter sent to physiotherapist (finding)	4180186
44789737	GMS4 claim - registration examination signed (finding)	4180186
44789739	Via internal post:letter to (finding)	4180186
44789743	GMS4 claim - immunisation (Rate A) paid (finding)	4180186
44789745	Personally Administered Medication - FocusActOrEvent (record artifact)	4180186
44789747	GMS4 claim - contraception (non intrauterine contraceptive device) due (finding)	4180186
44789749	Mental Health Act 1983 (England and Wales) form 3 completed (finding)	4180186
44789750	SD17/18 no details, returned (finding)	4180186
44789752	GMS4 claim - contraception (intrauterine contraceptive device) sent to Health Authority (finding)	4180186
44789753	Mental Health Act 1983 (England and Wales) form 3 fee unpaid (finding)	4180186
44789754	FP22-removed-patients request (finding)	4180186
44789755	Via external post:letter to (finding)	4180186
44789757	GMS4 claim - arrest of dental haemorrhage paid (finding)	4180186
44789758	Night visit - not claimable (finding)	4180186
44789761	GP/PS2 prior approval training (record artifact)	4180186
44789764	[X]Townes-Brocks syndrome (disorder)	4180186
44789766	Drug misuse enhanced service completed (finding)	4180186
44789767	Life assurance examination fee not paid (finding)	4180186
44789772	GP19 temporary resident less than 15 days form signed (finding)	4180186
44789773	Parathyroid washout (procedure)	4180186
44789774	Medication recommendations - care record element (record artifact)	4180186
44789776	Major systemic to pulmonary collateral artery occlusion (procedure)	4180186
44789777	Percutaneous transluminal embolisation of major systemic to pulmonary collateral artery (procedure)	4180186
44789779	Percutaneous transluminal balloon dilation of anastomosis between pulmonary artery and subclavian artery (procedure)	4180186
44789780	Plastic repair of aorta and insertion of tube graft (procedure)	4180186
44789781	Endovascular insertion of stent for aorto-uniiliac aneurysm	4180186
44789781	Endovascular stenting for aorto-uniiliac aneurysm	4180186
44789781	Endovascular stenting of aorto-uniiliac aneurysm (procedure)	4180186
44789784	Percutaneous transluminal balloon angioplasty and stenting of renal artery (procedure)	4180186
44789785	Re-excision of breast margins (procedure)	4180186
44789786	Nipple sharing using other tissue (procedure)	4180186
44789787	GP19 temporary resident more than 15 days form signed (finding)	4180186
44789790	[X]Mental and behavioural disorders due to use of crack cocaine: amnesic syndrome (disorder)	4180186
44789791	Percutaneous transluminal balloon angioplasty and stenting of aorta (procedure)	4180186
44789792	Percutaneous transluminal balloon angioplasty and stenting of coronary artery (procedure)	4180186
44789794	Percutaneous transluminal stent reconstruction of artery (procedure)	4180186
44789796	Percutaneous transluminal balloon test occlusion of artery (procedure)	4180186
44789798	Administration of activated charcoal (procedure)	4180186
44789800	GP19 temporary resident more than 15 days form sent to health board (finding)	4180186
44789800	GP19 temporary resident more than 15 days form sent to Health Board (finding)	4180186
44789801	Letter to orthotist (finding)	4180186
44789804	Percutaneous transluminal stent implantation into arterial duct (procedure)	4180186
44789807	Insertion of vascular closure device (procedure)	4180186
44789810	Transplantation of liver cells (procedure)	4180186
44789812	FP24 maternity claim checked by staff (finding)	4180186
44789813	Percutaneous transhepatic biliary drainage single (procedure)	4180186
44789814	Percutaneous aspiration thromboembolectomy (procedure)	4180186
44789816	Percutaneous transluminal arterial and venous embolisation of dural arteriovenous fistula (procedure)	4180186
44789817	Percutaneous transluminal arterial embolisation of dural arteriovenous fistula (procedure)	4180186
44789819	Attention to connection of stomach to duodenum (procedure)	4180186
44789819	Attention to gastroduodenal anastomosis	4180186
44789820	Attention to connection of stomach to transposed jejunum (procedure)	4180186
44789821	Single assessment process summary care plan completed (situation)	4180186
44789822	Attention to connection of stomach to jejunum (procedure)	4180186
44789824	Mental Health Act 1983 (England and Wales) form 4 completed (finding)	4180186
44789826	Percutaneous transluminal venous embolisation of dural arteriovenous fistula (procedure)	4180186
44789829	Diagnostic imaging of face and neck (procedure)	4180186
44789830	GP/MS minor surgery claim signed (finding)	4180186
44789831	Diagnostic imaging of pelvis (procedure)	4180186
44789832	Cardiac computed tomography angiography (procedure)	4180186
44789833	FP24 maternity claim - Family Practitioner Committee dispute fee due (finding)	4180186
44789834	Transjugular intrahepatic pressure measurements of hepatic vein (procedure)	4180186
44789836	Transilluminated powered phlebectomy of varicose vein of leg (procedure)	4180186
44789849	Placement of dynamic graciloplasty sphincter (procedure)	4180186
44789851	GP24 signed by patient (finding)	4180186
44789852	Creating of impression for denture or obturator (procedure)	4180186
44789853	Implantation of electrocardiography loop recorder (procedure)	4180186
44789856	Mental Health Act 1983 (England and Wales) form 4 fee unpaid (finding)	4180186
44789858	Conversion of atrial pulmonary anastomosis to total pulmonary connection (procedure)	4180186
44789862	Placement of hearing implant in middle ear (procedure)	4180186
44789863	Diagnostic imaging of breast (procedure)	4180186
44789865	FP81 night visit unspecified claim sent to Family Practitioner Committee (finding)	4180186
44789867	FP81 higher rate night visit claim signed (finding)	4180186
44789868	FP19 - temporary resident claim (less than 15 days) (procedure)	4180186
44789869	FP19 temporary resident less than 15 days form sent to Family Practitioner Committee (finding)	4180186
44789872	FP19 temporary resident more than 15 days form sent to Family Practitioner Committee (finding)	4180186
44789873	Range criteria (qualifier value)	4180186
44789876	FP31 anaesthetic claim signed (finding)	4180186
44789877	Mental Health Act 1983 (England and Wales) form 7 fee to Social Services (finding)	4180186
44789881	Bleaching of teeth (procedure)	4180186
44789884	Insertion of fixtures for bone anchored hearing prosthesis Stage 2 (procedure)	4180186
44789884	Second stage insertion of fixtures for bone anchored hearing prosthesis	4180186
44789885	GP/RF registration fee paid (finding)	4180186
44789886	Diagnostic imaging of vascular system (procedure)	4180186
44789887	Diagnostic imaging of genitourinary system (procedure)	4180186
44789888	Nuclear cystography (procedure)	4180186
44789890	Epigastric sounds absent (finding)	4180186
44789891	Cannulation of bone (procedure)	4180186
44789891	Intraosseous cannulation	4180186
44789892	Intraosseous administration of fluid (procedure)	4180186
44789895	FP/MS minor surgery fee claim form signed (finding)	4180186
44789897	Live related donor (person)	4180186
44789899	High cost drugs (procedure)	4180186
44789901	High cost anaesthesia drugs (procedure)	4180186
44789903	High cost dermatology drugs (procedure)	4180186
44789905	High cost endocrinology drugs (procedure)	4180186
44789909	High cost immunology drugs (procedure)	4180186
44789913	Percutaneous transluminal atrial septum fenestration (procedure)	4180186
44789915	Placement of hearing implant in external ear (procedure)	4180186
44789916	GP24 paid by Health Board - underpaid (finding)	4180186
44789919	GP/HPC-health promotion clinic (record artifact)	4180186
44789921	High cost neurology drugs (procedure)	4180186
44789923	High cost reproductive and urinary tract drugs (procedure)	4180186
44789927	Anti-fungal drugs Band 2 (procedure)	4180186
44789928	Hepatitis B treatment drugs Band 1 (procedure)	4180186
44789930	Respiratory syncytial virus treatment and Hepatitis C treatment drugs Band 1 (procedure)	4180186
44789932	Bone metabolism drugs Band 1 (procedure)	4180186
44789933	Growth hormone analogue drugs Band 1 (procedure)	4180186
44789934	Growth hormone receptor antagonist drugs Band 1 (procedure)	4180186
44789936	Blood products Band 2 (procedure)	4180186
44789937	FP/HPC health promotion clinic form (record artifact)	4180186
44789940	Hypoplastic haemolytic and renal anaemia drugs Band 2 (procedure)	4180186
44789941	Intravenous nutrition Band 1 (procedure)	4180186
44789943	Primary pulmonary hypertension drugs Band 1 (procedure)	4180186
44789944	FP/HPC clinic claim signed (finding)	4180186
44789945	Primary pulmonary hypertension drugs Band 2 (procedure)	4180186
44789946	Primary pulmonary hypertension drugs Band 3 (procedure)	4180186
44789948	Thrombin injection for pseudoaneurysm (procedure)	4180186
44789949	Photodynamic therapy to subretinal lesion (procedure)	4180186
44789950	Gestational age (observable entity)	4180186
44789952	Placement of therapeutic contact lens onto cornea (procedure)	4180186
44789954	Revisional automated percutaneous mechanical excision of cervical intervertebral disc (procedure)	4180186
44789955	Percutaneous laser ablation of placental arterio-venous anastomosis (procedure)	4180186
44789956	Implantation massive endoprosthetic replacement of bone (procedure)	4180186
44789957	GP/HPC - clinic claim signed (finding)	4180186
44789961	Primary pulmonary hypertension drugs Band 4 (procedure)	4180186
44789963	Immune response drugs Band 1 (procedure)	4180186
44789964	Immunoglobulins Band 1 (procedure)	4180186
44789966	FP/HPC claim paid (finding)	4180186
44789969	Somatostatin analogues Band 1 (procedure)	4180186
44789970	Metabolic disorder drugs Band 1 (procedure)	4180186
44789971	Metabolic disorder drugs Band 2 (procedure)	4180186
44789975	Amyotrophic lateral sclerosis drugs Band 1 (procedure)	4180186
44789978	Medical gases Band 1 (procedure)	4180186
44789979	Procurement of drugs for chemotherapy for neoplasm in bands 1-5 (procedure)	4180186
44789980	Procurement of drugs for chemotherapy for neoplasm in bands 6-10 (procedure)	4180186
44789981	Other specified procurement of drugs for chemotherapy for neoplasm in bands 1-5 - OPCS Classification of Interventions and Procedures (procedure)	4180186
44789983	Procurement of drugs for chemotherapy for neoplasm in bands 1-5 NOS - OPCS Classification of Interventions and Procedures (procedure)	4180186
44789985	GMS3 claim (procedure)	4180186
44789986	Report received from social services (finding)	4180186
44789987	Percutaneous transluminal cutting balloon angioplasty of pulmonary vein (procedure)	4180186
44789989	Reprogramming of neurostimulator adjacent to spinal cord (procedure)	4180186
44789994	Procurement of drugs for chemotherapy for neoplasm in bands 6-10 NOS - OPCS Classification of Interventions and Procedures (procedure)	4180186
44789998	Robotic assisted minimal access approach to other body cavity - OPCS Classification of Interventions and Procedures (qualifier value)	4180186
44790002	GMS3 claim - temporary resident less than 15 days signed (finding)	4180186
44790003	Endoscopic ultrasonic approach to other body cavity - OPCS Classification of Interventions and Procedures (qualifier value)	4180186
44790007	Arteriotomy approach to organ under image control NOS - OPCS Classification of Interventions and Procedures (qualifier value)	4180186
44790010	Arteriotomy approach to organ using image guidance with fluoroscopy - OPCS Classification of Interventions and Procedures (qualifier value)	4180186
44790011	Arteriotomy approach to organ using image guidance with image intensifier - OPCS Classification of Interventions and Procedures (qualifier value)	4180186
44790012	GMS3 claim - temporary resident less than 15 days paid (finding)	4180186
44790013	Arteriotomy approach to organ using image guidance with ultrasound - OPCS Classification of Interventions and Procedures (qualifier value)	4180186
44790014	Arteriotomy approach to organ using image guidance with video control - OPCS Classification of Interventions and Procedures (qualifier value)	4180186
44790015	Other specified arteriotomy approach to organ under image control - OPCS Classification of Interventions and Procedures (qualifier value)	4180186
44790016	Minimal access to abdominal cavity - OPCS Classification of Interventions and Procedures (qualifier value)	4180186
44790017	Hand assisted minimal access approach to abdominal cavity - OPCS Classification of Interventions and Procedures (qualifier value)	4180186
44790019	Laparoscopic ultrasonic approach to abdominal cavity - OPCS Classification of Interventions and Procedures (qualifier value)	4180186
44790022	Other specified minimal access to abdominal cavity - OPCS Classification of Interventions and Procedures (qualifier value)	4180186
44790025	Minimal access to thoracic cavity - OPCS Classification of Interventions and Procedures (qualifier value)	4180186
44790026	Robotic minimal access approach to thoracic cavity - OPCS Classification of Interventions and Procedures (qualifier value)	4180186
44790028	GMS3 claim - temporary resident more than 15 days paid (finding)	4180186
44790029	Poliovirus 3 antibody level (procedure)	4180186
44790032	GP74 - returned unpaid (finding)	4180186
44790033	Graft of fascia to eyelid (procedure)	4180186
44790034	Correction of cicatricial ectropion (procedure)	4180186
44790036	Aspergillus antigen level (procedure)	4180186
44790038	Mycobacteria nucleic acid detection (procedure)	4180186
44790040	HTLV nucleic acid detection	4180186
44790040	Human T-lymphotropic virus nucleic acid detection (procedure)	4180186
44790042	HHV-8 nucleic acid detection	4180186
44790042	Human herpes virus 8 nucleic acid detection (procedure)	4180186
44790045	HHV-6 nucleic acid detection	4180186
44790045	Human herpes virus 6 nucleic acid detection (procedure)	4180186
44790046	Norovirus (small round-structured viruses) nucleic acid detection (procedure)	4180186
44790048	Parainfluenza type 2 nucleic acid detection (procedure)	4180186
