concept_id	concept_synonym_name	language_concept_id
3541617	Diagnostic fiberoptic endoscopic examination of esophagus NOS (procedure)	4180186
3541618	Partial gastrectomy and anastomosis of stomach to jejunum NEC (procedure)	4180186
3541620	Accident caused by tidal wave NEC (event)	4180186
3541621	Crushed by falling object on ship or while loading or unloading, member of crew of other watercraft injured (event)	4180186
3541622	Fire on aircraft while taking off, other occupant of commercial aircraft in surface to surface transport injured (event)	4180186
3541624	Crushed by falling object on ship or while loading or unloading, other specified person injured (event)	4180186
3541625	Crushed by falling object on ship or while loading or unloading, unspecified person injured (event)	4180186
3541629	Other elbow, wrist and forearm injuries NOS (disorder)	4180186
3541630	Systemic agent poisoning NOS (disorder)	4180186
3541634	Electroshock therapy complication NEC (disorder)	4180186
3541639	Open injury to other intrathoracic structure not otherwise specified (disorder)	4180186
3541640	Noncollision motor vehicle traffic accident involving being trapped by door of motor bus while boarding or alighting, unspecified person injured (event)	4180186
3541641	Noncollision motor vehicle traffic accident while boarding vehicle NOS (event)	4180186
3541642	Other specified intestinal fixation anomaly (disorder)	4180186
3541645	Other congenital anomaly of vas deferens or prostate (disorder)	4180186
3541646	Other congenital anomaly of penis (disorder)	4180186
3541647	Genital organ anomaly NOS (disorder)	4180186
3541648	Renal agenesis, unspecified (disorder)	4180186
3541649	Renal agenesis, unspecified NOS (disorder)	4180186
3541650	Other liver or biliary system anomalies NOS (disorder)	4180186
3541651	Small intestine injury with open wound into cavity, unspecified (disorder)	4180186
3541652	Other colon or rectum injury with open wound into cavity (disorder)	4180186
3541656	Colon or rectum injury with open wound into cavity, NOS (disorder)	4180186
3541659	Gastrointestinal tract injury with open wound into cavity, unspecified (disorder)	4180186
3541660	Pancreas multiple or unspecified site injury with open wound into cavity (disorder)	4180186
3541661	Open fracture of skull NOS with intracranial injury, with more than 24 hours loss of consciousness and return to pre-existing conscious level (disorder)	4180186
3541664	Animal-drawn vehicle accident NOS, occupant of tram injured (event)	4180186
3541665	Iliac blood vessel injury, unspecified (disorder)	4180186
3541666	Iliac blood vessel injury NOS (disorder)	4180186
3541667	Other abdominal or pelvic blood vessel injury (disorder)	4180186
3541668	Other abdominal and pelvic blood vessel injury NOS (disorder)	4180186
3541671	Central nervous system muscle-tone depressant poisoning NOS (disorder)	4180186
3541672	Other gaseous anesthetic agent poisoning (disorder)	4180186
3541674	Fetus with damage due to other maternal disease with antenatal problem (disorder)	4180186
3541675	Fetus with damage due to other maternal disease NOS (disorder)	4180186
3541676	Fetus with damage due to intrauterine contraceptive device unspecified (disorder)	4180186
3541677	Fetus with other damage NEC (disorder)	4180186
3541679	Effects of lightning NOS (disorder)	4180186
3541684	Effects of hunger NOS (disorder)	4180186
3541690	Open fracture of fibula, unspecified part, NOS (disorder)	4180186
3541692	Closed fracture of carpal bone NOS (disorder)	4180186
3541693	Open fracture of carpal bone, unspecified (disorder)	4180186
3541694	Open fracture of carpal bone NOS (disorder)	4180186
3541695	Fracture of other metacarpal bone (disorder)	4180186
3541696	Closed fracture of metacarpal bone (s), site unspecified (disorder)	4180186
3541697	Intra-abdominal organ injury with open wound into cavity, unspecified (disorder)	4180186
3541699	Other external effects, cause NOS (disorder)	4180186
3541700	External effect cause NOS (disorder)	4180186
3541702	Battered man, unspecified (finding)	4180186
3541703	Ultrasound therapy complication NEC (disorder)	4180186
3541704	Ventilation therapy complication NEC (disorder)	4180186
3541705	Nontraffic accident involving collision between off-road motor vehicle, except snow vehicle, and another off-road motor vehicle, except snow vehicle, unspecified person injured (event)	4180186
3541707	Closed fracture of vault of skull without mention of intracranial injury, with concussion, unspecified (disorder)	4180186
3541712	Nontraffic accident involving collision, not on public highway, between motor vehicle, except off-road vehicle, and stationary object NOS, unspecified person injured (event)	4180186
3541718	Other face and neck injuries NOS (disorder)	4180186
3541723	Other specified other anomalies of muscle, tendon and fascia (disorder)	4180186
3541726	Venereal/spirochete disease NOS (disorder)	4180186
3541727	Other helminthiases (disorder)	4180186
3541731	Other water transport accident NOS, member of crew of other watercraft injured (event)	4180186
3541732	Other water transport accident NOS, passenger of other watercraft injured (event)	4180186
3541733	Nontraffic accident involving collision, not on public highway, between motor vehicle, except off-road vehicle and moving object NOS, other specified person injured (event)	4180186
3541737	Arthritis associated with other disease, talonavicular joint (disorder)	4180186
3541738	Oligoarticular osteoarthritis, unspecified, of ankle and foot (disorder)	4180186
3541739	Osteoarthritis of more than one site, unspecified, NOS (disorder)	4180186
3541744	Perinatal jaundice from other specified hemolysis (disorder)	4180186
3541746	Open fracture of skull NOS without mention of intracranial injury, with less than 1 hour loss of consciousness (disorder)	4180186
3541748	Open fracture of unspecified cervical vertebra (disorder)	4180186
3541750	Closed fracture of ilium, unspecified (disorder)	4180186
3541751	Motor vehicle traffic accident involving collision, on highway, between motor vehicle and safety island, other specified person injured (event)	4180186
3541752	Motor vehicle traffic accident involving collision with other vehicle NOS, pedal cyclist injured (event)	4180186
3541754	Other and unspecified high altitude effects (disorder)	4180186
3541755	Hypobaropathy NOS (disorder)	4180186
3541757	Decompression sickness, unspecified (disorder)	4180186
3541760	Air pressure effects NOS (disorder)	4180186
3541763	Other medical care vascular complications (disorder)	4180186
3541764	Venous complication of pregnancy, unspecified (disorder)	4180186
3541768	Other intra-abdominal organ injury, NOS (disorder)	4180186
3541769	Internal injury NOS (disorder)	4180186
3541770	Internal injury without mention of open wound into cavity, NOS (disorder)	4180186
3541771	Transurethral ureter removal NOS (procedure)	4180186
3541773	Polyneuropathy unspecified (disorder)	4180186
3541775	Burned while ship on fire, unspecified person injured (event)	4180186
3541777	Other joint stiffness (finding)	4180186
3541778	Rheumatism multiple NOS (disorder)	4180186
3541779	Diagnostic endoscopic examination of pleura and biopsy of lesion of intrathoracic organ NEC (procedure)	4180186
3541780	Needle biopsy of liver NEC (procedure)	4180186
3541782	Ca breast - NOS (disorder)	4180186
3541783	Ca cervix uteri NOS (disorder)	4180186
3541784	Other primary carcinomas (disorder)	4180186
3541787	Open fracture of spine with spinal cord lesion unspecified (disorder)	4180186
3541789	Closed fracture of larynx and trachea NOS (disorder)	4180186
3541790	Open fracture of larynx and trachea NOS (disorder)	4180186
3541792	Injured by rolling stock, NOS - other specified person (event)	4180186
3541796	Hypoplasia of aortic arch, unspecified (disorder)	4180186
3541799	Retracted nipple in pregnancy, the puerperium or lactation NOS (disorder)	4180186
3541800	Cracked nipple in pregnancy, the puerperium or lactation unspecified (disorder)	4180186
3541801	Unspecified legal abortion with shock (disorder)	4180186
3541803	Unspecified complete abortion with damage to pelvic organs or tissues (disorder)	4180186
3541805	Neoplasm of uncertain behavior of other and unspecified urinary organs (disorder)	4180186
3541811	Fall on same level from sports contact NOS (event)	4180186
3541812	Fall on same level from other pushing, shoving or collision, with or by other person (event)	4180186
3541814	Fall on same level from pushing by other person, unspecified (event)	4180186
3541815	Animal-drawn vehicle accident involving being run over by animal-drawn vehicle, unspecified person injured (event)	4180186
3541818	Collision between animal being ridden and nonmotor road vehicle except pedal cycle and animal-drawn vehicle, unspecified person injured (event)	4180186
3541821	Fall from animal being ridden, unspecified person injured (event)	4180186
3541823	Injured by rolling stock, NOS - pedal cyclist (event)	4180186
3541824	Motor vehicle nontraffic accident of unspecified nature, except off-road motor vehicle, while in motion, not on public highway, driver of motor vehicle injured (event)	4180186
3541825	Animal-drawn vehicle accident involving collision with other object, fixed, movable or moving, not set in motion by motor vehicle, train or aircraft, occupant of tram injured (event)	4180186
3541828	Other specific muscle disorder (disorder)	4180186
3541830	Other infections involving bone, of the shoulder region (disorder)	4180186
3541833	Other muscle, ligament and fascia disorder (disorder)	4180186
3541834	Other soft tissue disorders (disorder)	4180186
3541838	Other umbilical cord complications with antenatal problem (disorder)	4180186
3541839	Other umbilical cord complications NOS (disorder)	4180186
3541840	Umbilical cord complications NOS (disorder)	4180186
3541841	Umbilical cord complications NOS - delivered (disorder)	4180186
3541843	First degree perineal tear during delivery, unspecified (disorder)	4180186
3541846	Genitourinary tract infection in pregnancy unspecified (disorder)	4180186
3541847	Fatigue during pregnancy unspecified (disorder)	4180186
3541848	Fatigue during pregnancy NOS (disorder)	4180186
3541852	Other fetal malposition and malpresentation - delivered (finding)	4180186
3541856	Fetus with other damage NEC with antenatal problem (disorder)	4180186
3541857	Fetus with other damage NEC NOS (disorder)	4180186
3541858	Disproportion - major pelvic abnormality NOS (disorder)	4180186
3541860	Fetus with damage NOS with antenatal problem (disorder)	4180186
3541866	Motor vehicle traffic accident involving collision, on highway, between motor vehicle and boundary fence or guard rail, unspecified person injured (event)	4180186
3541869	Late effects of accidents NOS (disorder)	4180186
3541872	Other reduction of fracture of spine (procedure)	4180186
3541874	Replantation of upper limb NOS (procedure)	4180186
3541875	Other malaria (disorder)	4180186
3541876	Intravenous blood transfusion NEC (procedure)	4180186
3541877	Other gonococcal infection of other specified site (disorder)	4180186
3541878	Gonococcal infection of other site NOS (disorder)	4180186
3541880	Other phlebitis in pregnancy (disorder)	4180186
3541881	Noncollision motor vehicle traffic accident involving explosion of any part of motor vehicle while in motion, other specified person injured (event)	4180186
3541886	Other pulmonary valve anomalies (disorder)	4180186
3541887	Intracranial injury NOS with open intracranial wound, with less than 1 hours loss of consciousness (disorder)	4180186
3541888	Intracranial injury NOS with open intracranial wound, with more than 24 hours loss of consciousness without return to pre-existing conscious level (disorder)	4180186
3541889	Head/neck angiography NOS (procedure)	4180186
3541892	Anastomosis of intestine NOS (procedure)	4180186
3541895	Therapeutic aspiration of musculoskeletal system NOS (procedure)	4180186
3541896	Other ventral hernia repair (procedure)	4180186
3541897	Biliary tract anastomosis NOS (procedure)	4180186
3541898	Other hernia repair NOS (procedure)	4180186
3541899	Biliary excision/repair NOS (procedure)	4180186
3541900	Choledochotomy - obstruction NOS (procedure)	4180186
3541902	Accidental poisoning by sedatives and hypnotics NOS (disorder)	4180186
3541903	Accidental poisoning by phenothiazine-based tranquilizers NOS (disorder)	4180186
3541904	Accidental poisoning by butyrophenone-based tranquilizers NOS (disorder)	4180186
3541906	Accidental poisoning by other tranquilizers (disorder)	4180186
3541907	Urticaria NOS (disorder)	4180186
3541908	Other specified nail disease NOS (disorder)	4180186
3541913	Other skin disorders (disorder)	4180186
3541918	Other specified tenoplasty (procedure)	4180186
3541919	Foot arthritis NOS (disorder)	4180186
3541920	Ankle arthritis NOS (disorder)	4180186
3541922	Hip arthritis NOS (disorder)	4180186
3541923	Wrist arthritis NOS (disorder)	4180186
3541924	Elbow arthritis NOS (disorder)	4180186
3541931	Muscle sprain NOS (disorder)	4180186
3541935	Ligament sprain NOS (disorder)	4180186
3541936	Primary open reduction of fracture and other external immobilization (procedure)	4180186
3541938	Submersion or drowning due to jumping from burning ship, passenger of other watercraft injured (event)	4180186
3541939	Intrathoracic organ injury NOS (disorder)	4180186
3541942	Unspecified complete abortion with complication NOS (disorder)	4180186
3541944	Other threatened labor NOS (disorder)	4180186
3541945	Early onset of delivery unspecified (finding)	4180186
3541947	Post-term pregnancy NOS (disorder)	4180186
3541951	Boil of face NOS (disorder)	4180186
3541953	Acute myocarditis NOS (disorder)	4180186
3541955	Other diseases of pericardium (disorder)	4180186
3541956	Adhesive pericarditis NOS (disorder)	4180186
3541965	Surgical biopsy organ NOS (procedure)	4180186
3541967	Expression of placenta NOS (procedure)	4180186
3541968	Cardiac pacing NOS (procedure)	4180186
3541970	Bladder incision NOS (procedure)	4180186
3541972	Abdominal operations NOS (procedure)	4180186
3541973	Open bladder excision NOS (procedure)	4180186
3541974	Nephrectomy NOS (procedure)	4180186
3541978	Oophorotomy NOS (procedure)	4180186
3541979	Accidental poisoning by other solid and liquid substances OS (disorder)	4180186
3541980	Fall on or from stairs or steps NOS (event)	4180186
3541982	Failure in dose in shock therapy NOS (event)	4180186
3541984	Other failure in dose (event)	4180186
3541985	Hysterectomy NEC (procedure)	4180186
3541988	Aircraft crash on landing - other person injured (event)	4180186
3541992	Other gas, fume and vapour causing toxic effect NOS (disorder)	4180186
3541994	Noxious substance eaten as food causing toxic effect NOS (disorder)	4180186
3541997	Effects of thirst NOS (disorder)	4180186
3541998	Superficial injury of finger NOS, without mention of infection (disorder)	4180186
3541999	Superficial injury of finger NOS, infected (disorder)	4180186
3542000	Abrasion or friction burn of lower limb, without mention of infection, NOS (disorder)	4180186
3542002	Toxic effect of other arthropods (disorder)	4180186
3542005	Open fracture of metacarpal bone(s), site unspecified (disorder)	4180186
3542006	Open fractures of multiple sites of unspecified metacarpus (disorder)	4180186
3542008	Other senile/presenile dementia (disorder)	4180186
3542009	Vascular lesions of cord unspecified (disorder)	4180186
3542010	Complete tear, ankle ligament NOS (disorder)	4180186
3542013	Other open multiple and ill-defined dislocation (disorder)	4180186
3542014	Other dislocation NOS (disorder)	4180186
3542018	Train collision with other nonmotor vehicle, passenger injured (event)	4180186
3542019	Train collision with other nonmotor vehicle, pedestrian injured (event)	4180186
3542021	Late effect of other fracture of leg (disorder)	4180186
3542021	Sequelae of other fractures of lower limb	4180186
3542022	Late effect of multiple and unspecified fracture of bones (disorder)	4180186
3542034	Multiple open wounds, of unspecified site (disorder)	4180186
3542036	Open wound of shoulder and upper limb NOS (disorder)	4180186
3542038	Portal and splenic vein injury NOS (disorder)	4180186
3542040	Disease of anus and rectum, unspecified (disorder)	4180186
3542046	Non-arthropod-borne viral diseases of the central nervous system NOS (disorder)	4180186
3542047	Chest infection NOS (disorder)	4180186
3542048	Other pharyngeal disease NEC (disorder)	4180186
3542049	Paralysis of larynx unspecified (disorder)	4180186
3542050	Viral encephalitis from other arthropods (disorder)	4180186
3542052	Other viral conjunctivitis (disorder)	4180186
3542054	Benign neoplasm of brain and other parts of nervous system (disorder)	4180186
3542058	Joint contracture of unspecified site (disorder)	4180186
3542060	Contracture of joint NOS (disorder)	4180186
3542061	Joint ankylosis of unspecified site (disorder)	4180186
3542063	Ankylosis of other joint of the shoulder girdle (disorder)	4180186
3542069	Other joint symptoms of the forearm (finding)	4180186
3542070	Schmorl's nodes, region NOS (disorder)	4180186
3542072	Traumatic blister of head, infected, NOS (disorder)	4180186
3542076	Hit by boat while water skiing, other specified person injured (event)	4180186
3542077	Other replacement of aneurysmal segment of aorta (procedure)	4180186
3542078	Open excision of lesion of stomach NEC (procedure)	4180186
3542079	Bypass of stomach by anastomosis of stomach to jejunum NEC (procedure)	4180186
3542080	Other pelvic organ injury with open wound into cavity NOS (disorder)	4180186
3542081	Pelvic organ injury without mention of open wound into cavity, NOS (disorder)	4180186
3542084	Other cerebral hemorrhage following injury with open intracranial wound (disorder)	4180186
3542088	Motor vehicle traffic accident involving re-entrant collision with another motor vehicle, NOS, pedal cyclist injured (event)	4180186
3542091	Motor vehicle traffic accident involving pedestrian run over by motor vehicle, unspecified person injured (event)	4180186
3542094	Noncollision motor vehicle traffic accident involving injury by moving part of the vehicle while boarding or alighting, other specified person injured (event)	4180186
3542095	Train collision with rock, other specified person injured (event)	4180186
3542096	Train collision with rock, unspecified person injured (event)	4180186
3542097	Train collision with streetcar, other specified person injured (event)	4180186
3542098	Application of caustic NOS (procedure)	4180186
3542102	Maternal labor/delivery problem NOS (disorder)	4180186
3542103	Malnutrition NOS as fetus (disorder)	4180186
3542104	Adipose tissue reduction operation NOS (procedure)	4180186
3542107	Oophorectomy NOS (procedure)	4180186
3542108	Cervical excision/destruction NOS (procedure)	4180186
3542109	Fallopian insufflation NOS (procedure)	4180186
3542111	Cleft hard palate NOS (disorder)	4180186
3542112	Cleft soft palate NOS (disorder)	4180186
3542113	Chondrodystrophy NEC (disorder)	4180186
3542117	Fall due to collision or other accident to watercraft, docker or stevedore injured (event)	4180186
3542119	Off-road land motor vehicle in collision with other off-road land motor vehicle (event)	4180186
3542121	Other manic-depressive psychos (disorder)	4180186
3542122	Other phobias (finding)	4180186
3542126	Embolism and thrombosis of other and unspecified parts of aorta (disorder)	4180186
3542127	Irrigation of maxillary antrum NEC (procedure)	4180186
3542129	Tracheoscopy NEC (procedure)	4180186
3542130	Tracheobronchoscopy NEC (procedure)	4180186
3542132	Accidental mechanical suffocation, unspecified (event)	4180186
3542136	Accidents caused by submersion, suffocation and foreign bodies NOS (event)	4180186
3542140	Fall in, on or from aircraft, not due to an accident to aircraft, NOS, member of crew of commercial aircraft in surface to surface transport injured (event)	4180186
3542141	Hit by boat while water skiing, unspecified person injured (event)	4180186
3542142	Aircraft explosion-takeoff - other person injured (event)	4180186
3542144	Other uterine or pelvic floor abnormality in pregnancy, childbirth and the puerperium (disorder)	4180186
3542145	Lower leg fracture NOS (disorder)	4180186
3542147	Malfixation of gut NEC (disorder)	4180186
3542148	Other operations on chest wall (procedure)	4180186
3542149	Open excision of pleura NOS (procedure)	4180186
3542150	Accident in alighting from aircraft, other person injured (event)	4180186
3542151	Fall in aircraft, not due to an accident to aircraft, other occupant of commercial aircraft in surface to surface transport injured (event)	4180186
3542152	Fall in aircraft, not due to an accident to aircraft, occupant of other powered aircraft injured (event)	4180186
3542154	Fall from aircraft, not due to an accident to aircraft, other occupant of commercial aircraft in surface to surface transport injured (event)	4180186
3542155	Hydrogen peroxide 9%(30 volume) solution BP	4180186
3542157	Fall from aircraft, not due to an accident to aircraft, other person injured (event)	4180186
3542158	Fall in, on or from aircraft NOS (event)	4180186
3542161	Other accidental drowning and submersion (event)	4180186
3542162	Other accidental drowning and submersion NOS (event)	4180186
3542163	Nevus NEC (disorder)	4180186
3542164	Situs inversus, unspecified (disorder)	4180186
3542164	Transposition of viscera unspecified	4180186
3542166	Down's syndrome NOS (disorder)	4180186
3542166	Trisomy 21 NOS	4180186
3542167	Edward's syndrome NOS (disorder)	4180186
3542167	Trisomy 18 NOS	4180186
3542170	Other specified open operation on uterus (procedure)	4180186
3542172	Poisoning due to other snake venom (disorder)	4180186
3542175	Accidental mechanical suffocation by falling earth or other substance (event)	4180186
3542176	Assault by cutting or stabbing NOS (event)	4180186
3542177	Assault by homicidal burns NOS (event)	4180186
3542179	Catheterization of right side of heart NEC (procedure)	4180186
3542180	Accidentally struck by or against person NOS (event)	4180186
3542182	Injury undetermined whether accidentally or purposely inflicted, poisoning by other gases (disorder)	4180186
3542184	Optional surgery NOS (procedure)	4180186
3542185	Lesion endoscopic destruction NOS (procedure)	4180186
3542186	Hemolytic disease NOS (disorder)	4180186
3542187	Poison/toxic effect with other injury (disorder)	4180186
3542188	Therapeutic aspiration - gastrointestinal/cardiovascular/respiratory systems NOS (procedure)	4180186
3542190	Assault/injury NOS (event)	4180186
3542193	Bypass of other abdominal visceral artery (procedure)	4180186
3542194	War injury due to unconventional forms of warfare NOS (disorder)	4180186
3542196	Burning caused by conflagration in other residential home (event)	4180186
3542198	Accident due to collapse of other burning structure or building (event)	4180186
3542199	Accident due to fall from other burning structure or building (event)	4180186
3542204	Accident caused by other flame or fire NOS (event)	4180186
3542205	Bonnevie-Ullrich syndrome NOS (disorder)	4180186
3542207	Accident due to abandonment or neglect of helpless person NOS (event)	4180186
3542211	Appendectomy NEC (procedure)	4180186
3542214	Endoscopic retrograde cholangiopancreatography NEC (procedure)	4180186
3542215	Myringoplasty NEC (procedure)	4180186
3542217	Other uterine or pelvic floor abnormality affecting obstetric care (disorder)	4180186
3542223	Other cervical abnormality - baby delivered with postpartum complication (disorder)	4180186
3542224	Fiberoptic sigmoidoscopy NEC (procedure)	4180186
3542226	Esophagostomy NEC (procedure)	4180186
3542227	Ileectomy NEC (procedure)	4180186
3542230	Other respiratory resuscitation NOS (procedure)	4180186
3542234	Excision vulva/perineum NOS (procedure)	4180186
3542237	Diagnostic/aspiration puncture NOS (procedure)	4180186
3542238	Extraperitoneal incision NOS (procedure)	4180186
3542240	Perivesical tissue operations NOS (procedure)	4180186
3542241	Pre-eclampsia NOS (disorder)	4180186
3542241	Pre-eclampsia, unspecified	4180186
3542243	Fetus with maternal problem NOS (navigational concept)	4180186
3542244	Other fetal pregnancy removal operation (procedure)	4180186
3542247	Osteomyelitis hip NOS (disorder)	4180186
3542248	Urethrotomy NOS (procedure)	4180186
3542250	Cervix excision/destruction NOS (procedure)	4180186
3542251	Unspecified amblyopia (disorder)	4180186
3542252	Blurred vision NOS (disorder)	4180186
3542256	Encephalocele of other specified site (disorder)	4180186
3542257	Overexposure to radiation NOS (event)	4180186
3542258	Accident caused by explosion of gas cylinder NOS (event)	4180186
3542259	Accident caused by explosion of other pressure vessel NOS (event)	4180186
3542261	Accident caused by handgun NOS (event)	4180186
3542263	Spacecraft accident NOS, member of ground crew injured (event)	4180186
3542265	Epilepsy NOS (disorder)	4180186
3542266	Other conditions of brain NOS (disorder)	4180186
3542267	Mononeuritis of unspecified site NOS (disorder)	4180186
3542269	Other specific myoneural disorder (disorder)	4180186
3542270	Other specified hereditary progressive muscular dystrophy (disorder)	4180186
3542271	Other background retinopathy (disorder)	4180186
3542272	Retinal neovascularization NOS (disorder)	4180186
3542273	Hereditary retinal dystrophy NOS (disorder)	4180186
3542274	Chorioretinal inflammations scars and other disorders of choroid (disorder)	4180186
3542277	Back disorders - other (disorder)	4180186
3542280	Foreign body left in tissue NOS (disorder)	4180186
3542281	Musculoskeletal problems NOS (finding)	4180186
3542282	Spina bifida with hydrocephalus - closed NOS (disorder)	4180186
3542284	Spina bifida without hydrocephalus - closed NOS (disorder)	4180186
3542287	Local gigantism NEC (disorder)	4180186
3542288	Aqueduct of Sylvius septum NEC (disorder)	4180186
3542291	Arm dislocation NOS (disorder)	4180186
3542292	Fracture of radius NOS (disorder)	4180186
3542295	Sternum fracture NOS (disorder)	4180186
3542296	Upper leg fracture NOS (disorder)	4180186
