concept_id	concept_synonym_name	language_concept_id
37117887	Entire pericardium tissue (body structure)	4180186
37117889	Entire left ventricle mid anterolateral segment	4180186
37117889	Entire mid anterolateral segment of left cardiac ventricle (body structure)	4180186
37117890	Entire soleal vein (body structure)	4180186
37117891	Entire superior nasal quadrant of eye proper (body structure)	4180186
37117893	Entire fascia of extensor compartment of upper arm (body structure)	4180186
37117894	Entire efferent loop of jejunum (body structure)	4180186
37117899	Entire bone tissue of lacrimal bone (body structure)	4180186
37117900	History of selective lumbar nerve block (situation)	4180186
37117901	2-hydroxyphenylacetate (substance)	4180186
37117901	o-hydroxyphenylacetate	4180186
37117902	Tizoxanide (substance)	4180186
37117904	Hydantoin-5-propionate (substance)	4180186
37117906	Barthel Index of Activities of Daily Living score (observable entity)	4180186
37117907	Entire rhomboideus cervicis muscle (body structure)	4180186
37117912	Tetrahydrogestrinone (substance)	4180186
37117917	Picloram (substance)	4180186
37117919	Potassium citrate monohydrate (substance)	4180186
37117920	Entire soft tissue of elbow joint (body structure)	4180186
37117927	Esomeprazole magnesium dihydrate (substance)	4180186
37117931	Infundibulopelvic stenosis multicystic kidney syndrome (disorder)	4180186
37117931	Infundibulopelvic dysgenesis	4180186
37117933	Cirrhosis of liver caused by methotrexate (disorder)	4180186
37117935	Formalin-fixed placenta tissue specimen (specimen)	4180186
37117936	Enthesis of foot	4180186
37117936	Structure of enthesis of foot (body structure)	4180186
37117937	Mitral valve appearance (observable entity)	4180186
37117938	Structure of enthesis of shoulder region (body structure)	4180186
37117940	Entire enthesis of pelvic girdle (body structure)	4180186
37117942	Monosodium glutamate monohydrate (substance)	4180186
37117944	Entire tunica intima (body structure)	4180186
37117945	Entire circular layer of duodenal muscularis propria (body structure)	4180186
37117946	Entire bone tissue of third sacral vertebra (body structure)	4180186
37117948	Entire bone tissue of interparietal bone (body structure)	4180186
37117952	Entire bone tissue of phalanx of little toe (body structure)	4180186
37117953	Entire bone tissue of fourth sacral vertebra (body structure)	4180186
37117954	Entire bone tissue of floating rib (body structure)	4180186
37117955	Entire bone tissue of true rib (body structure)	4180186
37117956	Entire bone tissue of phalanx of fourth toe (body structure)	4180186
37117958	Entire bone tissue of distal phalanx of foot (body structure)	4180186
37117960	Entire bone tissue of lunate bone (body structure)	4180186
37117965	Entire early mixed dentition (body structure)	4180186
37117966	Entire third molar region of oral cavity (body structure)	4180186
37117967	Entire lateral incisor region of oral cavity (body structure)	4180186
37117969	Entire cupula ampullaris (body structure)	4180186
37117973	Entire fibrofatty tissue (body structure)	4180186
37117974	Entire distobuccal groove of tooth (body structure)	4180186
37117976	Entire manubriosternal synostosis (body structure)	4180186
37117977	Entire Dodd's perforating vein (body structure)	4180186
37117978	Entire Xiphisternal skin (body structure)	4180186
37117980	Entire distobuccal tooth root (body structure)	4180186
37117982	Entire C5/C6 ligamentum flavum (body structure)	4180186
37117984	Entire T9/T10 ligamentum flavum (body structure)	4180186
37117986	Entire C4/C5 intertransverse ligament (body structure)	4180186
37117987	Entire T4/T5 intertransverse ligament (body structure)	4180186
37117989	Entire C3/C4 interspinous ligament (body structure)	4180186
37117990	Entire T3/T4 interspinous ligament (body structure)	4180186
37117992	Entire Glossotonsillar sulcus (body structure)	4180186
37117993	Entire atriofascicular connection (body structure)	4180186
37117994	Entire Couinaud hepatic segment VII (body structure)	4180186
37117995	Entire cartilago triticea (body structure)	4180186
37117997	Computed tomography of right clavicle (procedure)	4180186
37117997	Computed tomography of right clavicle	4180186
37117999	Myotonia congenita (disorder)	4180186
37117999	Congenital myotonia	4180186
37118000	Difference in percentage concentration (property) (qualifier value)	4180186
37118000	Difference in percentage concentration (property)	4180186
37118001	Mitral valve orifice appearance (observable entity)	4180186
37118003	Entire reticular corium (body structure)	4180186
37118004	Entire duodenal serosa (body structure)	4180186
37118011	Partial trisomy of short arm of chromosome 1 (disorder)	4180186
37118011	Duplication of short arm of chromosome 1	4180186
37118015	Deletion of part of chromosome 12 (disorder)	4180186
37118016	Deletion of part of chromosome 19 (disorder)	4180186
37118017	Myokymia of eyelid (finding)	4180186
37118018	Prosthetic unicompartmental arthroplasty of right knee (procedure)	4180186
37118019	Radical mastectomy of left breast (procedure)	4180186
37118021	ThinPrep cytology technique (qualifier value)	4180186
37118027	Structure of periorbital region of right eye (body structure)	4180186
37118031	Immature granulocyte (cell)	4180186
37118032	Arthrogryposis hyperkeratosis syndrome lethal form (disorder)	4180186
37118032	Johnston Aarons Schelley syndrome	4180186
37118033	Scalp defect postaxial polydactyly syndrome (disorder)	4180186
37118034	Amputation of bilateral great toes (procedure)	4180186
37118035	Structure of thoracic trachea (body structure)	4180186
37118038	Surgical instrument torque limiter override device (physical object)	4180186
37118039	Monosomy 3q13	4180186
37118039	3q13 microdeletion syndrome (disorder)	4180186
37118040	Entire Healey and Schroy left liver segment (body structure)	4180186
37118042	Entire premarginal recess of Eisler (body structure)	4180186
37118042	Entire Premarginal recess of Eisler (body structure)	4180186
37118043	Entire C4 vertebral foramen (body structure)	4180186
37118044	Entire T3 vertebral foramen (body structure)	4180186
37118046	Entire L2 vertebral foramen (body structure)	4180186
37118050	Entire 6/7 interchondral joint (body structure)	4180186
37118053	Entire medial border of sole (body structure)	4180186
37118054	Entire thenar and hypothenar spaces (body structure)	4180186
37118059	Entire second cuneiform facet of navicular bone of foot (body structure)	4180186
37118061	Entire interlobular bile duct (body structure)	4180186
37118063	Entire flexor tendon of foot (body structure)	4180186
37118063	Entire flexor tendon within foot	4180186
37118063	Entire flexor tendon within foot (body structure)	4180186
37118064	Entire pelvic and leg veins (body structure)	4180186
37118067	Entire male bladder neck (body structure)	4180186
37118069	Entire conjunctival zone (body structure)	4180186
37118075	Entire medial hypothalamic nucleus (body structure)	4180186
37118076	Entire tributary of internal jugular vein (body structure)	4180186
37118077	Entire articular facet of clavicle (body structure)	4180186
37118080	Entire cuneiform facet of intermediate cuneiform (body structure)	4180186
37118081	Entire metatarsal facet of lateral cuneiform (body structure)	4180186
37118082	Entire process of maxilla (body structure)	4180186
37118085	Entire articular surface of lower limb bone (body structure)	4180186
37118086	Entire umbilical vein (body structure)	4180186
37118091	Krill oil (substance)	4180186
37118092	Chicory (substance)	4180186
37118098	Entire third of oesophagus	4180186
37118098	Entire third of esophagus (body structure)	4180186
37118100	Entire posterior upper third of oesophagus	4180186
37118100	Entire posterior upper third of esophagus (body structure)	4180186
37118102	Entire blood vessel of head of foetus	4180186
37118102	Entire blood vessel of head of fetus (body structure)	4180186
37118105	Entire external capsule of brain (body structure)	4180186
37118109	Entire vagus nerve nodose ganglion (body structure)	4180186
37118109	Entire inferior vagus ganglion	4180186
37118110	Entire dorsal metatarsal ligament (body structure)	4180186
37118111	Entire muscle of hip and thigh	4180186
37118111	Entire skeletal muscle of hip and thigh (body structure)	4180186
37118114	Entire mucocutaneous junction of upper lip (body structure)	4180186
37118116	Entire anagen hair (body structure)	4180186
37118117	Entire lamina of sixth lumbar vertebra (body structure)	4180186
37118118	Entire annulus fibrosus of intervertebral disc of sixth lumbar vertebra (body structure)	4180186
37118118	Entire anulus fibrosus of intervertebral disc of sixth lumbar vertebra	4180186
37118120	Entire endothelium (body structure)	4180186
37118121	Entire capsule of tibial astragaloid joint (body structure)	4180186
37118123	Entire inferior gemellus muscle (body structure)	4180186
37118124	Entire muscularis of bronchus (body structure)	4180186
37118125	Entire oblique fiber of gastric muscularis (body structure)	4180186
37118125	Entire oblique fiber of gastric muscularis	4180186
37118125	Entire oblique fibre of gastric muscularis	4180186
37118125	Entire oblique fibers of gastric muscularis (body structure)	4180186
37118125	Entire oblique fibres of gastric muscularis	4180186
37118128	Entire eccrine intraepidermal duct (body structure)	4180186
37118135	Entire lower respiratory spaces (body structure)	4180186
37118136	Entire medulla oblongata dorsal spinothalamic tract (body structure)	4180186
37118138	Entire posterior wall of anal canal (body structure)	4180186
37118140	Entire second lumbar artery (body structure)	4180186
37118144	Entire clinoid portion of internal carotid artery (body structure)	4180186
37118147	Entire body of third sacral vertebra (body structure)	4180186
37118148	Entire body of fifth sacral vertebra (body structure)	4180186
37118150	Entire ossification center of head of fifth metacarpal (body structure)	4180186
37118150	Entire ossification centre of head of fifth metacarpal	4180186
37118151	Entire tributary of superior mesenteric vein (body structure)	4180186
37118152	Entire ossification center of third metatarsal head (body structure)	4180186
37118152	Entire ossification centre of third metatarsal head	4180186
37118154	Entire ossification centre of second metatarsal head	4180186
37118154	Entire ossification center of second metatarsal head (body structure)	4180186
37118155	Entire tributary of femoral vein (body structure)	4180186
37118156	Entire ossification center of base of first metacarpal (body structure)	4180186
37118156	Entire ossification centre of base of first metacarpal	4180186
37118157	Entire apocrine sweat gland bearing skin of vulva (body structure)	4180186
37118160	Entire apocrine sweat gland bearing skin of periumbilical area (body structure)	4180186
37118163	Entire apocrine sweat gland bearing skin (body structure)	4180186
37118164	Entire tributary of azygous vein (body structure)	4180186
37118165	Entire tributary of inferior petrosal sinus (body structure)	4180186
37118166	Entire surface of bone (body structure)	4180186
37118168	Entire maxillary incisor tooth (body structure)	4180186
37118169	Entire common right pulmonary vein (body structure)	4180186
37118170	Entire subpial space of brain (body structure)	4180186
37118171	Entire sural nerve in calf (body structure)	4180186
37118172	Entire branch of vestibulocochlear nerve (body structure)	4180186
37118173	Entire common peroneal nerve in popliteal region (body structure)	4180186
37118177	Entire back of upper thoracic region (body structure)	4180186
37118179	Entire upper chest wall (body structure)	4180186
37118182	Entire accessory lateral collateral ligament of elbow (body structure)	4180186
37118186	Entire epiphyseal plate of fibula (body structure)	4180186
37118188	Entire lateral femoral intermuscular septum (body structure)	4180186
37118189	Entire medulla oblongata internal arcuate fibre	4180186
37118189	Entire medulla oblongata internal arcuate fiber	4180186
37118189	Entire medulla oblongata internal arcuate fiber (body structure)	4180186
37118189	Entire medulla oblongata internal arcuate fibres	4180186
37118189	Entire medulla oblongata internal arcuate fibers (body structure)	4180186
37118191	Entire medullary cavity of bone (body structure)	4180186
37118193	Entire cranial articular process of sixth lumbar vertebra (body structure)	4180186
37118194	Entire lateral pterygoid nerve (body structure)	4180186
37118196	Entire internal nasal branches of anterior ethmoidal nerve (body structure)	4180186
37118197	Entire head of mandible (body structure)	4180186
37118199	Entire small intestinal crypt of Lieberkühn (body structure)	4180186
37118202	Entire gingival lamina propria (body structure)	4180186
37118203	Entire muscularis of gallbladder (body structure)	4180186
37118205	Entire rectal solitary lymphoid follicle (body structure)	4180186
37118207	Entire retinacula cutis (body structure)	4180186
37118208	Entire mucous connective tissue (body structure)	4180186
37118209	Entire tunica media vasorum (body structure)	4180186
37118210	Entire skin of vertex (body structure)	4180186
37118212	Entire peritendineum (body structure)	4180186
37118214	Entire apophysis (body structure)	4180186
37118216	Entire lumen of artery (body structure)	4180186
37118217	Entire superficial intraparotid lymph node (body structure)	4180186
37118219	Entire crista triangularis of tooth (body structure)	4180186
37118220	Entire epithelial layer of tympanic membrane (body structure)	4180186
37118221	Entire long ciliary nerves (body structure)	4180186
37118224	Entire communicating ramus with tympanic plexus (body structure)	4180186
37118228	Entire facial nerve zygomatic branch (body structure)	4180186
37118229	Entire extracellular space of nervous system (body structure)	4180186
37118230	Entire lamina propria of frontal sinus (body structure)	4180186
37118231	Entire sublingual caruncle (body structure)	4180186
37118232	Entire accessory renal artery (body structure)	4180186
37118234	Entire soft tissue (body structure)	4180186
37118234	Entire soft tissue	4180186
37118234	Entire soft tissues (body structure)	4180186
37118236	Entire space of Mall (body structure)	4180186
37118239	Entire wall of cerebral artery (body structure)	4180186
37118241	Entire endocardium of truncal valve (body structure)	4180186
37118243	All bone marrow of radius and ulna (body structure)	4180186
37118244	All bone marrow of pelvis (body structure)	4180186
37118245	All bone marrow of upper limb (body structure)	4180186
37118246	All bone marrow of cervical vertebra (body structure)	4180186
37118248	All bone marrow of knee (body structure)	4180186
37118249	All bone marrow of nasal-orbit complex (body structure)	4180186
37118251	Entire skin and mucosa of anus (body structure)	4180186
37118252	Entire intervertebral disc of L5 and S1 (body structure)	4180186
37118253	Entire posterior section of prostate (body structure)	4180186
37118255	Entire T10 vertebra	4180186
37118255	Entire bone of T10 (body structure)	4180186
37118256	Entire L2 vertebra	4180186
37118256	Entire bone of L2 (body structure)	4180186
37118257	Entire bone of hamate (body structure)	4180186
37118261	Entire T7 vertebra	4180186
37118261	Entire bone of T7 (body structure)	4180186
37118262	Entire bone of pubis (body structure)	4180186
37118273	Entire musculoskeletal system of cervical spine (body structure)	4180186
37118274	Entire bone of radius and ulna (body structure)	4180186
37118275	Entire blood vessel of pancreas (body structure)	4180186
37118276	Entire blood vessel of ovary (body structure)	4180186
37118277	Entire blood vessel of cervical spine (body structure)	4180186
37118279	Entire bone of proximal tibia and fibula (body structure)	4180186
37118280	Entire periarticular bone of hip joint (body structure)	4180186
37118282	Entire bone of posterior cranial fossa (body structure)	4180186
37118283	Entire blood vessel of internal nose (body structure)	4180186
37118284	Entire blood vessel of intestine (body structure)	4180186
37118285	Entire synovial membrane of wrist region	4180186
37118285	Entire synovial membrane of wrist region (body structure)	4180186
37118285	Entire synovial membrane of wrist (body structure)	4180186
37118286	Entire synovial membrane of shoulder region (body structure)	4180186
37118287	Angiography of arteries of left lower limb (procedure)	4180186
37118288	Computed tomography of right hand with contrast	4180186
37118288	Computed tomography of right hand with contrast (procedure)	4180186
37118289	Biopsy of left kidney using fluoroscopic guidance	4180186
37118289	Biopsy of left kidney using fluoroscopic guidance (procedure)	4180186
37118290	Entire crista transversalis of tooth (body structure)	4180186
37118293	Entire muscle tissue (body structure)	4180186
37118294	Entire lumen of vein (body structure)	4180186
37118295	Entire anatomical region of continuity (body structure)	4180186
37118296	Entire buccal embrasure (body structure)	4180186
37118297	Entire dorsal skin of penis (body structure)	4180186
37118299	Entire lower outer quadrant of male breast (body structure)	4180186
37118301	Entire lenticulostriate artery (body structure)	4180186
37118303	Entire tooth furcation (body structure)	4180186
37118305	Entire retrocuspid papilla (body structure)	4180186
37118307	Entire ventral primary division of four upper cervical nerves (body structure)	4180186
37118308	Entire cavernous autonomic plexus	4180186
37118308	Entire cavernous autonomic plexus (body structure)	4180186
37118308	Entire cavernous plexus	4180186
37118309	Entire rhomboideus capitis muscle (body structure)	4180186
37118311	Entire lower parasternal region (body structure)	4180186
37118314	Entire extracellular substance of eye (body structure)	4180186
37118315	Entire triangular fibrocartilage complex of wrist region	4180186
37118315	Entire triangular fibrocartilage complex of wrist region (body structure)	4180186
37118315	Entire triangular fibrocartilage complex of wrist (body structure)	4180186
37118318	Entire posterior process of distal tibia (body structure)	4180186
37118319	Entire lesser curvature of body of stomach (body structure)	4180186
37118322	Entire undescended testis (body structure)	4180186
37118323	Entire superior mediastinal lymph node (body structure)	4180186
37118324	Entire lower paratracheal lymph node, superior group (body structure)	4180186
37118326	Entire lingual thyroid (body structure)	4180186
37118327	Entire nodes of Kent (body structure)	4180186
37118328	Entire middle fossa meninges (body structure)	4180186
37118329	Entire spinal nerve root C2 (body structure)	4180186
37118330	Entire spinal nerve root C7 (body structure)	4180186
37118331	Entire spinal nerve root T3 (body structure)	4180186
37118332	Entire spinal nerve root T8 (body structure)	4180186
37118333	Entire spinal nerve root L1 (body structure)	4180186
37118335	Entire radial nerve in upper arm (body structure)	4180186
37118336	Entire ulnar nerve, dorsal sensory branch	4180186
37118336	Entire dorsal sensory branch of ulnar nerve (body structure)	4180186
37118338	Entire bone of trunk (body structure)	4180186
37118342	Entire vein of spleen (body structure)	4180186
37118343	Entire soft tissue of ankle (body structure)	4180186
37118345	Entire skin of eyelid and periocular area (body structure)	4180186
37118346	Entire fascia of lower leg compartment (body structure)	4180186
37118347	Entire skin and subcutaneous tissue of buttock (body structure)	4180186
37118348	Entire skin and subcutaneous tissue of perineum (body structure)	4180186
37118349	Entire skin and subcutaneous tissue of upper arm (body structure)	4180186
37118350	Entire skin and subcutaneous tissue of hip (body structure)	4180186
37118352	Entire bone of malleus (body structure)	4180186
37118353	Entire blood vessel of stomach (body structure)	4180186
37118357	Entire skin of lower abdomen (body structure)	4180186
37118358	Entire skin of posterior superior iliac crest region of back (body structure)	4180186
37118359	Entire skin of upper thigh region (body structure)	4180186
37118364	Entire hypothenar region (body structure)	4180186
37118365	Entire supreme nasal turbinate bone (body structure)	4180186
37118366	Entire tibial vein (body structure)	4180186
37118368	Entire prostatic connective tissue (body structure)	4180186
37118370	Entire vitellointestinal structure (body structure)	4180186
37118378	Entire embryonic gut (body structure)	4180186
37118381	Entire regional musculoskeletal system (body structure)	4180186
37118383	Entire colon wall (body structure)	4180186
37118384	Entire bony semicircular canal (body structure)	4180186
37118391	Entire digital nerve in thumb (body structure)	4180186
37118392	Entire plantar digital nerve (body structure)	4180186
37118395	Entire thyroglossal tract (body structure)	4180186
37118396	Entire artery of circle of Willis (body structure)	4180186
37118397	Entire superficial femoral artery (body structure)	4180186
37118400	Entire skin of anterior surface of elbow (body structure)	4180186
37118404	Entire tendon of peroneus brevis (body structure)	4180186
37118405	Entire lymphatic tissue (body structure)	4180186
37118406	Entire fascia of shoulder girdle (body structure)	4180186
37118408	Entire fascia of leg peroneal compartment (body structure)	4180186
37118408	Entire fascia of peroneal compartment of lower leg	4180186
37118408	Entire fascia of peroneal compartment of lower leg (body structure)	4180186
37118409	Entire complex of bones of floor of orbit (body structure)	4180186
37118409	Entire complex of bones of floor of orbit	4180186
37118409	Entire orbital complex of bones - floor (body structure)	4180186
37118411	Entire anatomical neck of humerus (body structure)	4180186
37118414	Entire shaft of distal phalanx of finger (body structure)	4180186
37118416	Entire medial border of patella (body structure)	4180186
37118418	Entire carpometacarpal joint of ring finger (body structure)	4180186
37118420	Entire dorsal aspect of wrist region (body structure)	4180186
37118420	Entire dorsal aspect of wrist region	4180186
37118420	Entire dorsal aspect of wrist (body structure)	4180186
37118421	Entire posterior aspect of ankle (body structure)	4180186
37118422	Entire supraumbilical region (body structure)	4180186
37118423	Entire cervical region of posterior longitudinal ligament (body structure)	4180186
37118430	Entire collateral ligament of distal interphalangeal joint of ring finger (body structure)	4180186
37118432	Entire collateral ligament of interphalangeal joint of third toe (body structure)	4180186
37118433	Entire systemic collateral artery to lung (body structure)	4180186
37118434	Entire supracolic region (body structure)	4180186
37118435	Entire retrocecal space (body structure)	4180186
37118435	Entire retrocaecal space	4180186
37118437	Entire skin of side of nose (body structure)	4180186
37118439	Entire sternal skin (body structure)	4180186
37118441	Entire microscopic pancreatic duct (body structure)	4180186
37118443	Entire orbital fat (body structure)	4180186
37118444	Entire perianal region (body structure)	4180186
37118446	Entire infraorbital foramen (body structure)	4180186
37118447	Entire paratesticular structure (body structure)	4180186
37118449	Entire temple region (body structure)	4180186
37118450	Entire triceps surae muscle and tendon (body structure)	4180186
37118451	Entire semitendinosus muscle and tendon (body structure)	4180186
37118452	Entire gastrocnemius muscle and tendon (body structure)	4180186
37118453	Entire subscapularis muscle and tendon (body structure)	4180186
37118454	Measles virus genotype E (organism)	4180186
37118455	Amputation of right lower limb (procedure)	4180186
37118458	Immunoglobulin E antibody to Mangifera indica pollen (substance)	4180186
37118458	Anti-Mangifera indica pollen IgE	4180186
37118458	Immunoglobulin E antibody to Mangifera indica pollen	4180186
37118459	Cell positive for CD154 antigen (cell)	4180186
37118459	Cell positive for CD154 antigen	4180186
37118460	Population of all round cells in portion of fluid (body structure)	4180186
37118461	0.0025 (qualifier value)	4180186
37118461	Zero point zero zero two five	4180186
37118466	Zero point one zero five	4180186
37118466	0.105 (qualifier value)	4180186
37118467	0.14 (qualifier value)	4180186
37118467	Zero point one four	4180186
37118470	0.63 (qualifier value)	4180186
37118470	Zero point six three	4180186
37118472	0.82 (qualifier value)	4180186
37118472	Zero point eight two	4180186
37118473	Zero point nine three	4180186
37118473	0.93 (qualifier value)	4180186
37118474	1.3 (qualifier value)	4180186
37118474	One point three	4180186
37118476	One point eight seven five	4180186
37118476	1.875 (qualifier value)	4180186
37118478	One thousand fifty	4180186
37118478	1050 (qualifier value)	4180186
37118479	One thousand one hundred	4180186
37118479	1100 (qualifier value)	4180186
37118483	One hundred and forty-one	4180186
37118483	141 (qualifier value)	4180186
37118485	Sixteen	4180186
37118485	16 (qualifier value)	4180186
37118487	1680 (qualifier value)	4180186
37118487	One thousand six hundred and eighty	4180186
37118488	1720 (qualifier value)	4180186
37118488	One thousand seven hundred and twenty	4180186
37118489	18.5 (qualifier value)	4180186
37118489	Eighteen point five	4180186
37118490	Entire skin over acromion (body structure)	4180186
37118493	Entire skin of medial border of hand (body structure)	4180186
37118498	Entire branch of maxillary artery (body structure)	4180186
37118503	Entire crural artery (body structure)	4180186
37118508	Entire cerebellar meninges (body structure)	4180186
37118509	Entire cervical subdural space (body structure)	4180186
37118511	Entire ulnar digital nerve of index finger (body structure)	4180186
37118512	Entire radial digital nerve of index finger (body structure)	4180186
37118514	Entire plantar digital nerve of third web space (body structure)	4180186
37118518	Entire lateral compartment of knee (body structure)	4180186
