concept_id	concept_synonym_name	language_concept_id
4080865	Lobular carcinoma of breast	4180186
4080868	Tenderness in vaginal fornix (finding)	4180186
4080872	Flat sacral curve (finding)	4180186
4080873	Length of cervix in labour	4180186
4080873	Length of cervix in labor (observable entity)	4180186
4080874	Deflexed foetal head	4180186
4080874	Deflexed fetal head (finding)	4180186
4080875	Jewelry ring (physical object)	4180186
4080875	Jewellery ring	4180186
4080876	Ring pattern (qualifier value)	4180186
4080877	Radiology techniques	4180186
4080877	Radiographic imaging	4180186
4080877	Radiographic imaging - action (qualifier value)	4180186
4080878	Congenital non-A non-B hepatitis infection (disorder)	4180186
4080881	Neonatal bacterial dacryocystitis (disorder)	4180186
4080882	Neonatal viral dacryocystitis (disorder)	4180186
4080882	Neonatal dacryocystitis due to virus	4180186
4080884	Harlequin change (disorder)	4180186
4080887	Neonatal rickets (disorder)	4180186
4080889	Normal birth weight (finding)	4180186
4080892	Intracerebellar and posterior fossa hemorrhage (disorder)	4180186
4080892	Intracerebellar and posterior fossa haemorrhage	4180186
4080893	Microbiology subtype (qualifier value)	4180186
4080893	Microbiology subtypes	4180186
4080894	Null (qualifier value)	4180186
4080895	Cystic dermoid choristoma of brain	4180186
4080895	Cystic dermoid choristoma of brain (disorder)	4180186
4080897	Septic shock associated with other non-bacterial microorganism (disorder)	4180186
4080898	Sepsis-associated myocardial dysfunction (disorder)	4180186
4080900	Histology tonsillectomy (procedure)	4180186
4080901	Amelanotic melanoma	4180186
4080901	Amelanotic malignant melanoma of skin (disorder)	4180186
4080903	SVC - Superior vena cava oxygen saturation	4180186
4080903	Superior vena cava oxygen saturation	4180186
4080903	Superior vena cava oxygen saturation measurement (procedure)	4180186
4080904	Wedge pressure - a wave (observable entity)	4180186
4080909	Wig friction (disorder)	4180186
4080910	Eosinophilic granuloma of bone (disorder)	4180186
4080910	Langerhans cell histiocytosis, unifocal, bone	4180186
4080911	Toboggan dermatitis (disorder)	4180186
4080913	Amputation-related dermatosis (disorder)	4180186
4080914	Entire navicular calcaneal articular surface of talus (body structure)	4180186
4080915	Hair sinus of breast (disorder)	4180186
4080920	Phytophlyctodermatitis	4180186
4080920	Meadow grass dermatitis	4180186
4080920	Phytophotodermatitis caused by topical exposure to furocoumarin	4180186
4080920	Plant photodermatitis	4180186
4080920	Meadow dermatitis	4180186
4080920	Phytophotodermatitis (disorder)	4180186
4080920	Dermatitis bullosa et striata pratensis	4180186
4080925	Cactus dermatitis (disorder)	4180186
4080927	Erythrodermic atopic eczema	4180186
4080927	Erythrodermic atopic dermatitis (disorder)	4180186
4080929	Pruriginous atopic dermatitis (disorder)	4180186
4080929	Pruriginous atopic eczema	4180186
4080933	Psoriasiform eczema (disorder)	4180186
4080934	Truncal seborrheic dermatitis (disorder)	4180186
4080934	Truncal seborrhoeic eczema	4180186
4080934	Truncal seborrhoeic dermatitis	4180186
4080934	Truncal seborrheic eczema	4180186
4080937	Chronic prurigo (disorder)	4180186
4080940	Phenolsulfonphthalein (substance)	4180186
4080940	Phenolsulphonphthalein	4180186
4080941	Generalized pustular psoriasis of pregnancy (disorder)	4180186
4080941	Generalised pustular psoriasis of pregnancy	4180186
4080944	Keratosis follicularis spinulosa decalvans	4180186
4080944	Keratosis pilaris decalvans (disorder)	4180186
4080945	Giant porokeratosis (disorder)	4180186
4080947	Disseminated spiked hyperkeratoses	4180186
4080947	Multiple minute digitate hyperkeratosis of Goldstein (disorder)	4180186
4080949	Injection of pericardial sac for local action (procedure)	4180186
4080953	Ultraviolet lesion destruction (procedure)	4180186
4080955	Eutrophic muscle stimulation (procedure)	4180186
4080956	Other physical agent therapy NOS (regime/therapy)	4180186
4080957	Endotracheal respiratory assistance (procedure)	4180186
4080958	Operative resuscitation NEC (procedure)	4180186
4080959	Lung collapse therapy (procedure)	4180186
4080964	Asthma control step 2 (procedure)	4180186
4080967	Arteriovenous cannulation for blood treatment (procedure)	4180186
4080969	Extracorporeal blood NOS (procedure)	4180186
4080970	Indirect blood exchange NOS (procedure)	4180186
4080973	Consent to donate organs given (finding)	4180186
4080978	Chlamydia psittaci var. ovis	4180186
4080978	Chlamydophila psittaci variant ovis (organism)	4180186
4080978	Chlamydophila psittaci var. ovis	4180186
4080979	Fibrinogen degradation product screening (procedure)	4180186
4080980	Monitoring of patient NOS (regime/therapy)	4180186
4080982	Emergency treatment NOS (procedure)	4180186
4080983	Drug prescription (situation)	4180186
4080984	Replacement therapy (situation)	4180186
4080987	Drugs not issued (finding)	4180186
4080991	Palpebral conjunctiva - giant follicles (finding)	4180186
4080993	Corneal observation	4180186
4080993	Cornea finding	4180186
4080993	Corneal finding (finding)	4180186
4081000	Coats' white ring (finding)	4180186
4081002	Haab's striae	4180186
4081002	Tears in Descemet's membrane (finding)	4180186
4081002	Tears in Descemet membrane	4180186
4081004	Scleral icterus (finding)	4180186
4081004	Yellow sclera	4180186
4081007	Anterior chamber observation	4180186
4081007	Anterior chamber finding (finding)	4180186
4081007	AC - Anterior chamber observation	4180186
4081008	Evenly shallow anterior chamber of eye (finding)	4180186
4081010	Anterior chamber flare (finding)	4180186
4081011	Anterior chamber cells (finding)	4180186
4081012	Entire periadrenal tissue (body structure)	4180186
4081015	Anterior chamber - abnormal contents (finding)	4180186
4081017	Saturated aliphatic hydrocarbon (substance)	4180186
4081017	Aliphatic saturated hydrocarbon	4180186
4081020	Six-plumed bird of paradise (organism)	4180186
4081022	Vascular tufts at pupil margin (finding)	4180186
4081023	Holth iridencleisis (procedure)	4180186
4081025	Displacement of ciliary body (finding)	4180186
4081027	Nuclear lens opacities (finding)	4180186
4081028	Posterior subcapsular lens opacities (finding)	4180186
4081028	PSCLO - Posterior subcapsular lens opacities	4180186
4081030	Right ventricular systolic pressure (observable entity)	4180186
4081033	Right atrial pressure - x trough (observable entity)	4180186
4081034	Left ventricular end-diastolic pressure (observable entity)	4180186
4081034	LVEDP - Left ventricular end-diastolic pressure	4180186
4081037	Isolated aortic stenosis (disorder)	4180186
4081038	Pulmonary hypertension with extreme obesity (disorder)	4180186
4081040	Facultative pulmonary hypertension with shunt at atrial level (disorder)	4180186
4081042	Benign neoplasm of fibrous tissue of skin (disorder)	4180186
4081042	Benign tumor of fibrous tissue	4180186
4081042	Benign tumour of fibrous tissue	4180186
4081043	Adenocarcinoma of oesophagus	4180186
4081043	Adenocarcinoma of esophagus (disorder)	4180186
4081044	Squamous cell carcinoma of esophagus (disorder)	4180186
4081044	Squamous cell carcinoma of oesophagus	4180186
4081044	SCC - Squamous cell carcinoma of oesophagus	4180186
4081044	SCC - Squamous cell carcinoma of esophagus	4180186
4081045	Stoma material (attribute)	4180186
4081046	Type of specimen (attribute)	4180186
4081052	Intraduct papilloma of pancreas (disorder)	4180186
4081053	Papillary tumour of ampulla of Vater	4180186
4081053	Papillary tumor of ampulla of Vater (disorder)	4180186
4081055	Benign tumour of pelviureteric junction	4180186
4081055	Benign tumor of pelviureteric junction (disorder)	4180186
4081058	Core periphery body temperature gradient (finding)	4180186
4081058	Core peripheral temperature gap	4180186
4081060	Percutaneous balloon angioplasty of pulmonary venous pathway (procedure)	4180186
4081060	Percutaneous angioplasty of pulmonary venous pathway	4180186
4081061	SVRI - Systemic vascular resistance index	4180186
4081061	Systemic vascular resistance index (observable entity)	4180186
4081063	Pityriasis rotunda (disorder)	4180186
4081064	Bazex syndrome	4180186
4081064	Acrokeratosis paraneoplastica of Bazex (disorder)	4180186
4081064	Bazex syndrome - acquired keratoderma	4180186
4081065	Acquired follicular keratosis	4180186
4081065	Acquired keratosis follicularis (disorder)	4180186
4081066	Site-specific lichen planus (disorder)	4180186
4081067	Lichen planus of tongue (disorder)	4180186
4081068	Lichen planus of lips (disorder)	4180186
4081070	Granuloma multiforme (disorder)	4180186
4081071	Erythema fugax (disorder)	4180186
4081073	Vibratory angio-oedema	4180186
4081073	Vibratory angioedema (disorder)	4180186
4081074	Water-induced itching	4180186
4081074	Aquagenic pruritus (disorder)	4180186
4081075	Immune complex urticaria (disorder)	4180186
4081080	Eruptive lentiginosis (disorder)	4180186
4081081	Occupational hypomelanosis	4180186
4081081	Occupational vitiligo (disorder)	4180186
4081084	Involutional alopecia (disorder)	4180186
4081086	Disturbance of hair cycle (disorder)	4180186
4081087	Loose anagen hair syndrome (disorder)	4180186
4081088	Benign seborrhoeic hyperplasia	4180186
4081088	Sebaceous gland hyperplasia	4180186
4081088	Sebaceous hyperplasia (finding)	4180186
4081088	Benign seborrheic hyperplasia	4180186
4081089	Rosaceal flushing (disorder)	4180186
4081090	Disorder of apocrine gland (disorder)	4180186
4081091	Neutrophilic eccrine hidradenitis (disorder)	4180186
4081095	Solar telangiectasia (disorder)	4180186
4081097	Thread veins (disorder)	4180186
4081098	Gougerot-Ruiter vasculitis	4180186
4081098	Gougerot-Ruiter purpura (disorder)	4180186
4081102	Normal variation in translucency (finding)	4180186
4081103	Excision of lesion from joint of spine (procedure)	4180186
4081104	Biers spots (disorder)	4180186
4081105	Drug not issued NOS (finding)	4180186
4081106	Drug not taken - dislike form (situation)	4180186
4081107	Drug not taken - pat disbelief (situation)	4180186
4081109	Treatment stopped - patient unable to concentrate (situation)	4180186
4081114	Drug declined by patient - inconvenient (situation)	4180186
4081116	Drug declined by patient - patient beliefs (situation)	4180186
4081117	Drug declined by patient - cannot pay script (situation)	4180186
4081117	Drug declined by patient - cannot pay script	4180186
4081121	Administration of iodised salt	4180186
4081121	Administration of iodized salt	4180186
4081121	Administration of iodized salt (procedure)	4180186
4081121	Use of iodized salt (procedure)	4180186
4081121	Use of iodised salt	4180186
4081123	Anti-D globulin NOS (procedure)	4180186
4081125	Low salt diet - prophylaxis (regime/therapy)	4180186
4081126	Low protein diet - prophylaxis (regime/therapy)	4180186
4081127	Adrenal cortical adenoma, no International Classification of Diseases for Oncology subtype	4180186
4081127	Adrenal cortical adenoma, no International Classification of Diseases for Oncology subtype (morphologic abnormality)	4180186
4081127	Adrenal cortical adenoma, no ICD-O subtype	4180186
4081128	Chemotherapy follow-up (procedure)	4180186
4081130	Removed from waiting list (finding)	4180186
4081131	Discharged from hospital care NOS (finding)	4180186
4081132	Referred - other care (finding)	4180186
4081133	General surgical self-referral (procedure)	4180186
4081134	Rheumatology self-referral (procedure)	4180186
4081136	Domiciliary visit requested (finding)	4180186
4081137	Cardiology domiciliary visit requested (finding)	4180186
4081138	Neurology domiciliary visit requested (finding)	4180186
4081138	Neurology D.V. requested	4180186
4081140	Plastic surgery D.V. requested	4180186
4081140	Plastic surgery domiciliary visit requested (finding)	4180186
4081144	Spontaneous reabsorption of cataract (finding)	4180186
4081145	Lens capsule clear in pseudophakia (finding)	4180186
4081146	Lens capsule opacity in pseudophakia (finding)	4180186
4081149	Vitreous incarceration (finding)	4180186
4081151	Vitreous syneresis (finding)	4180186
4081153	Preretinal and epiretinal observation	4180186
4081153	Preretinal and epiretinal finding (finding)	4180186
4081153	Interface of vitreous and retina observation	4180186
4081155	Blood group antibody Pr^a^	4180186
4081155	Blood group antibody Pr<sup>a</sup>	4180186
4081155	Blood group antibody Pritchard	4180186
4081155	Blood group antibody Pr^a^ (substance)	4180186
4081155	Blood group antibody Pr a	4180186
4081156	Optic fundus observation	4180186
4081156	Retina and choroid finding (finding)	4180186
4081156	Retina and choroid observation	4180186
4081157	Infiltration of retina (finding)	4180186
4081158	Insertion of atrial septal umbrella (procedure)	4180186
4081159	Fit - had one, symptom (situation)	4180186
4081160	Rolandic march	4180186
4081160	Simple partial seizure with focal motor signs with march (disorder)	4180186
4081160	Jacksonian seizure	4180186
4081161	Simple partial seizure followed by impaired consciousness (disorder)	4180186
4081162	Complex partial seizure with impairment of consciousness only	4180186
4081162	Complex part seizure with impairment of consciousness only (disorder)	4180186
4081163	History and physical examination, emergency preliminary evaluation (procedure)	4180186
4081168	Cranial nerve reflex (observable entity)	4180186
4081168	Cranial nerve reflexes	4180186
4081170	Radial reflex	4180186
4081170	Supinator reflex (observable entity)	4180186
4081171	Equivocal plantar response (finding)	4180186
4081173	Spinal nerve root finding (finding)	4180186
4081173	Spinal nerve root observation	4180186
4081175	Able to sit up straight with flexed hip and extended knee (finding)	4180186
4081177	Median nerve observation	4180186
4081177	Median nerve finding (finding)	4180186
4081178	Median nerve entrapment (disorder)	4180186
4081179	Transurethral relief of prostatic obstruction without resection or incision (procedure)	4180186
4081183	Structure of para-aortic region	4180186
4081183	Structure of para-aortic region (body structure)	4180186
4081183	Para-aortic region (body structure)	4180186
4081185	Percutaneous endarterectomy of renal artery (procedure)	4180186
4081187	Percutaneous endarterectomy of superficial femoral artery (procedure)	4180186
4081188	Percutaneous endarterectomy of crural artery (procedure)	4180186
4081191	Odontogenic tumour of jaw	4180186
4081191	Odontogenic tumor of jaw (disorder)	4180186
4081192	Percentage of total failed (qualifier value)	4180186
4081192	% of total failed	4180186
4081192	percent of total failed	4180186
4081193	Percutaneous embolectomy of intracranial artery (procedure)	4180186
4081195	Percutaneous embolectomy of arteriovenous fistula (procedure)	4180186
4081196	Antepartum (qualifier value)	4180186
4081197	Intrapartum (qualifier value)	4180186
4081198	Pattern visual evoked potential component (observable entity)	4180186
4081199	Visual evoked potential symmetry (observable entity)	4180186
4081202	Mixed rod and cone defect (finding)	4180186
4081204	Kiel non-Hodgkin's lymphoma classification	4180186
4081204	Kiel classification (qualifier value)	4180186
4081206	Focal motor nerve conduction slowing (finding)	4180186
4081208	No post-activation response (finding)	4180186
4081211	Type of fixator (attribute)	4180186
4081212	Type of cement (attribute)	4180186
4081213	Class (attribute)	4180186
4081215	Twin block orthodontic appliance (physical object)	4180186
4081216	FR3 - Frankel 3 orthodontic appliance	4180186
4081216	Frankel 3 orthodontic appliance (physical object)	4180186
4081218	Vacuum formed orthodontic retainer (physical object)	4180186
4081219	Neuritis AND/OR radiculitis due to rupture of lumbar intervertebral disc (disorder)	4180186
4081223	Methadone hydrochloride (substance)	4180186
4081226	Atrophia maculosa varioliformis cutis	4180186
4081226	Varioliform atrophy	4180186
4081226	Atrophic scarring of cheeks (disorder)	4180186
4081229	Fibrotic disorder of skin (disorder)	4180186
4081233	Acquired colloid milium (disorder)	4180186
4081235	Cascara	4180186
4081235	Product containing cascara (medicinal product)	4180186
4081236	Fat necrosis (disorder)	4180186
4081244	Madelung neck	4180186
4081244	LMS - Multiple symmetrical lipomatosis	4180186
4081244	Launois Bensaude lipomatosis	4180186
4081244	Multiple symmetrical lipomatosis (disorder)	4180186
4081244	Madelung disease	4180186
4081246	Skin disorder of breast (disorder)	4180186
4081247	Sebocystoma of scrotum (disorder)	4180186
4081248	Chronic discoid lupus erythematosus (disorder)	4180186
4081248	CDLE - Chronic discoid lupus erythematosus	4180186
4081251	Prebullous pemphigoid (disorder)	4180186
4081253	Eosinophilic spongiosis (disorder)	4180186
4081254	REM syndrome	4180186
4081254	Plaque-like mucinosis	4180186
4081254	REM - Reticular erythematous mucinosis	4180186
4081254	Reticular erythematous mucinosis (disorder)	4180186
4081256	Disorders of cutaneous image and perception (disorder)	4180186
4081259	Classical histoplasmosis intestinal ulceration (disorder)	4180186
4081262	Chest medicine domiciliary visit done (finding)	4180186
4081262	Thoracic medicine domiciliary visit done	4180186
4081262	Respiratory medicine domiciliary visit done	4180186
4081262	Pulmonary medicine domiciliary visit done	4180186
4081262	Pulmonary medicine domiciliary visit done (finding)	4180186
4081264	Ear, nose and throat domiciliary visit done (finding)	4180186
4081264	Ear, nose and throat domiciliary visit done	4180186
4081265	Display artist (occupation)	4180186
4081267	Listed for General Medicine admission (finding)	4180186
4081268	Listed for Dermatology admission (finding)	4180186
4081269	Listed for Neurology admission (finding)	4180186
4081270	Listed for psychogeriatric admission (finding)	4180186
4081271	Listed for other medical admis (finding)	4180186
4081272	Listed for Orthopaedic admission	4180186
4081272	Listed for Orthopedic admission (finding)	4180186
4081274	Listed for Obstetric admission (finding)	4180186
4081276	Listed for other surgical admn (finding)	4180186
4081280	Inpatient stay 10 days (finding)	4180186
4081281	Inpatient stay 12 days (finding)	4180186
4081283	Admission non-fundable procedure (finding)	4180186
4081284	Onchocerca cervicalis (organism)	4180186
4081289	Refer for lung function test (procedure)	4180186
4081290	Unilateral congenital macrostomia (situation)	4180186
4081290	Unilateral macrostomia	4180186
4081292	Referral to antenatal clinic (procedure)	4180186
4081293	Crushed chest without open wound into thoracic cavity (disorder)	4180186
4081295	Private referral to ear, nose and throat surgeon (procedure)	4180186
4081295	Private referral to ear, nose and throat surgeon	4180186
4081296	Private referral to urologist (procedure)	4180186
4081297	Private referral to paediatrician	4180186
4081297	Private referral to pediatrician (procedure)	4180186
4081298	Entire superior right basal pulmonary vein (body structure)	4180186
4081299	Pasteurella ureae	4180186
4081299	Actinobacillus ureae (organism)	4180186
4081304	Eccentric viewing (finding)	4180186
4081306	Misjudges distances (finding)	4180186
4081307	Dim vision (disorder)	4180186
4081307	Darkened vision	4180186
4081308	Sees patterns	4180186
4081308	Shapes in visual field (finding)	4180186
4081309	Brightness of visual image (observable entity)	4180186
4081312	Complete bitemporal hemianopia (finding)	4180186
4081313	Altitudinal hemianopia (finding)	4180186
4081316	Reduced yellow-blue discrimination (finding)	4180186
4081316	Reduced yellow-blue vision	4180186
4081317	Blood clot in eye (finding)	4180186
4081318	Ocular posture chin down (finding)	4180186
4081319	Range of movement of both eyes open (observable entity)	4180186
4081319	Quantified movement of both eyes open	4180186
4081319	Degree of movement of both eyes open	4180186
4081320	A pattern vergence (finding)	4180186
4081323	With thickness	4180186
4081323	Has thickness	4180186
4081323	Thick (qualifier value)	4180186
4081326	Convergence in manifest squint, fusion at intersection of visual axes	4180186
4081326	Converge in manifest squint, fusion intersection of vis axes (finding)	4180186
4081328	Galvanic skin response, function (observable entity)	4180186
4081328	Galvanic skin response, function	4180186
4081329	Speed of focus (observable entity)	4180186
4081331	Human leucocyte antigen Dw11	4180186
4081331	Human leukocyte antigen Dw11 (substance)	4180186
4081331	Human leukocyte antigen Dw11	4180186
4081333	Incomitant exotropia (disorder)	4180186
4081335	Incomitant exophoria (disorder)	4180186
4081340	Hypermetric saccades (disorder)	4180186
4081341	Vertical gaze palsy (disorder)	4180186
4081342	DHD	4180186
4081342	Dissociated horizontal deviation	4180186
4081342	Horizontal dissociated gaze palsy (disorder)	4180186
4081343	Premature baby oral feeding plate (physical object)	4180186
4081344	Vertical orthodontic lingual arch (physical object)	4180186
4081345	Maryland bridge (physical object)	4180186
4081346	Cantilever bridge - dental (physical object)	4180186
4081348	Orthodontic coil spring - open (physical object)	4180186
4081349	Sacral reflex (observable entity)	4180186
4081356	Philadelphia chromosome status (qualifier value)	4180186
4081357	Chronic phase (qualifier value)	4180186
4081359	BCR status	4180186
4081359	Break cluster region status (qualifier value)	4180186
4081363	Entire respiratory system (body structure)	4180186
4081363	Entire RS - Respiratory system	4180186
4081364	A serotypes	4180186
4081364	A serotype (qualifier value)	4180186
4081365	Serotype B2 (qualifier value)	4180186
4081367	Book (physical object)	4180186
4081368	Haemolytic	4180186
4081368	Hemolytic (qualifier value)	4180186
4081369	Thoracic epidural steroid injection (procedure)	4180186
4081373	Entire membranous portion of interventricular septum (body structure)	4180186
4081373	Entire membranous ventricular septum	4180186
4081374	Type of impression (attribute)	4180186
4081375	Motor nerve conduction pattern (observable entity)	4180186
4081378	Serogroup L3 (qualifier value)	4180186
4081379	Posterior projection (qualifier value)	4180186
4081380	Peripheral blood stem cell transplantation	4180186
4081380	Peripheral blood stem cell rescue	4180186
4081380	Peripheral blood stem cell graft (procedure)	4180186
4081380	PBSC - Peripheral blood stem cell graft	4180186
4081380	Second stage peripheral stem cell infusion	4180186
4081381	Entire foramen of Bochdalek (body structure)	4180186
4081386	Primary cutaneous histoplasmosis (disorder)	4180186
4081390	Cutaneous chromoblastomycotic abscess (disorder)	4180186
4081391	Structure of petrosooccipital synchondrosis (body structure)	4180186
4081391	Petrosooccipital synchondrosis	4180186
4081392	Straw itch (disorder)	4180186
4081395	Animal mite infestation (disorder)	4180186
4081396	Cat mite infestation (disorder)	4180186
4081397	Rabbit mite infestation (disorder)	4180186
4081398	Rat mite infestation (disorder)	4180186
4081404	Endarterectomy of crural artery (procedure)	4180186
4081404	Endarterectomy of the crural artery	4180186
4081404	Endarterectomy of the infrapopliteal artery	4180186
4081405	Embolectomy of aortoiliac segment (procedure)	4180186
4081405	Aortoiliac segment embolectomy	4180186
4081407	Percutaneous thrombolysis of hepatic artery (procedure)	4180186
4081408	Percutaneous thrombolysis of internal iliac artery (procedure)	4180186
4081411	Small intestinal intervention	4180186
4081411	Small intestinal intervention (procedure)	4180186
4081412	W abdominoplasty (procedure)	4180186
4081415	Deroofing of skin blister	4180186
4081415	Unroofing of blister (procedure)	4180186
4081419	Eragrostis cilianensis (organism)	4180186
4081419	Stinkgrass	4180186
4081421	Drainage of subungual hematoma with hot wire (procedure)	4180186
4081421	Drainage of subungual haematoma with hot wire	4180186
4081422	Elective abortion (disorder)	4180186
4081422	Elective abortion	4180186
4081423	Private referral to radiotherapist (procedure)	4180186
4081424	Private referral to geneticist (procedure)	4180186
4081425	Referral by nurse (procedure)	4180186
4081426	Residence remote from medical care (situation)	4180186
4081428	Procedure declined - uncooperative	4180186
4081428	Procedure declined - uncooperative (situation)	4180186
4081428	Procedure refused - uncooperative (situation)	4180186
4081430	Refuse procedure NOS (situation)	4180186
4081435	Hip replacement planned (situation)	4180186
4081439	Reversal vasectomy requested (situation)	4180186
4081440	Patient signed registration form (finding)	4180186
4081443	"Patient reg. ""ghost"" NOS (finding)"	4180186
4081444	Patient away at school (finding)	4180186
4081445	Patient works away (finding)	4180186
4081452	Patient telephone number unknown (finding)	4180186
4081454	Patient hospital number unknown (finding)	4180186
4081459	Patient registration date queries NOS (finding)	4180186
4081460	Horizontal doll's head reflex (observable entity)	4180186
4081462	Thoracopagus parasiticus (disorder)	4180186
4081463	Sounds associated with eye movement (observable entity)	4180186
4081465	Palpebral fissure height	4180186
4081465	Height of palpebral fissure (observable entity)	4180186
4081467	Salmonella enterica subsp. enterica ser. Matopeni	4180186
4081467	Salmonella Matopeni (organism)	4180186
4081467	Salmonella 30:y:1,2	4180186
4081468	Notching of lid margin (finding)	4180186
4081470	Cyclic III nerve palsy (disorder)	4180186
4081474	Observation of meibomian secretion	4180186
4081474	Meibomian secretion (finding)	4180186
4081475	Intermarginal serous discharge (finding)	4180186
4081476	Lid margin observation	4180186
4081476	Lid margin finding (finding)	4180186
4081477	Sticking of eyelids due to discharge from eyes (finding)	4180186
4081477	Sticky eyes	4180186
4081478	Upper lacrimal punctum finding (finding)	4180186
4081478	Upper lacrimal punctum observation	4180186
4081479	Drainage bleb, leaking (finding)	4180186
4081481	Limbal metaplasia (finding)	4180186
4081483	Injection of palpebral conjunctiva	4180186
4081483	Injection of palpebral conjunctiva (finding)	4180186
4081483	Hyperaemia of palpebral conjunctiva	4180186
