concept_id	concept_synonym_name	language_concept_id
37206124	Dickeya fangzhongdai (organism)	4180186
37206126	Family Coniochaetaceae	4180186
37206126	Family Coniochaetaceae (organism)	4180186
37206128	Genus Byssochlamys	4180186
37206128	Genus Byssochlamys (organism)	4180186
37206129	Genus Acaulium (organism)	4180186
37206129	Genus Acaulium	4180186
37206131	Bronchitis co-occurrent with chronic wheeze (disorder)	4180186
37206135	Genus Phialemoniopsis	4180186
37206135	Genus Phialemoniopsis (organism)	4180186
37206136	Genus Plectosphaerella (organism)	4180186
37206136	Genus Plectosphaerella	4180186
37206137	Genus Pseudogymnoascus (organism)	4180186
37206137	Genus Pseudogymnoascus	4180186
37206138	Bronchitis co-occurrent with acute wheeze (disorder)	4180186
37206144	Product containing only rimabotulinumtoxinB (medicinal product)	4180186
37206146	Product containing thioglycolic acid (medicinal product)	4180186
37206149	Product containing only acetic acid and oxyquinoline (medicinal product)	4180186
37206153	Product containing only aluminium acetate in otic dose form (medicinal product form)	4180186
37206153	Aluminium acetate only product in otic dose form	4180186
37206154	Poly levo lactic acid	4180186
37206154	Poly-L-lactic acid (substance)	4180186
37206157	Branchial sinus (morphologic abnormality)	4180186
37206159	MiNEN - mixed neuroendocrine-non neuroendocrine neoplasm	4180186
37206159	Mixed neuroendocrine-non neuroendocrine neoplasm (morphologic abnormality)	4180186
37206161	Tieghemella glauca	4180186
37206161	Absidia glauca (organism)	4180186
37206165	Aspergillus tritici (organism)	4180186
37206165	Aspergillus triticus	4180186
37206174	Fusarium delphinoides	4180186
37206174	Bisifusarium delphinoides (organism)	4180186
37206182	Penicillium singorense (organism)	4180186
37206183	Phaeoacremonium cinereum (organism)	4180186
37206184	Mucor sexualis	4180186
37206184	Rhizopus sexualis (organism)	4180186
37206185	Scedosporium dehoogii (organism)	4180186
37206188	Carcinoma in situ of oral cavity (disorder)	4180186
37206190	Substance with 4-hydroxyphenylpyruvate dioxygenase inhibitor mechanism of action (substance)	4180186
37206191	Flexion contracture (morphologic abnormality)	4180186
37206193	Alkaline phosphatase inhibitor (disposition)	4180186
37206196	B lymphoblastic leukemia lymphoma with intrachromosomal amplification of chromosome 21	4180186
37206196	B lymphoblastic leukaemia lymphoma with iAMP21	4180186
37206196	B lymphoblastic leukemia lymphoma with intrachromosomal amplification of chromosome 21 (morphologic abnormality)	4180186
37206196	B lymphoblastic leukaemia lymphoma with intrachromosomal amplification of chromosome 21	4180186
37206197	Transplant of cornea of right eye (procedure)	4180186
37206198	Transplant of cornea of left eye (procedure)	4180186
37206200	Peritonitis due to abscess (disorder)	4180186
37206201	Order Longamoebia (organism)	4180186
37206201	Order Longamoebia	4180186
37206206	ABiMVPS - arrhythmogenic bileaflet mitral valve prolapse syndrome	4180186
37206206	Arrhythmogenic bileaflet mitral prolapse (disorder)	4180186
37206207	Mycobacterium massiliense	4180186
37206207	Mycobacteroides abscessus massiliense	4180186
37206207	Mycobacteroides abscessus subsp. massiliense	4180186
37206207	Mycobacterium abscessus subsp. massiliense	4180186
37206207	Mycobacterium abscessus massiliense	4180186
37206207	Mycobacterium abscessus subspecies massiliense	4180186
37206207	Mycobacteroides abscessus subspecies massiliense (organism)	4180186
37206209	Reverse shoulder replacement	4180186
37206209	Reverse total shoulder arthroplasty	4180186
37206209	Reverse prosthetic total arthroplasty of shoulder (procedure)	4180186
37206210	Superficial contusion (morphologic abnormality)	4180186
37206211	Deep bruising	4180186
37206211	Deep contusion (morphologic abnormality)	4180186
37206212	Escherichia coli serotype O8:H12 (organism)	4180186
37206213	Escherichia coli serotype O121:H1 (organism)	4180186
37206215	Escherichia coli serotype O81:H27 (organism)	4180186
37206217	Eurycotis	4180186
37206217	Genus Eurycotis (organism)	4180186
37206218	Salmonella enterica subsp. enterica ser. Farmingdale	4180186
37206218	Salmonella 43:z4,z23:[1,2]	4180186
37206218	Salmonella Farmingdale (organism)	4180186
37206219	Bacillus species, not Bacillus anthracis and not Bacillus cereus (organism)	4180186
37206220	Acinetobacter baumannii or Acinetobacter calcoaceticus or Acinetobacter pittii (finding)	4180186
37206222	Staphylococcus intermedius or Staphylococcus pseudintermedius (finding)	4180186
37206223	Meningococcal group B vaccine (product)	4180186
37206224	Measles and mumps vaccine (product)	4180186
37206225	Product containing cytochrome P450 inhibitor (product)	4180186
37206226	Excessive haemorrhage due to and following induced termination of pregnancy	4180186
37206226	Induced termination of pregnancy complicated by excessive haemorrhage	4180186
37206226	Excessive hemorrhage due to and following induced termination of pregnancy (disorder)	4180186
37206226	Induced termination of pregnancy complicated by excessive hemorrhage	4180186
37206227	Secondary haemorrhage due to and following induced termination of pregnancy	4180186
37206227	Induced termination of pregnancy complicated by secondary haemorrhage	4180186
37206227	Secondary hemorrhage due to and following induced termination of pregnancy (disorder)	4180186
37206227	Induced termination of pregnancy complicated by secondary hemorrhage	4180186
37206228	Secondary hemorrhage due to and following illegally induced termination of pregnancy (disorder)	4180186
37206228	Secondary haemorrhage due to and following illegally induced termination of pregnancy	4180186
37206229	Secondary haemorrhage due to and following legally induced termination of pregnancy	4180186
37206229	Secondary hemorrhage due to and following legally induced termination of pregnancy (disorder)	4180186
37206233	Disorder of joint region (disorder)	4180186
37206235	Mucinous cystadenocarcinoma of pancreas (disorder)	4180186
37206235	Pancreatic mucinous cystadenocarcinoma	4180186
37206238	Removal of surgically implanted eyeball jewelry from posterior segment of eye	4180186
37206238	Removal of surgically implanted eyeball jewellery from posterior segment of eye	4180186
37206238	Removal of surgically implanted extraocular implant from posterior segment of eye (procedure)	4180186
37206241	Nutrition knowledge of individual client (observable entity)	4180186
37206242	Nutrition skill of supportive individuals (observable entity)	4180186
37206243	Nutrition knowledge of supportive individuals (observable entity)	4180186
37206247	Solution for ocular irrigation	4180186
37206247	Conventional release solution for ocular irrigation	4180186
37206247	Conventional release solution for ocular irrigation (dose form)	4180186
37206247	Conventional release ocular solution for irrigation	4180186
37206247	Conventional release ocular solution for irrigation (dose form)	4180186
37206249	Contracture of joint following injury (disorder)	4180186
37206251	Scalpel introducer cricothyroidotomy	4180186
37206251	Scalpel introducer cricothyrotomy	4180186
37206251	Scalpel bougie cricothyroidotomy (procedure)	4180186
37206255	Prolonged-release intralesional implant (dose form)	4180186
37206260	Mycobacterium lutetiense	4180186
37206260	Mycolicibacterium lutetiense (organism)	4180186
37206268	Mycobacterium arcueilense	4180186
37206268	Mycolicibacterium arcueilense (organism)	4180186
37206269	Mycobacterium africanum or Mycobacterium pinnipedii (finding)	4180186
37206270	Product containing precisely chlorhexidine gluconate 500 microgram/1 milliliter and tetracaine 150 microgram/1 milliliter conventional release oral spray (clinical drug)	4180186
37206272	Product containing precisely blood group antibody D 1136 unit/1 milliliter conventional release solution for injection (clinical drug)	4180186
37206274	Product containing precisely levonorgestrel 833 nanogram/1 hour prolonged-release intrauterine drug delivery system (clinical drug)	4180186
37206276	Product containing precisely coagulation factor VIII 1000 unit and von Willebrand factor 2500 unit/1 vial powder for conventional release solution for injection (clinical drug)	4180186
37206277	Product containing precisely coagulation factor VIII 500 unit and von Willebrand factor 1250 unit/1 vial powder for conventional release solution for injection (clinical drug)	4180186
37206279	Product containing precisely bacitracin A 50000 unit/1 vial powder for conventional release solution for injection (clinical drug)	4180186
37206280	Product containing precisely asparaginase 10000 unit/1 vial powder for conventional release solution for injection (clinical drug)	4180186
37206283	Product containing precisely ticarcillin (as ticarcillin disodium) 3 gram/1 vial powder for conventional release solution for injection (clinical drug)	4180186
37206284	Product containing precisely clavulanic acid (as clavulanate potassium) 1 milligram and ticarcillin (as ticarcillin disodium) 30 milligram/1 vial powder for conventional release solution for injection (clinical drug)	4180186
37206285	Product containing precisely ceftriaxone (as ceftriaxone sodium) 10 gram/1 vial powder for conventional release solution for injection (clinical drug)	4180186
37206286	Product containing precisely erythromycin (as erythromycin lactobionate) 500 milligram/1 vial powder for conventional release solution for injection (clinical drug)	4180186
37206287	Product containing precisely vancomycin (as vancomycin hydrochloride) 10 gram/1 vial powder for conventional release solution for injection (clinical drug)	4180186
37206288	Product containing precisely cefoperazone (as cefoperazone sodium) 10 gram/1 vial powder for conventional release solution for injection (clinical drug)	4180186
37206293	Product containing precisely ceftizoxime (as ceftizoxime sodium) 2 gram/1 vial powder for conventional release solution for injection (clinical drug)	4180186
37206295	Product containing precisely cefoxitin (as cefoxitin sodium) 10 gram/1 vial powder for conventional release solution for injection (clinical drug)	4180186
37206296	Product containing precisely polymyxin B (as polymyxin B sulfate) 500000 unit/1 vial powder for conventional release solution for injection (clinical drug)	4180186
37206298	Product containing precisely tobramycin (as tobramycin sulfate) 1.2 gram/1 vial powder for conventional release solution for injection (clinical drug)	4180186
37206302	Product containing precisely carbidopa anhydrous (as carbidopa) 10 milligram and levodopa 100 milligram/1 each conventional release orodispersible tablet (clinical drug)	4180186
37206303	Product containing precisely carbidopa anhydrous (as carbidopa) 25 milligram and levodopa 100 milligram/1 each conventional release orodispersible tablet (clinical drug)	4180186
37206308	Product containing precisely sulfasalazine 30 milligram/1 milliliter conventional release rectal suspension (clinical drug)	4180186
37206311	Product containing precisely epinephrine 1 microgram/1 milligram and lidocaine hydrochloride 100 microgram/1 milligram conventional release cutaneous patch (clinical drug)	4180186
37206311	Adrenaline 1 microgram/mg and lidocaine hydrochloride 100 microgram/mg cutaneous patch	4180186
37206312	Product containing precisely sodium chloride 9 milligram/1 milliliter conventional release solution for irrigation (clinical drug)	4180186
37206315	Product containing precisely mezlocillin (as mezlocillin sodium) 3 gram/1 vial powder for conventional release solution for injection (clinical drug)	4180186
37206316	Product containing precisely mezlocillin (as mezlocillin sodium) 4 gram/1 vial powder for conventional release solution for injection (clinical drug)	4180186
37206317	Noxytiolin 2.5 g powder for solution for injection vial	4180186
37206317	Product containing precisely noxytiolin 2.5 gram/1 vial powder for conventional release solution for injection (clinical drug)	4180186
37206319	Product containing precisely streptokinase 250000 unit/1 vial powder for conventional release solution for injection (clinical drug)	4180186
37206320	Product containing precisely streptokinase 750000 unit/1 vial powder for conventional release solution for injection (clinical drug)	4180186
37206322	Product containing precisely amoxicillin anhydrous (as amoxicillin) 40 milligram/1 milliliter and clavulanic acid (as clavulanate potassium) 5.7 milligram/1 milliliter conventional release oral suspension (clinical drug)	4180186
37206323	Product containing precisely amoxicillin anhydrous (as amoxicillin) 250 milligram and clavulanic acid (as clavulanate potassium) 62.5 milligram/1 each conventional release chewable tablet (clinical drug)	4180186
37206325	Product containing precisely amoxicillin anhydrous (as amoxicillin) 120 milligram/1 milliliter and clavulanic acid (as clavulanate potassium) 8.58 milligram/1 milliliter conventional release oral suspension (clinical drug)	4180186
37206326	Product containing precisely hydrocortisone 1.67 milligram/1 milliliter conventional release rectal suspension (clinical drug)	4180186
37206327	Product containing precisely tiotropium (as tiotropium bromide) 18 microgram/1 actuation conventional release powder for inhalation (clinical drug)	4180186
37206328	Product containing precisely lutropin alfa 75 unit/1 vial powder for conventional release solution for injection (clinical drug)	4180186
37206329	Product containing precisely nonacog alfa 1000 international unit/1 vial lyophilized powder for conventional release solution for injection (clinical drug)	4180186
37206329	Nonacog alfa 1000 international unit lyophilised powder for solution for injection vial	4180186
37206332	Product containing precisely alprostadil 10 microgram/1 milliliter conventional release solution for injection (clinical drug)	4180186
37206334	Product containing precisely human chorionic gonadotropin 10000 unit/1 vial powder for conventional release solution for injection (clinical drug)	4180186
37206335	Product containing precisely warfarin sodium 5 milligram/1 vial powder for conventional release solution for injection (clinical drug)	4180186
37206338	Product containing precisely human C1 esterase inhibitor 500 unit/1 vial powder for conventional release solution for injection (clinical drug)	4180186
37206341	Product containing precisely amoxicillin anhydrous (as amoxicillin) 775 milligram/1 each prolonged-release oral tablet (clinical drug)	4180186
37206343	Product containing precisely amoxicillin anhydrous (as amoxicillin) 25 milligram/1 milliliter conventional release oral suspension (clinical drug)	4180186
37206345	Cefalexin anhydrous (as cefalexin) 50 mg/mL oral suspension	4180186
37206345	Product containing precisely cefalexin anhydrous (as cefalexin) 50 milligram/1 milliliter conventional release oral suspension (clinical drug)	4180186
37206346	Cefalexin anhydrous (as cefalexin) 25 mg/mL oral solution	4180186
37206346	Product containing precisely cefalexin anhydrous (as cefalexin) 25 milligram/1 milliliter conventional release oral solution (clinical drug)	4180186
37206347	Product containing precisely cefalexin anhydrous (as cefalexin) 50 milligram/1 milliliter conventional release oral solution (clinical drug)	4180186
37206347	Cefalexin anhydrous (as cefalexin) 50 mg/mL oral solution	4180186
37206351	Product containing precisely doxycycline anhydrous (as doxycycline calcium) 10 milligram/1 milliliter conventional release oral suspension (clinical drug)	4180186
37206353	Product containing precisely cilastatin (as cilastatin sodium) 500 milligram and imipenem anhydrous (as imipenem) 500 milligram/1 vial powder for conventional release solution for injection (clinical drug)	4180186
37206354	Product containing precisely piperacillin anhydrous (as piperacillin sodium) 1 gram/1 vial powder for conventional release solution for injection (clinical drug)	4180186
37206356	Product containing precisely piperacillin anhydrous (as piperacillin sodium) 4 gram/1 vial powder for conventional release solution for injection (clinical drug)	4180186
37206358	Product containing precisely levofloxacin anhydrous (as levofloxacin) 15 milligram/1 milliliter conventional release eye solution (clinical drug)	4180186
37206360	Product containing precisely levofloxacin anhydrous (as levofloxacin) 5 milligram/1 milliliter conventional release eye solution (clinical drug)	4180186
37206361	Product containing precisely cefixime anhydrous (as cefixime) 40 milligram/1 milliliter conventional release oral suspension (clinical drug)	4180186
37206362	Product containing precisely doxycycline monohydrate 100 milligram/1 each conventional release orodispersible tablet (clinical drug)	4180186
37206363	Cefapirin (as cefapirin sodium) 1 g powder for solution for injection vial	4180186
37206363	Product containing precisely cefapirin (as cefapirin sodium) 1 gram/1 vial powder for conventional release solution for injection (clinical drug)	4180186
37206364	Product containing precisely capsaicin 179 milligram/1 each conventional release cutaneous patch (clinical drug)	4180186
37206366	Product containing precisely cefmetazole (as cefmetazole sodium) 2 gram/1 vial powder for conventional release solution for injection (clinical drug)	4180186
37206367	Product containing precisely ceftazidime anhydrous (as ceftazidime) 40 milligram/1 milliliter conventional release solution for injection (clinical drug)	4180186
37206370	Familial nonmedullary thyroid carcinoma (disorder)	4180186
37206370	Familial non medullary thyroid carcinoma	4180186
37206370	FNMTC - familial nonmedullary thyroid carcinoma	4180186
37206374	Product containing precisely coal tar 20 milligram/1 milliliter conventional release cutaneous shampoo (clinical drug)	4180186
37206376	Product containing precisely anthraquinone glycoside 5 milligram/1 milliliter and salicylic acid 10 milligram/1 milliliter conventional release oromucosal solution (clinical drug)	4180186
37206379	Product containing precisely lanthanum (as lanthanum carbonate) 1 gram/1 each conventional release chewable tablet (clinical drug)	4180186
37206381	Occlusion of central retinal vein of left eye (disorder)	4180186
37206382	Product containing precisely human protein C 1000 unit/1 vial powder for conventional release solution for injection (clinical drug)	4180186
37206383	Product containing precisely human protein C 500 unit/1 vial powder for conventional release solution for injection (clinical drug)	4180186
37206384	Product containing precisely tuberculin purified protein derivative 100000 unit/1 milliliter conventional release solution for injection (clinical drug)	4180186
37206389	Product containing only Vaccinia human immune globulin in parenteral dose form (medicinal product form)	4180186
37206392	Product containing only acetylcholine in ocular dose form (medicinal product form)	4180186
37206395	Product containing only alglucerase in parenteral dose form (medicinal product form)	4180186
37206396	Product containing only alprazolam in oromucosal dose form (medicinal product form)	4180186
37206397	Product containing only amlexanox in oral dose form (medicinal product form)	4180186
37206399	Product containing ammonium lactate and salicylic acid (medicinal product)	4180186
37206401	Product containing amylase and endopeptidase and pancreatic lipase (medicinal product)	4180186
37206404	Product containing only anidulafungin in parenteral dose form (medicinal product form)	4180186
37206405	Product containing only antidiuretic hormone in parenteral dose form (medicinal product form)	4180186
37206408	Product containing only aspirin and glycine in oromucosal dose form (medicinal product form)	4180186
37206409	Product containing only aspirin in oromucosal dose form (medicinal product form)	4180186
37206410	Product containing only aztreonam in pulmonary dose form (medicinal product form)	4180186
37206412	Product containing only belinostat in parenteral dose form (medicinal product form)	4180186
37206413	Product containing belladonna alkaloid and opium (medicinal product)	4180186
37206417	Product containing only benzyl alcohol in cutaneous dose form (medicinal product form)	4180186
37206418	Benzylpenicillin only product in oral dose form	4180186
37206418	Product containing only benzylpenicillin in oral dose form (medicinal product form)	4180186
37206419	Product containing only bepotastine in ocular dose form (medicinal product form)	4180186
37206424	Product containing only bromazine and codeine in oral dose form (medicinal product form)	4180186
37206424	Bromazine and codeine only product in oral dose form	4180186
37206425	Product containing only bromfenac in ocular dose form (medicinal product form)	4180186
37206426	Product containing brompheniramine and codeine and phenylpropanolamine (medicinal product)	4180186
37206435	Product containing only carbachol in parenteral dose form (medicinal product form)	4180186
37206436	Product containing only carbenoxolone in oral dose form (medicinal product form)	4180186
37206437	Product containing only carbinoxamine and dextromethorphan and pseudoephedrine in oral dose form (medicinal product form)	4180186
37206438	Product containing only carglumic acid in oral dose form (medicinal product form)	4180186
37206439	Product containing only calcium phosphate and carmellose in parenteral dose form (medicinal product form)	4180186
37206439	Calcium phosphate and carmellose only product in parenteral dose form	4180186
37206441	Product containing only carmellose in oral dose form (medicinal product form)	4180186
37206441	Carmellose only product in oral dose form	4180186
37206443	Cetyl dimeticone-containing product	4180186
37206443	Product containing cetyl dimeticone (medicinal product)	4180186
37206444	Product containing only chloral in oral dose form (medicinal product form)	4180186
37206445	Product containing only chloral in rectal dose form (medicinal product form)	4180186
37206447	Chlorphenamine and ibuprofen and pseudoephedrine only product in oral dose form	4180186
37206447	Product containing only chlorphenamine and ibuprofen and pseudoephedrine in oral dose form (medicinal product form)	4180186
37206448	Product containing choline and glycerol (medicinal product)	4180186
37206448	Choline- and glycerol-containing product	4180186
37206449	Product containing only cinchocaine and prednisolone in rectal dose form (medicinal product form)	4180186
37206449	Cinchocaine and prednisolone only product in rectal dose form	4180186
37206450	Product containing only ciprofloxacin and dexamethasone in otic dose form (medicinal product form)	4180186
37206451	Product containing only citalopram in oromucosal dose form (medicinal product form)	4180186
37206455	Product containing only clonazepam in oromucosal dose form (medicinal product form)	4180186
37206456	Product containing only coal tar and lecithin in cutaneous dose form (medicinal product form)	4180186
37206459	Product containing only cocaine and homatropine in ocular dose form (medicinal product form)	4180186
37206463	Product containing codeine and promethazine (medicinal product)	4180186
37206464	Product containing only colestyramine in oral dose form (medicinal product form)	4180186
37206464	Colestyramine only product in oral dose form	4180186
37206465	Product containing conjugated estrogen and esterified estrogen and medroxyprogesterone (medicinal product)	4180186
37206466	Product containing corbadrine and mepivacaine (medicinal product)	4180186
37206466	Corbadrine- and mepivacaine-containing product	4180186
37206468	Product containing only cyclopentolate and phenylephrine in ocular dose form (medicinal product form)	4180186
37206472	Product containing dexamethasone and hypromellose (medicinal product)	4180186
37206473	Product containing only dexlansoprazole in oral dose form (medicinal product form)	4180186
37206477	Product containing only dextromethorphan in oromucosal dose form (medicinal product form)	4180186
37206478	Product containing only diethylstilbestrol in parenteral dose form (medicinal product form)	4180186
37206479	Product containing only difluprednate in ocular dose form (medicinal product form)	4180186
37206483	Product containing only diphenhydramine and zinc acetate in cutaneous dose form (medicinal product form)	4180186
37206484	Product containing only docosanol in cutaneous dose form (medicinal product form)	4180186
37206487	Product containing drospirenone and ethinylestradiol and levomefolic acid (medicinal product)	4180186
37206487	Drospirenone- and ethinylestradiol- and levomefolic acid-containing product	4180186
37206490	Product containing only enfuvirtide in parenteral dose form (medicinal product form)	4180186
37206492	Adrenaline and mepivacaine only product in parenteral dose form	4180186
37206492	Product containing only epinephrine and mepivacaine in parenteral dose form (medicinal product form)	4180186
37206494	Product containing equine antithymocyte immunoglobulin (medicinal product)	4180186
37206495	Product containing only ertapenem in parenteral dose form (medicinal product form)	4180186
37206499	Ethinylestradiol and ferrous fumarate and norethisterone only product in oral dose form	4180186
37206499	Product containing only ethinylestradiol and ferrous fumarate and norethisterone in oral dose form (medicinal product form)	4180186
37206500	Product containing only etidocaine in parenteral dose form (medicinal product form)	4180186
37206503	Product containing only fluocinolone and hydroquinone and tretinoin in cutaneous dose form (medicinal product form)	4180186
37206505	Product containing only fluorometholone and tobramycin in ocular dose form (medicinal product form)	4180186
37206506	Product containing only fosfomycin in oral dose form (medicinal product form)	4180186
37206507	Product containing only gadoteric acid in parenteral dose form (medicinal product form)	4180186
