concept_id	concept_synonym_name	language_concept_id
4075566	Entire primary lower left D tooth	4180186
4075566	Entire Universal designation L	4180186
4075567	Thioperazine (substance)	4180186
4075568	Osteotomy of mandible and retrusion of mandible (procedure)	4180186
4075575	Division of palpebral ligament (procedure)	4180186
4075575	Division of canthal ligament	4180186
4075576	Plum	4180186
4075576	Prunus domestica (organism)	4180186
4075579	Primary hemilaminectomy excision of cervical intervertebral disc (procedure)	4180186
4075580	Primary posterior excision of cervical intervertebral disc (procedure)	4180186
4075581	Primary anterior excision of cervical intervertebral disc NEC (procedure)	4180186
4075587	Transoral fusion of atlantoaxial joint (procedure)	4180186
4075590	Revision decompression of thoracic spine (procedure)	4180186
4075593	Structure of right lateral nasopharynx (body structure)	4180186
4075593	Right lateral nasopharynx	4180186
4075594	Primary anterior decompression of cervical spinal cord and fusion (procedure)	4180186
4075597	Removal of slough from skin of head or neck NEC (procedure)	4180186
4075598	Dressing of burnt skin of head or neck (procedure)	4180186
4075600	Other specified dressing of skin (procedure)	4180186
4075601	Exploration of burnt skin of head or neck OS (procedure)	4180186
4075602	Other specified exploration of burnt skin of other site (procedure)	4180186
4075603	Exploration of burnt skin of other site NOS (procedure)	4180186
4075604	Other specified exploration of skin of head or neck (procedure)	4180186
4075606	Other specified other subcutaneous tissue operation (procedure)	4180186
4075608	Chemical destruction of nail bed (procedure)	4180186
4075609	Entire parathyroid transitional cell (cell)	4180186
4075610	Incision of the nail bed (procedure)	4180186
4075610	Incision of nailbed or nailfold	4180186
4075616	Attention to dressing of burn of head or neck (procedure)	4180186
4075617	Attention to dressing of skin of head or neck NEC (procedure)	4180186
4075624	Other specified skin wound operation (procedure)	4180186
4075625	Other operation on skin wound NOS (procedure)	4180186
4075626	Dermabrasion of skin NEC (procedure)	4180186
4075628	Removal of Norplant (procedure)	4180186
4075629	Kitchen (environment)	4180186
4075631	Location inside building (environment)	4180186
4075632	Upstairs (environment)	4180186
4075635	Canada (geographic location)	4180186
4075638	Honduras (geographic location)	4180186
4075642	Grenada (geographic location)	4180186
4075643	St. Vincent and the Grenadines (geographic location)	4180186
4075643	Saint Vincent and the Grenadines	4180186
4075643	Saint Vincent and the Grenadines (geographic location)	4180186
4075645	Brazil (geographic location)	4180186
4075646	Guiana	4180186
4075646	Guyana (geographic location)	4180186
4075649	Venezuela (geographic location)	4180186
4075649	Bolivarian Republic of Venezuela	4180186
4075649	Bolivarian Republic of Venezuela (geographic location)	4180186
4075651	Andaman islands (geographic location)	4180186
4075652	Bali (geographic location)	4180186
4075654	Honshu (geographic location)	4180186
4075658	Mindanao (geographic location)	4180186
4075666	Wicklow (geographic location)	4180186
4075670	Islands in region of Italy (geographic location)	4180186
4075671	Islands of Netherlands (geographic location)	4180186
4075674	Balearic islands (geographic location)	4180186
4075677	Isles du Salut (geographic location)	4180186
4075679	Regions of England (geographic location)	4180186
4075682	Dorsetshire (geographic location)	4180186
4075682	Dorset	4180186
4075683	Durham (geographic location)	4180186
4075684	Greater Manchester (geographic location)	4180186
4075685	Hampshire (geographic location)	4180186
4075685	Hants - Hampshire	4180186
4075686	Leics - Leicestershire	4180186
4075686	Leicestershire (geographic location)	4180186
4075687	Merseyside (geographic location)	4180186
4075690	Entire primary lower left incisor tooth (body structure)	4180186
4075691	Tooth surface (body structure)	4180186
4075691	Structure of tooth surface	4180186
4075691	Structure of tooth surface (body structure)	4180186
4075694	Distal-buccal (body structure)	4180186
4075694	Structure of distal buccal tooth surfaces	4180186
4075694	Structure of distal buccal tooth surfaces (body structure)	4180186
4075695	Distal-lingual (body structure)	4180186
4075695	Structure of distal lingual tooth surfaces	4180186
4075695	Structure of distal lingual tooth surfaces (body structure)	4180186
4075697	Distal-occlusal-buccal (body structure)	4180186
4075697	Structure of distal occlusal buccal tooth surfaces	4180186
4075697	Structure of distal occlusal buccal tooth surfaces (body structure)	4180186
4075699	Mesial-occlusal-buccal-palatal (body structure)	4180186
4075699	Structure of mesial occlusal buccal palatal tooth surfaces (body structure)	4180186
4075699	Structure of mesial occlusal buccal palatal tooth surfaces	4180186
4075700	Mesial-occlusal-buccal-lingual (body structure)	4180186
4075700	Structure of mesial occlusal buccal lingual tooth surfaces (body structure)	4180186
4075700	Structure of mesial occlusal buccal lingual tooth surfaces	4180186
4075703	Purgative	4180186
4075703	Cathartic (substance)	4180186
4075705	Tendon of brachioradialis	4180186
4075705	Structure of tendon of brachioradialis (body structure)	4180186
4075706	Structure of long digital extensor tendon - Zone I (body structure)	4180186
4075706	Structure of long digital extensor tendon - Zone I	4180186
4075706	Long digital extensor tendon - Zone I (body structure)	4180186
4075707	Structure of long digital extensor tendon - Zone II	4180186
4075707	Structure of long digital extensor tendon - Zone II (body structure)	4180186
4075707	Long digital extensor tendon - Zone II (body structure)	4180186
4075708	Structure of long digital extensor tendon - Zone III	4180186
4075708	Structure of long digital extensor tendon - Zone III (body structure)	4180186
4075708	Long digital extensor tendon - Zone III (body structure)	4180186
4075716	Tendon of flexor pollicis brevis	4180186
4075716	Structure of tendon of flexor pollicis brevis (body structure)	4180186
4075717	Tendon of second dorsal interosseous of hand	4180186
4075717	Structure of tendon of second dorsal interosseous of hand (body structure)	4180186
4075717	Structure of second dorsal interosseous tendon within hand	4180186
4075717	Structure of second dorsal interosseous tendon within hand (body structure)	4180186
4075721	Rhamnulose-1-phosphate aldolase (substance)	4180186
4075722	Structure of tendon of obturator externus (body structure)	4180186
4075722	Structure of tendon of obturator externus	4180186
4075722	Tendon of obturator externus (body structure)	4180186
4075723	Structure of tendon of gracilis	4180186
4075723	Structure of tendon of gracilis (body structure)	4180186
4075723	Tendon of gracilis (body structure)	4180186
4075727	Free radical assay technique measurement (procedure)	4180186
4075727	FRAT measurement	4180186
4075729	Revision decompression of cervical spine (procedure)	4180186
4075729	Revisional decompression operations on cervical spine	4180186
4075730	Revisional anterior decompression operation on cervical spinal cord NEC (procedure)	4180186
4075733	Cervical and thoracic spine operations NOS (procedure)	4180186
4075734	Primary decompression of lumbar spine (procedure)	4180186
4075734	Primary decompression operations on lumbar spine	4180186
4075736	Other specified primary decompression operation on lumbar spine (procedure)	4180186
4075737	Revisional decompression operations on lumbar spine	4180186
4075737	Revision decompression of lumbar spine (procedure)	4180186
4075738	Revision extended posterior decompression lumbar spine NEC (procedure)	4180186
4075739	Revisional decompression operation on lumbar spine NOS (procedure)	4180186
4075740	Revisional fenestration excision of lumbar intervertebral disc (procedure)	4180186
4075742	Revisional anterior excision of lumbar disc NEC (procedure)	4180186
4075743	Revisional anterior excision of lumbar disc and posterior instrumentation (procedure)	4180186
4075745	Revision posterolateral fusion lumbar spine (procedure)	4180186
4075746	Betamethasone benzoate (substance)	4180186
4075747	Propylene glycol dinitrate (substance)	4180186
4075749	Sodium trichloroacetate (substance)	4180186
4075750	Poisoning caused by African honey bee sting	4180186
4075750	Poisoning by Apis mellifera scutellata	4180186
4075750	Poisoning caused by African honey bee sting (disorder)	4180186
4075750	Poisoning caused by Apis mellifera scutellata	4180186
4075751	Arteriolosclerosis (morphologic abnormality)	4180186
4075752	Centrosema plumieri (organism)	4180186
4075753	Glyodin (substance)	4180186
4075755	Skin structure of antecubital fossa (body structure)	4180186
4075755	Skin of antecubital fossa	4180186
4075756	Tympanites in dolichomegacolon syndrome	4180186
4075756	Acute dilatation of the colon syndrome	4180186
4075756	Piulachs-Hederich syndrome (disorder)	4180186
4075758	Naris	4180186
4075758	Structure of anterior naris (body structure)	4180186
4075758	Nostril	4180186
4075759	Actinea	4180186
4075759	Hymenoxys (organism)	4180186
4075761	Structure of lacrimal nerve (body structure)	4180186
4075761	Lacrimal nerve	4180186
4075763	Extirpation of nail bed NOS (procedure)	4180186
4075764	Biopsy of lesion of nail bed (procedure)	4180186
4075766	Incision of nail (procedure)	4180186
4075766	Incision of nail	4180186
4075768	Other specified other operation on nail (procedure)	4180186
4075771	Primary open reduction of fracture of bone and intramedullary fixation NOS (procedure)	4180186
4075772	Primary open reduction of fracture of long bone and fixation using Parham circlage band	4180186
4075772	Primary open reduction of fracture of long bone and extramedullary fixation using circlage	4180186
4075772	Primary open reduction of fracture and internal fixation with cerclage wiring (procedure)	4180186
4075773	Primary open reduction of fracture of ankle and (& complex) extramedullary fixation NEC	4180186
4075773	Primary open reduction of fracture of ankle and extramedullary fixation NEC (procedure)	4180186
4075774	Primary open reduction of fracture of bone and extramedullary fixation NOS (procedure)	4180186
4075778	Other specified primary open reduction of intra-articular fracture of bone (procedure)	4180186
4075779	Other primary open reduction of fracture of bone (procedure)	4180186
4075781	Primary open reduction of fracture of long bone and extramedullary fixation using suture (procedure)	4180186
4075785	Primary intra-articular fixation of intra-articular fracture of bone NEC (procedure)	4180186
4075787	Staffordshire (geographic location)	4180186
4075787	Staffs - Staffordshire	4180186
4075789	T and W - Tyne and Wear	4180186
4075789	Tyne and Wear (geographic location)	4180186
4075793	Health boards of Northern Ireland (environment)	4180186
4075793	NI - Health boards of Northern Ireland	4180186
4075794	Border region (geographic location)	4180186
4075795	Dumfries and Galloway (geographic location)	4180186
4075796	Highland (geographic location)	4180186
4075797	Western Isles (geographic location)	4180186
4075798	Arran (geographic location)	4180186
4075801	South Georgia (geographic location)	4180186
4075803	Nova Scotia (geographic location)	4180186
4075805	Saskatchewan (geographic location)	4180186
4075808	Kitikmeot (geographic location)	4180186
4075809	Location within general practice premises (environment)	4180186
4075809	Location within general practice surgery	4180186
4075809	Location within GP surgery	4180186
4075809	Location within GP premises	4180186
4075810	Toilet on hospital premises (environment)	4180186
4075811	Children Act proceedings (qualifier value)	4180186
4075813	Ground floor (environment)	4180186
4075814	Upper floor (environment)	4180186
4075815	4th floor	4180186
4075815	Fourth floor (environment)	4180186
4075817	Eleventh floor and above of building (environment)	4180186
4075818	pounds (sterling) per annum (qualifier value)	4180186
4075819	Medium secure unit (environment)	4180186
4075820	Services (qualifier value)	4180186
4075821	Waste land	4180186
4075821	Derelict land (environment)	4180186
4075822	General practitioner locum (occupation)	4180186
4075822	Locum	4180186
4075824	Shooting self (finding)	4180186
4075825	Mature personality (finding)	4180186
4075826	Shy	4180186
4075826	Introvert (finding)	4180186
4075827	Observation of colour of lips	4180186
4075827	Finding of colour of lips	4180186
4075827	Finding of color of lips (finding)	4180186
4075827	Observation of color of lips	4180186
4075828	Global developmental delay (disorder)	4180186
4075829	Ability to sleep (observable entity)	4180186
4075835	Ability to understand own emotions (observable entity)	4180186
4075836	Structure of tendon of posterior crural muscle (body structure)	4180186
4075836	Structure of tendon of posterior crural muscle	4180186
4075836	Tendon of posterior crural muscle (body structure)	4180186
4075836	Tendon of flexor compartment of lower leg	4180186
4075837	Entire tendon of plantaris	4180186
4075837	Entire plantaris muscle tendon (body structure)	4180186
4075840	Total excision of mandible (procedure)	4180186
4075840	Total mandibulectomy	4180186
4075844	Structure of tendon of second plantar interosseus muscle (body structure)	4180186
4075844	Structure of tendon of second plantar interosseus muscle	4180186
4075844	Tendon of second plantar interosseus muscle (body structure)	4180186
4075855	Axillary vein lymph nodes	4180186
4075855	Axillary vein lymph node group (body structure)	4180186
4075858	Celiac lymph node group (body structure)	4180186
4075858	Celiac nodes	4180186
4075858	Coeliac nodes	4180186
4075858	Coeliac lymph node group	4180186
4075861	Inferior mesenteric nodes	4180186
4075861	Inferior mesenteric lymph node group (body structure)	4180186
4075862	Para-rectal nodes	4180186
4075862	Pararectal lymph node group (body structure)	4180186
4075865	Subcutaneous tissue structure of posterior surface of forearm (body structure)	4180186
4075865	Subcutaneous tissue of posterior surface of forearm	4180186
4075865	Subcutaneous tissue of dorsal surface of forearm	4180186
4075867	Superior gluteal nodes	4180186
4075867	Superior gluteal lymph node group (body structure)	4180186
4075868	Median sacral lymph node group (body structure)	4180186
4075868	Median sacral nodes	4180186
4075871	Entire submandibular lymph node (body structure)	4180186
4075873	Aromatic ammonia spirit (substance)	4180186
4075874	Plastic repair of cranium NOS (procedure)	4180186
4075874	Cranioplasty NOS	4180186
4075875	Apoplectic cyst (morphologic abnormality)	4180186
4075876	Biopsy of cranial lesion (procedure)	4180186
4075880	Lonchura pallidiventer	4180186
4075880	Lonchura atricapilla (organism)	4180186
4075882	Other specified other operation on cranium (procedure)	4180186
4075883	Operation on cranium NOS (procedure)	4180186
4075884	Reduction of closed fracture of orbit bone (procedure)	4180186
4075885	Other specified reduction of fracture of facial bone (procedure)	4180186
4075887	Biopsy of lesion of bone of face (procedure)	4180186
4075888	Genus Redunca (organism)	4180186
4075888	Reedbuck	4180186
4075888	Genus Redunca	4180186
4075889	Other operation on bone of face NOS (procedure)	4180186
4075890	Excision of part of maxilla	4180186
4075890	Partial maxillectomy (procedure)	4180186
4075891	Extended maxillectomy (procedure)	4180186
4075892	Reduction of fracture of maxilla (procedure)	4180186
4075893	LF1 - Reduction of Le Fort 1 fracture of maxilla	4180186
4075893	Reduction of Le Fort 1 fracture of maxilla (procedure)	4180186
4075893	LFI - Reduction of Le Fort I fracture of maxilla	4180186
4075898	Fixation of maxilla NEC (procedure)	4180186
4075901	Le Fort III osteotomy (procedure)	4180186
4075901	Osteotomy of maxilla involving nasal complex	4180186
4075902	Osteotomy of alveolar segment of mandible (procedure)	4180186
4075904	Alveolar bone graft (procedure)	4180186
4075909	Primary open reduction and external fixation of femoral fracture (procedure)	4180186
4075912	Secondary open reduction of fracture of bone (procedure)	4180186
4075912	Revision to open reduction of fracture of bone	4180186
4075913	Revision to open reduction and external fixation of proximal femoral fracture (procedure)	4180186
4075915	Revision to open reduction of fracture and cast immobilization (procedure)	4180186
4075915	Revision to open reduction of fracture and cast immobilisation	4180186
4075916	Revision to open reduction of fracture and internal fixation with plate (procedure)	4180186
4075917	Closed reduction of fracture of long bone and rigid internal fixation NEC (procedure)	4180186
4075919	Primary closed reduction and internal fixation of proximal femoral fracture with screw/nail device alone (procedure)	4180186
4075920	Primary closed reduction of fracture and unlocked reamed intramedullary nail fixation (procedure)	4180186
4075921	Revision to closed reduction of fracture and locked reamed intramedullary nail fixation (procedure)	4180186
4075923	Revision to external fixation(without reduction) of proximal femoral fracture (procedure)	4180186
4075924	Other primary external immobilisation of fracture	4180186
4075924	Other primary external immobilization of fracture (procedure)	4180186
4075926	Revision to closed reduction of fracture and external fixation (procedure)	4180186
4075927	Other closed reduction of fracture of bone (procedure)	4180186
4075929	Entire anterior wall of nasopharynx (body structure)	4180186
4075930	Immature emotional adjustment (finding)	4180186
4075931	Becomes angry very easily (finding)	4180186
4075932	Feeling dirty (finding)	4180186
4075934	Feeling unwanted (finding)	4180186
4075935	Despair stage of grief (finding)	4180186
4075936	Memory recall finding (finding)	4180186
4075936	Memory recall observations	4180186
4075938	Observations relating to reminiscing	4180186
4075938	Finding relating to reminiscing (finding)	4180186
4075939	Self-strangulation (event)	4180186
4075940	Well person screening (procedure)	4180186
4075943	Giving antiseptic mouthwash (regime/therapy)	4180186
4075944	Application of lubricant to lips (regime/therapy)	4180186
4075946	Spigotting of urinary catheter (procedure)	4180186
4075947	Expression of bladder (procedure)	4180186
4075949	Replacing dentures (regime/therapy)	4180186
4075951	Intermittent urethral catheterisation	4180186
4075951	In-out urethral catheterization	4180186
4075951	Intermittent urethral catheterization (procedure)	4180186
4075951	In-out urethral catheterisation	4180186
4075951	Urinary catheterization: intermittent	4180186
4075953	Inspection of stump (procedure)	4180186
4075954	Soaking off dressing (procedure)	4180186
4075955	Repadding wound (procedure)	4180186
4075957	Scalp cooling (procedure)	4180186
4075961	Checking skin creases (procedure)	4180186
4075962	Checking dressing of skin (procedure)	4180186
4075964	Wound toilet	4180186
4075964	Cleaning wound (procedure)	4180186
4075964	Cleansing wound	4180186
4075965	Application of Bennett's plaster cast (procedure)	4180186
4075965	Application of Bennett plaster cast	4180186
4075969	Application of hot wax (procedure)	4180186
4075970	Emptying colostomy bag (procedure)	4180186
4075971	Changing stoma appliance seal (procedure)	4180186
4075975	Entire scapular lymph node (body structure)	4180186
4075976	Entire interpectoral lymph node (body structure)	4180186
4075978	Entire abdominal lymph node (body structure)	4180186
4075979	Entire celiac lymph node (body structure)	4180186
4075979	Entire coeliac lymph node	4180186
4075979	Entire coeliac node	4180186
4075979	Entire celiac node	4180186
4075980	Structure of peripancreatic lymph node (body structure)	4180186
4075980	Structure of peripancreatic lymph node	4180186
4075980	Peripancreatic lymph node (body structure)	4180186
4075981	Structure of lateral sacral node	4180186
4075981	Structure of lateral sacral node (body structure)	4180186
4075981	Lateral sacral node (body structure)	4180186
4075984	Entire porta hepatis (body structure)	4180186
4075987	Entire fundus of gallbladder (body structure)	4180186
4075988	Entire hepatic duct (body structure)	4180186
4075990	Entire right hepatic duct (body structure)	4180186
4075991	Structure of region of esophagus (body structure)	4180186
4075991	Structure of region of oesophagus	4180186
4075991	Structure of region of esophagus	4180186
4075991	Region of oesophagus	4180186
4075991	Region of esophagus (body structure)	4180186
4075996	Entire fourth part of duodenum	4180186
4075996	Entire ascending portion of duodenum (body structure)	4180186
4075998	Entire splenic flexure of colon	4180186
4075998	Entire left colic flexure (body structure)	4180186
4076000	Entire sacral flexure of rectum (body structure)	4180186
4076002	Terminal part of anal canal (body structure)	4180186
4076003	Entire anal column (body structure)	4180186
4076005	White line of anal canal (body structure)	4180186
4076007	Loudness (finding)	4180186
4076007	Magnitude of sound	4180186
4076013	Entire right cornu of Fallopian tube	4180186
4076013	Entire right horn of uterus (body structure)	4180186
4076013	Entire right uterine cornu	4180186
4076015	Prosthetic replacement of temporomandibular joint NEC (procedure)	4180186
4076016	Reconstruction of temporomandibular joint NEC (procedure)	4180186
4076021	Revisional foraminotomy of cervical spine (procedure)	4180186
4076024	Primary anterior excision thoracic disc and fusion (procedure)	4180186
4076025	Primary posterior decompression of thoracic disc (procedure)	4180186
4076026	Localised chondromalacia	4180186
4076026	Localized chondromalacia (disorder)	4180186
4076028	Entire angle of eleventh rib (body structure)	4180186
4076032	Revision posterior decompression lumbar spine and fusion (procedure)	4180186
4076034	Primary removal of lumbar intervertebral disc	4180186
4076034	Primary lumbar discectomy (procedure)	4180186
4076034	Primary excision of lumbar intervertebral disc	4180186
4076044	Revision to closed reduction of fracture and skin traction (procedure)	4180186
4076046	Revision to arthroscopic reduction of fracture (procedure)	4180186
4076047	Revision to arthroscopic reduction and fixation of fracture (procedure)	4180186
4076048	Epiphysioplasty (procedure)	4180186
4076049	Removal of staple from epiphysis (procedure)	4180186
4076052	Application of balanced suspension traction (procedure)	4180186
4076054	Traction to bone NEC (procedure)	4180186
4076055	Other specified internal fixation of bone (procedure)	4180186
4076057	Other specified other fixation of bone (procedure)	4180186
4076058	Grafting of bone marrow NOS (procedure)	4180186
4076058	Graft of bone marrow NOS	4180186
4076059	Cancellous strip autograft of bone (procedure)	4180186
4076061	Application of corticocancellous autograft of bone (procedure)	4180186
4076061	Corticocancellous autograft of bone	4180186
4076062	Allograft of bone NEC (procedure)	4180186
4076064	Filling of bone defect with bone cement (procedure)	4180186
4076066	Removal of implanted substance from bone (procedure)	4180186
4076068	Other specified operations on bone (procedure)	4180186
4076069	Bone operations NOS (procedure)	4180186
4076070	Revision uncemented total hip replacement (procedure)	4180186
4076072	Primary cemented hemiarthroplasty of hip (procedure)	4180186
4076073	Other prosthetic hemiarthroplasty of hip NOS (procedure)	4180186
4076074	Other specified operations on hip joint (procedure)	4180186
4076075	Changing stoma appliance (procedure)	4180186
4076077	Checking intravenous fluids for foreign particles (procedure)	4180186
4076078	Putting additive into intravenous infusion bag (procedure)	4180186
4076080	Resiting intravenous infusion	4180186
4076080	Relocation of intravenous infusion site (procedure)	4180186
4076082	Sleep and rest interventions (procedure)	4180186
4076082	Rest/sleep treatments and procedures	4180186
4076083	Search procedure (procedure)	4180186
4076084	Acknowledging anxiety (procedure)	4180186
4076085	Psychodynamic and/or supportive psychotherapeutic intervention (procedure)	4180186
4076085	Psychodynamic and psychotherapeutic interventions	4180186
4076087	Entire subcutaneous tissue of all toes (body structure)	4180186
4076089	District of Columbia (geographic location)	4180186
4076092	Second language (observable entity)	4180186
4076095	Marital or partnership status (observable entity)	4180186
4076096	Number of previous marriages (observable entity)	4180186
4076097	No known relatives (finding)	4180186
4076097	No known family	4180186
4076100	Age spread of children in family (observable entity)	4180186
4076101	Family with child under one year (finding)	4180186
4076103	Household composition (observable entity)	4180186
4076103	Lives with	4180186
4076103	LW - Lives with	4180186
4076104	Lives with friends (finding)	4180186
4076108	Lives with grandparents (finding)	4180186
4076111	Lives as companion (finding)	4180186
4076112	Lives as unpaid companion (finding)	4180186
4076114	Household income (observable entity)	4180186
4076115	Income paid weekly (finding)	4180186
4076116	Income paid annually (finding)	4180186
4076117	Structure of uterine submucosa	4180186
4076117	Structure of uterine submucosa (body structure)	4180186
4076117	Uterine submucosa (body structure)	4180186
4076118	Entire endocervical canal	4180186
4076118	Entire cervical canal of uterus (body structure)	4180186
4076118	Entire cervical canal of uterus	4180186
4076120	Entire isthmus of fallopian tube (body structure)	4180186
4076121	Genital system	4180186
4076121	Reproductive anatomical structure	4180186
4076121	Structure of anatomical reproductive system (body structure)	4180186
4076124	Entire left lobar bronchus (body structure)	4180186
4076128	Structure of apical segment of left upper lobe	4180186
4076128	Structure of apical segment of left upper lobe (body structure)	4180186
4076128	Apical segment of left upper lobe (body structure)	4180186
4076133	Entire lobe of thyroid gland (body structure)	4180186
