concept_id	concept_synonym_name	language_concept_id
3565636	Human bocavirus (organism)	4180186
3565638	Other specified rigid diagnostic bronchoscopy (procedure)	4180186
3565639	Oocyte recovery NOS (procedure)	4180186
3565643	Sodium chloride 0.9% eye drops preservative free (product)	4180186
3565647	Clinical administration (record artifact)	4180186
3565650	Self-referred (finding)	4180186
3565651	Paroxysmal kinesigenic dyskinesia (finding)	4180186
3565654	DF118 (qualifier value)	4180186
3565656	Population based and preventive services - National Public Health Classification (administrative concept)	4180186
3565658	Somatropin (rbe) 6mg powder and solvent for solution for injection cartridges (product)	4180186
3565659	Generic Femodene ED tablets (product)	4180186
3565666	Occupational health and safety - National Public Health Classification (administrative concept)	4180186
3565668	OFTT - Organic failure to thrive	4180186
3565668	Organic failure to thrive (disorder)	4180186
3565669	Percutaneous transluminal insertion of stent into subclavian artery (procedure)	4180186
3565670	Fluoroscopic percutaneous transluminal angioplasty of common iliac artery (procedure)	4180186
3565670	PTA of common iliac artery	4180186
3565671	Risks and warnings highlighting act (record artifact)	4180186
3565677	Oxycodone 40mg modified-release tablets (product)	4180186
3565678	Triamcinolone acetonide 50mg/5ml suspension for injection vials (product)	4180186
3565681	Ultrasound guided injection of subacromial bursa (procedure)	4180186
3565682	Adenosine 30mg/10ml solution for infusion vials (product)	4180186
3565683	Does heat home - Common Assessment Framework (finding)	4180186
3565687	Diagnostic procedure NOS (procedure)	4180186
3565697	Skeletal injury NOS - birth (disorder)	4180186
3565700	Cardiopulmonary resuscitation discontinued due to do not resuscitate order (situation)	4180186
3565709	Netilmicin 15mg/1.5ml solution for injection ampoules (product)	4180186
3565710	Atropine 3mg/10ml solution for injection ampoules (product)	4180186
3565714	Galsulfase 5mg/5ml solution for infusion vials (product)	4180186
3565718	Paracetamol + Domperidone (product)	4180186
3565719	Data analysis - National Public Health Classification (administrative concept)	4180186
3565720	Radionuclide technetium-99m hexamethylpropyleneamine oxime leucocyte whole body scan (procedure)	4180186
3565720	White cell HMPAO whole body scan	4180186
3565723	Percutaneous transluminal angioplasty of blood vessel of liver (procedure)	4180186
3565725	Other specified diagnostic electrocardiography (regime/therapy)	4180186
3565727	Therapeutic transluminal operations on heart (procedure)	4180186
3565728	Remanipulation of dislocation alone	4180186
3565728	Revision to closed reduction of dislocation alone (procedure)	4180186
3565729	Closed fracture of seventh cervical vertebra without mention of spinal cord lesion (disorder)	4180186
3565730	Reconstruction of mouth using flap NEC (procedure)	4180186
3565734	Other specified bone scanning procedures (procedure)	4180186
3565736	Atracurium besilate 250mg/25ml solution for injection vials (product)	4180186
3565738	Intravenous injection of vaccine (procedure)	4180186
3565751	Rural development - National Public Health Classification (administrative concept)	4180186
3565756	Patient administrative data NOS (record artifact)	4180186
3565758	Alcohol related harm - National Public Health Classification (administrative concept)	4180186
3565759	Percutaneous insertion of tubal prosthesis into hepatic duct NEC (procedure)	4180186
3565762	Closed fracture of bone (disorder)	4180186
3565764	Testosterone 2.5mg/24hours transdermal patches (product)	4180186
3565768	New Kadampa Tradition Buddhist, follower of religion (person)	4180186
3565771	Fast-electron therapy NOS (procedure)	4180186
3565772	Ultrasound scan of forearm (procedure)	4180186
3565772	US scan of forearm	4180186
3565774	Rehabilitation for musculoskeletal disorders NOS (regime/therapy)	4180186
3565776	Mass media campaign - National Public Health Classification (administrative concept)	4180186
3565777	Epoetin beta 10,000units/0.6ml solution for injection pre-filled syringes (product)	4180186
3565778	Percutaneous nephrolithotomy NEC (procedure)	4180186
3565780	Electrocardiogram: premature atrial contractions	4180186
3565780	Electrocardiogram shows premature atrial contractions (finding)	4180186
3565783	Endovascular placement of one drug-eluting stent (procedure)	4180186
3565788	[SO]Shaft of fibula NEC (body structure)	4180186
3565790	Fluoroscopy and biopsy of thorax (procedure)	4180186
3565790	Fluoroscopy and biopsy of chest	4180186
3565792	Number of hours oxygen therapy required per day (observable entity)	4180186
3565794	St George's (product)	4180186
3565795	Pethidine 100mg/10ml solution for injection ampoules (product)	4180186
3565801	Seniority administration (administrative concept)	4180186
3565802	Contrast fluoroscopy NEC (procedure)	4180186
3565804	Other infectious and parasitic diseases with arthropathy of the pelvic region and thigh (disorder)	4180186
3565806	Urethral administration of treatment (procedure)	4180186
3565807	Gingival administration of treatment (procedure)	4180186
3565812	IV - Intravenous route	4180186
3565813	Expected to resolve (qualifier value)	4180186
3565818	Closed reduction of dislocated total prosthetic replacement of hip joint (procedure)	4180186
3565822	Percutaneous transluminal angioplasty of vein NEC (procedure)	4180186
3565823	Ultrasound scan of sternum (procedure)	4180186
3565824	Discussion technique - National Public Health Classification (administrative concept)	4180186
3565825	Accident involving collision between road vehicle NEC and animal, occupant of tram injured (event)	4180186
3565826	Other specified plastic repair of tricuspid valve (procedure)	4180186
3565831	Scalp injury due to birth trauma, NOS (disorder)	4180186
3565834	Other specified intermittent infusion of therapeutic substance (procedure)	4180186
3565837	Healonid GV (qualifier value)	4180186
3565841	Airway toilet using soft catheter (procedure)	4180186
3565842	Computed tomography venography of pulmonary vein (procedure)	4180186
3565842	CT venogram of pulmonary vein	4180186
3565848	MRI venography (procedure)	4180186
3565849	Major open wound (disorder)	4180186
3565850	IgE (immunoglobulin E) antibody to omega-5 gliadin	4180186
3565850	Immunoglobulin E antibody to omega-5 gliadin (substance)	4180186
3565853	Motor vehicle nontraffic accident involving collision, not on public highway, between motor vehicle, except off-road motor vehicle, and railway train, unspecified person injured (event)	4180186
3565854	Other specified sexual precocity NEC (disorder)	4180186
3565855	Magnetic resonance angiogram of axillary-femoral bypass	4180186
3565855	Magnetic resonance angiography of axillary-femoral artery bypass (procedure)	4180186
3565856	Other specified total prosthetic replacement of elbow joint using cement (procedure)	4180186
3565859	Fluoroscopic angiography of lower limb artery (procedure)	4180186
3565859	Lower limb angiogram	4180186
3565861	Percutaneous insertion of plastic stent into ureter (procedure)	4180186
3565862	Developmental screening - National Public Health Classification (administrative concept)	4180186
3565863	Referral by psychologist (procedure)	4180186
3565865	Motor vehicle traffic accident NOS (event)	4180186
3565868	Suspended (qualifier value)	4180186
3565869	Revisional percutaneous intradiscal radiofrequency thermocoagulation to cervical intervertebral disc (procedure)	4180186
3565872	Endovascular stenting for aortic aneurysm of bifurcation NEC (procedure)	4180186
3565873	Computerised tomography arthrography guided injection of elbow joint (procedure)	4180186
3565873	CT arthrogram guided injection of elbow	4180186
3565878	Hepatitis B immunisation declined (situation)	4180186
3565879	Other specified radiology with contrast (procedure)	4180186
3565882	Radionuclide I131 thyroid ablation therapy	4180186
3565882	Radionuclide iodine 131 thyroid ablation therapy (procedure)	4180186
3565884	Biopsy of liver using ultrasound guidance (procedure)	4180186
3565884	US guided biopsy of liver	4180186
3565885	Delivery of a fraction of intraluminal brachytherapy (procedure)	4180186
3565888	Community cafe - National Public Health Classification (administrative concept)	4180186
3565890	Neurologic disorder medication review (procedure)	4180186
3565891	Radiotherapy to breast (procedure)	4180186
3565894	Computerised tomography arthrogram of midtarsal joint (procedure)	4180186
3565894	CT arthrogram of midtarsal joint	4180186
3565895	Revision of reverse polarity total prosthetic replacement of shoulder joint not using cement (procedure)	4180186
3565898	Destruction of subretinal lesion NOS (procedure)	4180186
3565900	New patient screening administration (administrative concept)	4180186
3565902	Diagnostic imaging of abdomen (procedure)	4180186
3565906	Ultrasound guided radiofrequency ablation (procedure)	4180186
3565910	Thermal ablation of single lesion of liver (procedure)	4180186
3565914	Removal of releasable suture following glaucoma surgery (procedure)	4180186
3565915	Advice to change high energy food intake (procedure)	4180186
3565920	Other specified destruction of subretinal lesion (procedure)	4180186
3565923	US scan of female genital tract (procedure)	4180186
3565924	Bilateral adrenalectomy NEC (procedure)	4180186
3565925	Bypass of femoral artery by anastomosis of femoral artery to peroneal artery using vein graft NEC (procedure)	4180186
3565926	Choroiditis NOS (disorder)	4180186
3565927	Meningomyelocele of unspecified site (disorder)	4180186
3565932	Partial excision of bone NEC (procedure)	4180186
3565937	Partnership working - National Public Health Classification (administrative concept)	4180186
3565938	Drug addict notification administration (administrative concept)	4180186
3565940	Chlorphenamine 10mg/1ml solution for injection ampoules (product)	4180186
3565943	Heparin sodium 5,000units/1ml solution for injection ampoules (product)	4180186
3565950	Acupuncture NEC (procedure)	4180186
3565955	Lidocaine 50mg/5ml (1%) solution for injection ampoules (product)	4180186
3565960	Other umbilical cord complications - delivered (disorder)	4180186
3565965	Ultrasound guided fine needle aspiration biopsy of breast (procedure)	4180186
3565965	US guided FNA of breast	4180186
3565968	Endoscopic ultrasound examination of bile duct and biopsy of lesion of bile duct (procedure)	4180186
3565969	Transluminal balloon assisted coil embolisation of aneurysm NOS (procedure)	4180186
3565971	Imipramine 25mg/5ml oral solution (product)	4180186
3565972	Fluoroscopic percutaneous angiography of aorta with insertion of hybrid stent graft (procedure)	4180186
3565975	Excision of lesion of eyelid NEC (procedure)	4180186
3565978	Computerised tomography peritoneal cavity with contrast (procedure)	4180186
3565978	CT peritoneogram	4180186
3565979	Adjustment of cochlear implant processor (procedure)	4180186
3565980	Estradiol 75micrograms/24hours transdermal patches (product)	4180186
3565981	Ritodrine 50mg/5ml solution for injection ampoules (product)	4180186
3565987	Fluoroscopic percutaneous transluminal angioplasty of renal artery (procedure)	4180186
3565987	PTA of renal artery	4180186
3565991	Congenital nose deformity, unspecified (disorder)	4180186
3565992	Deafness due to congenital anomaly NEC (disorder)	4180186
3565994	Fluoroscopy and stent duodenum	4180186
3565994	Fluoroscopy of duodenum and insertion of stent (procedure)	4180186
3565996	Referral for social services carer's assessment (procedure)	4180186
3565999	Removal of foreign body from cornea NOS (procedure)	4180186
3566000	On examination - joint power NOS	4180186
3566000	On examination - joint power NOS (finding)	4180186
3566003	Reduction deformity of unspecified limb NOS (disorder)	4180186
3566005	Fluoroscopic angiography and embolisation of thoracic artery (procedure)	4180186
3566005	Fluoroscopy and embolisation of thoracic artery	4180186
3566006	Transluminal insertion of stent graft for aneurysmal segment of aorta NOS (procedure)	4180186
3566007	Ener-G Low Protein lasagne (product)	4180186
3566013	Route of administration	4180186
3566018	GMS4 claim - contraception (non IUCD) signed (finding)	4180186
3566021	Bill/fee administration (administrative concept)	4180186
3566022	Repositioning of transposed great arteries (procedure)	4180186
3566024	Oestradiol valerate 1mg tablet	4180186
3566026	Phenylephrine 0.12% eye drops (product)	4180186
3566028	Screening invitation medium (record artifact)	4180186
3566032	Other specified rehabilitation for trauma and reconstructive surgery (regime/therapy)	4180186
3566033	Transvaginal ultrasound guided aspiration of ovarian cyst (procedure)	4180186
3566034	Atropine 1mg/10ml solution for injection pre-filled syringes (product)	4180186
3566038	Health and safety commission region - National Public Health Classification (administrative concept)	4180186
3566039	Plasma pregnancy associated plasma protein-A mean of median measurement (procedure)	4180186
3566040	Bovril (substance)	4180186
3566045	Holter extended electrocardiographic recording (regime/therapy)	4180186
3566046	Ultrasound scan of sacral spine (procedure)	4180186
3566046	US scan of sacral spine	4180186
3566046	US scan of sacrum	4180186
3566051	Single photon emission computerised tomography iodine 123 whole body study (procedure)	4180186
3566051	SPECT iodine 123 whole body study	4180186
3566053	Forces recruitment medical administration (administrative concept)	4180186
3566055	Diagnostic imaging of vascular system NOS (procedure)	4180186
3566058	Cocaine misuse (finding)	4180186
3566062	Contusion of infraorbital nerve (disorder)	4180186
3566063	Unspecified eustachian tube obstruction (disorder)	4180186
3566066	Fracture of femur, NOS (disorder)	4180186
3566069	Adverse reaction to hormones and synthetic substances NOS (disorder)	4180186
3566077	Mental Health Act 1983 (England and Wales) section 5 nearest relative recommendation form (record artifact)	4180186
3566081	X-ray of chest and abdomen (procedure)	4180186
3566082	High immunoreactive trypsinogen (finding)	4180186
3566082	High IRT	4180186
3566085	Pretesting - National Public Health Classification (administrative concept)	4180186
3566086	Wyeth Generics (qualifier value)	4180186
3566088	Primary repair of umbilical hernia using insert of natural material (procedure)	4180186
3566089	Paracetamol+codeine phosphate 500mg/8mg capsule	4180186
3566090	Percutaneous insertion of stent into cerebral venous sinus using fluoroscopic guidance (procedure)	4180186
3566095	Honey smacks (substance)	4180186
3566096	Housing history (observable entity)	4180186
3566097	Methotrexate 1g/40ml solution for injection vials (product)	4180186
3566100	Resiting of lead of cardioverter defibrillator (procedure)	4180186
3566102	Percutaneous transluminal embolisation of branch of gastroduodenal artery using fluoroscopic guidance (procedure)	4180186
3566105	Expected to worsen (qualifier value)	4180186
3566106	Radionuclide bone study of femur (procedure)	4180186
3566109	Reconstruction of vagina using bowel interposition (procedure)	4180186
3566110	Sodium citrate compound 5ml enema (product)	4180186
3566113	Focused ultrasound ablation of uterine fibroid using magnetic resonance imaging guidance (procedure)	4180186
3566119	Naproxen 500mg tablets and Misoprostol 200microgram tablets (product)	4180186
3566120	Petrositis NOS (disorder)	4180186
3566123	Endoscopic ultrasound guided aspiration of pancreas (procedure)	4180186
3566124	Main spoken language Bihari (finding)	4180186
3566132	Endoscopic endoluminal balloon rupture of stenosis of pelviureteric junction of kidney (procedure)	4180186
3566133	Fluoroscopic guidance for removal of stent	4180186
3566133	Fluoroscopy guided removal of stent (procedure)	4180186
3566136	Fluoroscopic percutaneous angiography of external iliac artery with insertion of drug eluting stent (procedure)	4180186
3566137	Computerised tomography guided aspiration (procedure)	4180186
3566141	Fluoroscopic guidance for aspiration of hand	4180186
3566141	Fluoroscopy guided aspiration of hand (procedure)	4180186
3566146	Aspiration of intervertebral disc NEC (procedure)	4180186
3566148	Radionuclide cardiac first pass angiogram	4180186
3566148	Radionuclide cardiac first pass angiography (procedure)	4180186
3566151	Fibreoptic endoscopic extirpation of lesion of stomach NOS (procedure)	4180186
3566152	Revisional laser foraminoplasty of spine NEC (procedure)	4180186
3566155	Advice to change red meat intake	4180186
3566155	Recommendation to change red meat intake (procedure)	4180186
3566157	Cefradine 250mg/5ml oral solution (product)	4180186
3566159	Collection of sperm NEC (procedure)	4180186
3566161	Theophylline 200mg modified-release tablets (product)	4180186
3566164	Anterior chamber of eye NEC (body structure)	4180186
3566167	Breech presentation unspecified (finding)	4180186
3566168	Other specified arthropathy NOS (disorder)	4180186
3566170	Percutaneous transjugular embolisation of oesophageal vein using fluoroscopic guidance (procedure)	4180186
3566176	Antepartum hemorrhage with uterine leiomyoma NOS (disorder)	4180186
3566177	Acquired absence of teeth NOS (disorder)	4180186
3566181	Magnetic resonance imaging of heart for myocardial viability assessment (procedure)	4180186
3566183	Radiology with contrast NOS (procedure)	4180186
3566189	CT of mastoid (procedure)	4180186
3566190	Revision of one component of total prosthetic replacement of shoulder joint using cement (procedure)	4180186
3566192	GP82 - NOS (finding)	4180186
3566195	Immature cataract NOS (disorder)	4180186
3566197	Excepted from heart failure quality indicators: Patient unsuitable (finding)	4180186
3566198	Removal of gastric band (procedure)	4180186
3566202	Cleansing and sterilisation of burnt skin of head or neck (procedure)	4180186
3566205	Education for inhaled therapy education	4180186
3566205	Education for inhaled therapy (procedure)	4180186
3566206	Cannabis misuse (finding)	4180186
3566211	Assessment of competence with stoma care (regime/therapy)	4180186
3566212	Reconstruction of mouth using graft NEC (procedure)	4180186
3566220	Repair of salivary gland NEC (procedure)	4180186
3566223	Methadone 1mg/ml oral solution sugar free (product)	4180186
3566228	Economics, finance and industry - National Public Health Classification (administrative concept)	4180186
3566229	Other excision of breast operations (procedure)	4180186
3566229	Other mastectomy operations	4180186
3566230	Magnetic resonance imaging of joint (procedure)	4180186
3566231	Zen Buddhist, follower of religion (person)	4180186
3566232	Excision of cyst of male perineum (procedure)	4180186
3566236	Benign neoplasm of connective and soft tissue of buttock NEC (disorder)	4180186
3566242	Magnetic resonance imaging arthrography of metatarsophalangeal joint (procedure)	4180186
3566242	MRI arthrogram of metatarsophalangeal joint	4180186
3566243	GP/PS3 - sent to HB (finding)	4180186
3566247	Degeneration of macula or posterior pole NOS (disorder)	4180186
3566248	Neonatal candida infection NOS (disorder)	4180186
3566253	Progesterone 100mg/2ml solution for injection ampoules (product)	4180186
3566254	Psychiatry - National Public Health Classification (administrative concept)	4180186
3566260	Conversion from previous hybrid prosthetic replacement of shoulder joint using cement NEC (procedure)	4180186
3566262	E. coli serotype O69:H11	4180186
3566262	Escherichia coli, serotype O69:H11 (organism)	4180186
3566263	Pamidronate disodium 90mg/30ml solution for infusion vials (product)	4180186
3566272	Fentanyl 100micrograms/hour transdermal patches (product)	4180186
3566273	CT and biopsy of abdomen (procedure)	4180186
3566280	Laceration injury (disorder)	4180186
3566282	Fluoroscopic percutaneous cholecystogram	4180186
3566282	Fluoroscopic percutaneous cholecystography (procedure)	4180186
3566282	Percutaneous cholecystogram	4180186
3566283	Perineal area care (regime/therapy)	4180186
3566284	Discogram	4180186
3566284	Fluoroscopic discography (procedure)	4180186
3566289	Adenosine 6mg/2ml solution for injection vials (product)	4180186
3566290	Spectacles (physical object)	4180186
3566293	Duration of early morning joint stiffness (observable entity)	4180186
3566294	Ibuprofen 100mg/5mL syrup	4180186
3566297	Helmet worn (finding)	4180186
3566299	Incision of tissue in atria (procedure)	4180186
3566301	Magnetic resonance imaging of liver with contrast (procedure)	4180186
3566303	Repair of rupture of coronary artery (procedure)	4180186
3566307	Ultrasound doppler scan of superior mesenteric artery (procedure)	4180186
3566310	Preconception - National Public Health Classification (administrative concept)	4180186
3566312	Photodynamic ablation of endometrium (procedure)	4180186
3566314	Fluticasone propionate 500microgram inhalation powder blisters with device (product)	4180186
3566316	Diagnostic imaging summary report (record artifact)	4180186
3566317	Fluoroscopic angiography of subclavian artery (procedure)	4180186
3566317	Subclavian angiogram	4180186
3566318	External carotid angiogram	4180186
3566318	Fluoroscopic angiography of external carotid artery (procedure)	4180186
3566321	Haloperidol decanoate 100mg/1ml solution for injection ampoules (product)	4180186
3566323	Cardiac arrest due to respiratory disorder (disorder)	4180186
3566326	Assessment by multidisciplinary team NEC (regime/therapy)	4180186
3566328	Sodium chloride 0.9% solution for injection 5ml vials (product)	4180186
3566330	Squill opiate linctus (product)	4180186
3566331	Patient requests referral (situation)	4180186
3566334	No current contraception (finding)	4180186
3566335	Self-monitoring of alcohol intake (regime/therapy)	4180186
3566336	XMET Homidon mix	4180186
3566339	Other specified operations covering multiple systems (procedure)	4180186
3566340	Anencephalus and similar anomalies NOS (disorder)	4180186
3566341	Amputation of foot NOS (procedure)	4180186
3566342	Other mosquito-borne fever (disorder)	4180186
3566344	Arrange other care (regime/therapy)	4180186
3566345	Drug reaction to analgesic NOS (disorder)	4180186
3566347	Transplantation of ileum (procedure)	4180186
3566348	Human papillomavirus vaccination (procedure)	4180186
3566350	Beractant 200mg/8ml endotracheopulmonary suspension bottles (product)	4180186
3566354	Reconstruction of femoral or popliteal artery NOS (procedure)	4180186
3566355	US scan and drainage of breast (procedure)	4180186
3566361	US scan and aspiration of thyroid (procedure)	4180186
3566363	Will donate pancreas (finding)	4180186
3566364	Chemical destruction of sympathetic nerve NOS (procedure)	4180186
3566364	Chemical extirpation of sympathetic nerve NOS	4180186
3566366	Tuberculous pleurisy NOS (disorder)	4180186
3566370	Rose Donald stoma belt	4180186
3566373	Repair of univentricular heart NOS (procedure)	4180186
3566377	Referral for general practice carer's assessment (procedure)	4180186
3566378	Difficulty managing medication due to special needs (finding)	4180186
3566381	Plain X-ray of bone	4180186
3566381	X-ray of bone (procedure)	4180186
3566384	Transplantation of thymus gland NOS (procedure)	4180186
3566387	Replacement of medial canthal tendon using periosteal strip (procedure)	4180186
3566390	Unspecified non-suppurative otitis media (disorder)	4180186
3566391	Other benign mammary dysplasia (disorder)	4180186
3566392	Other specified harvest of tendon (procedure)	4180186
3566394	Palivizumab 50mg powder and solvent for solution for injection vials (product)	4180186
3566401	Iotrolan 240mg(I)/mL injection (product)	4180186
3566402	Medial aspect of first metatarsophalangeal joint (body structure)	4180186
3566406	Secondary dressing (finding)	4180186
3566406	Secondary dressing (physical object)	4180186
3566411	Endovascular placement of one fenestrated stent graft (procedure)	4180186
3566419	Fluoroscopic guidance for percutaneous transjugular biopsy of liver	4180186
3566419	Fluoroscopy guided percutaneous transjugular biopsy of liver (procedure)	4180186
3566423	Replacement of aneurysmal iliac artery by anastomosis of femoral artery to femoral artery NEC (procedure)	4180186
3566424	Pathological dislocation NOS (disorder)	4180186
3566426	Other specified delivery of oral chemotherapy for neoplasm (regime/therapy)	4180186
3566427	Excision of lesion of vein NEC (procedure)	4180186
3566436	Gentamicin 80mg/2ml solution for injection vials (product)	4180186
3566440	Is manifestation of (link assertion)	4180186
3566443	Main spoken language Oriya (finding)	4180186
3566444	Glucometer Esprit 2 blood glucose meter	4180186
3566445	Heart failure medication review (procedure)	4180186
3566446	Other orthodontic operations (procedure)	4180186
3566447	Fluoroscopic percutaneous angiography of superficial femoral artery with insertion of stent graft (procedure)	4180186
3566451	Fibreoptic endoscopic removal of gastrostomy tube (procedure)	4180186
3566454	Insertion of retropubic device for female stress urinary incontinence NEC (procedure)	4180186
3566456	Primary laser foraminoplasty of cervical spine (procedure)	4180186
3566457	Jet nebuliser system	4180186
3566457	Nebuliser+compressor	4180186
3566458	Magnetic resonance imaging of orbit with contrast (procedure)	4180186
3566460	Intravenous injection of antimicrobial therapy (procedure)	4180186
3566462	Abdominal vascular structure angiogram	4180186
3566462	Fluoroscopic angiography of abdominal vascular structure (procedure)	4180186
3566464	Computed tomography of head and thorax (procedure)	4180186
3566467	Defaecating proctogram	4180186
3566467	Radionuclide defaecating proctography (procedure)	4180186
3566470	Promazine 25mg/5ml oral solution (product)	4180186
3566480	Fluoroscopic guidance for sialoplasty	4180186
3566480	Fluoroscopy guided sialoplasty (procedure)	4180186
3566480	Sialoplasty	4180186
3566482	Management and policy - National Public Health Classification (administrative concept)	4180186
3566485	Retinopexy using cryotherapy (procedure)	4180186
