concept_id	concept_synonym_name	language_concept_id
4349005	DLV - Dermatome of fifth lumbar nerve	4180186
4349005	Dermatome of L5	4180186
4349005	Dermatome of fifth lumbar nerve (body structure)	4180186
4349005	DL5 - Dermatome of fifth lumbar nerve	4180186
4349007	Dermatome of Ccx1	4180186
4349007	Dermatome of first coccygeal nerve (body structure)	4180186
4349010	Entire parietal region of scalp (body structure)	4180186
4349011	Skin structure of rim of external ear (body structure)	4180186
4349011	Skin structure of rim of external ear	4180186
4349011	Skin of border of pinna	4180186
4349011	Skin of rim of external ear (body structure)	4180186
4349011	Skin of border of external ear	4180186
4349013	Entire skin of postauricular region (body structure)	4180186
4349013	Entire retroauricular skin	4180186
4349014	Glabella skin structure	4180186
4349014	Glabella skin structure (body structure)	4180186
4349014	Glabella skin (body structure)	4180186
4349112	Skin structure of external naris	4180186
4349112	Skin structure of external naris (body structure)	4180186
4349112	Skin of external naris (body structure)	4180186
4349115	Structure of skin of point of chin	4180186
4349115	Structure of skin of point of chin (body structure)	4180186
4349115	Skin of point of chin (body structure)	4180186
4349116	Skin structure of anterolateral surface of neck (body structure)	4180186
4349116	Skin structure of anterolateral surface of neck	4180186
4349116	Skin of anterolateral surface of neck (body structure)	4180186
4349117	Skin structure of anterior surface of thorax (body structure)	4180186
4349117	Skin structure of anterior surface of thorax	4180186
4349117	Skin of anterior surface of thorax (body structure)	4180186
4349117	Skin of front of chest	4180186
4349117	Skin of front of thorax	4180186
4349119	Skin structure of shaft of penis (body structure)	4180186
4349119	Skin structure of shaft of penis	4180186
4349119	Skin of shaft of penis (body structure)	4180186
4349121	Entire skin of shoulder (body structure)	4180186
4349122	Skin structure over biceps (body structure)	4180186
4349122	Skin structure over biceps	4180186
4349122	Skin over biceps (body structure)	4180186
4349123	Skin structure of posterolateral region of upper arm (body structure)	4180186
4349123	Skin of posterolateral surface of arm	4180186
4349124	Entire skin of medial surface of arm	4180186
4349124	Entire skin of medial surface of upper arm (body structure)	4180186
4349124	Entire skin of inside of arm	4180186
4349130	Skin structure of digit of hand (body structure)	4180186
4349130	Skin of fingers and thumb	4180186
4349132	Skin structure of posterolateral surface of knee (body structure)	4180186
4349132	Skin structure of posterolateral surface of knee	4180186
4349132	Skin of posterolateral surface of knee (body structure)	4180186
4349134	Intervertebral discal level (body structure)	4180186
4349134	Intervertebral discal plane	4180186
4349134	Plane of intervertebral discs	4180186
4349135	Level of C5/C6 intervertebral disc (body structure)	4180186
4349136	Level of T1/T2 intervertebral disc (body structure)	4180186
4349137	Level of T3/T4 intervertebral disc (body structure)	4180186
4349138	Level of T4/T5 intervertebral disc (body structure)	4180186
4349140	Level of L2/L3 intervertebral disc (body structure)	4180186
4349141	Plane of inter-regional intervertebral discs	4180186
4349141	Level of inter-regional intervertebral discs	4180186
4349141	Inter-regional intervertebral discal level (body structure)	4180186
4349141	Inter-regional intervertebral discal plane	4180186
4349142	Level of T12/L1 intervertebral disc (body structure)	4180186
4349142	Level of thoracolumbar intervertebral disc	4180186
4349142	Plane of thoracolumbar intervertebral disc	4180186
4349143	Entire ICS - Intercostal space	4180186
4349143	Entire intercostal space (body structure)	4180186
4349240	Entire eighth intercostal space (body structure)	4180186
4349241	Entire thoracic cavity (body structure)	4180186
4349244	Entire inguinal region (body structure)	4180186
4349245	Structure of posterior abdominal surface region (body structure)	4180186
4349245	Structure of posterior abdominal surface region	4180186
4349245	Region of posterior abdominal wall	4180186
4349245	Posterior abdominal surface region (body structure)	4180186
4349246	Structure of surface region of renal area (body structure)	4180186
4349246	Surface region of renal area	4180186
4349246	Structure of surface region of renal area	4180186
4349246	Renal area (surface region) (body structure)	4180186
4349246	Renal area	4180186
4349249	Entire region of retroperitoneal space (body structure)	4180186
4349250	Structure of retroduodenal area (body structure)	4180186
4349250	Structure of retroduodenal area	4180186
4349250	Retroduodenal area (body structure)	4180186
4349253	Structure of surface region of ring finger (body structure)	4180186
4349253	Structure of surface region of ring finger	4180186
4349253	Surface region of ring finger (body structure)	4180186
4349253	Region of ring finger	4180186
4349256	Dermatome of ophthalmic nerve (body structure)	4180186
4349256	Dermatome of V1	4180186
4349257	Dermatome of mandibular nerve (body structure)	4180186
4349257	Dermatome of V3	4180186
4349259	Dermatome of cervical nerve (body structure)	4180186
4349259	Dermatome of C1-C8	4180186
4349260	DCVI - Dermatome of sixth cervical nerve	4180186
4349260	Dermatome of C6	4180186
4349260	DC6 - Dermatome of sixth cervical nerve	4180186
4349260	Dermatome of sixth cervical nerve (body structure)	4180186
4349261	Dermatome of thoracic nerve (body structure)	4180186
4349261	Dermatome of T1-T12	4180186
4349263	Dermatome of third thoracic nerve (body structure)	4180186
4349263	Dermatome of T3	4180186
4349263	DT3 - Dermatome of third thoracic nerve	4180186
4349263	DTIII - Dermatome of third thoracic nerve	4180186
4349265	DTVIII - Dermatome of eighth thoracic nerve	4180186
4349265	Dermatome of T8	4180186
4349265	Dermatome of eighth thoracic nerve (body structure)	4180186
4349265	DT8 - Dermatome of eighth thoracic nerve	4180186
4349268	Dermatome of L1-L5	4180186
4349268	Dermatome of lumbar nerve (body structure)	4180186
4349269	DL1 - Dermatome of first lumbar nerve	4180186
4349269	Dermatome of L1	4180186
4349269	DLI - Dermatome of first lumbar nerve	4180186
4349269	Dermatome of first lumbar nerve (body structure)	4180186
4349273	Entire skin of ala nasi (body structure)	4180186
4349273	Entire skin of alae of nose	4180186
4349275	Entire skin of tip of nose (body structure)	4180186
4349276	Skin structure under chin	4180186
4349276	Skin structure under chin (body structure)	4180186
4349276	Skin under chin (body structure)	4180186
4349278	Entire skin of labium minus (body structure)	4180186
4349278	Entire skin of labium minor	4180186
4349378	Entire skin of limb	4180186
4349378	Entire skin of extremity (body structure)	4180186
4349379	Entire skin of upper extremity (body structure)	4180186
4349379	Entire skin of upper limb	4180186
4349381	Entire skin of deltoid region (body structure)	4180186
4349381	Entire skin over deltoid	4180186
4349382	Skin structure of posterolateral surface of elbow	4180186
4349382	Skin structure of posterolateral surface of elbow (body structure)	4180186
4349382	Skin of posterolateral surface of elbow (body structure)	4180186
4349383	Entire skin of tip of elbow	4180186
4349383	Entire skin of olecranal region (body structure)	4180186
4349384	Skin of surface of forearm (body structure)	4180186
4349386	Skin structure of medial border of hand (body structure)	4180186
4349386	Skin structure of medial border of hand	4180186
4349386	Skin of medial border of hand (body structure)	4180186
4349386	Skin of medial edge of hand	4180186
4349388	Skin structure of dorsal surface of web of finger	4180186
4349388	Skin structure of dorsal surface of web of finger (body structure)	4180186
4349388	Skin of dorsal surface of web of finger (body structure)	4180186
4349390	Skin structure of anterolateral surface of thigh	4180186
4349390	Skin structure of anterolateral surface of thigh (body structure)	4180186
4349390	Skin of anterolateral surface of thigh (body structure)	4180186
4349392	Entire skin over lateral margin of sole	4180186
4349392	Entire skin of lateral border of sole of foot (body structure)	4180186
4349395	Structure of internal carotid-anterior choroidal artery zone (body structure)	4180186
4349395	Structure of internal carotid-anterior choroidal artery zone	4180186
4349395	Internal carotid-anterior choroidal artery zone (body structure)	4180186
4349396	Entire PICA - Posterior inferior cerebellar artery	4180186
4349396	Entire posterior inferior cerebellar artery (body structure)	4180186
4349398	Entire thyrocervical trunk (body structure)	4180186
4349399	Entire LPA - Left pulmonary artery	4180186
4349399	Entire left pulmonary artery (body structure)	4180186
4349402	Structure of foot artery	4180186
4349402	Structure of foot artery (body structure)	4180186
4349402	Foot artery (body structure)	4180186
4349409	Entire tricuspid papillary muscle	4180186
4349409	Entire papillary muscles of right ventricle (body structure)	4180186
4349511	Structure of junction of saphenous vein	4180186
4349511	Structure of junction of saphenous vein (body structure)	4180186
4349511	Junction of saphenous vein (body structure)	4180186
4349513	Structure of cerebellar meninges (body structure)	4180186
4349513	Structure of cerebellar meninges	4180186
4349513	Cerebellar meninges (body structure)	4180186
4349515	Structure of orbital meninges	4180186
4349515	Structure of orbital meninges (body structure)	4180186
4349515	Orbital meninges (body structure)	4180186
4349517	Structure of cervical subarachnoid space (body structure)	4180186
4349517	Structure of cervical subarachnoid space	4180186
4349517	Cervical subarachnoid space (body structure)	4180186
4349519	Structure of ulnar digital nerve of index finger (body structure)	4180186
4349519	Structure of ulnar digital nerve of index finger	4180186
4349519	Ulnar digital nerve of index finger (body structure)	4180186
4349520	Structure of ulnar digital nerve of ring finger (body structure)	4180186
4349520	Structure of ulnar digital nerve of ring finger	4180186
4349520	Ulnar digital nerve of ring finger (body structure)	4180186
4349521	Structure of radial digital nerve of ring finger	4180186
4349521	Structure of radial digital nerve of ring finger (body structure)	4180186
4349521	Radial digital nerve of ring finger (body structure)	4180186
4349524	Entire superior hypogastric plexus (body structure)	4180186
4349524	Entire presacral nerve	4180186
4349525	Structure of mid-zone retina (body structure)	4180186
4349525	Structure of mid-zone retina	4180186
4349525	Mid-zone retina (body structure)	4180186
4349529	Entire joint of vertebral bodies within region (body structure)	4180186
4349531	Entire intervertebral symphysis between T5 and T6 (body structure)	4180186
4349531	Entire intervertebral symphysis between T5 and T6	4180186
4349531	Entire joint between bodies of T5 and T6 (body structure)	4180186
4349532	Entire intervertebral symphysis between T9 and T10	4180186
4349532	Entire intervertebral symphysis between T9 and T10 (body structure)	4180186
4349532	Entire joint between bodies of T9 and T10 (body structure)	4180186
4349533	Joint between bodies of C7 and T1 (body structure)	4180186
4349535	Structure of lateral femorotibial joint	4180186
4349535	Structure of lateral femorotibial joint (body structure)	4180186
4349535	Lateral femorotibial joint (body structure)	4180186
4349536	Compartment of knee (body structure)	4180186
4349536	Structure of compartment of knee	4180186
4349536	Structure of compartment of knee (body structure)	4180186
4349538	Lateral compartment of knee (body structure)	4180186
4349538	Structure of lateral compartment of knee (body structure)	4180186
4349538	Structure of lateral compartment of knee	4180186
4349540	Structure of intercuneiform joint (body structure)	4180186
4349540	Structure of intercuneiform joint	4180186
4349540	Intercuneiform joint (body structure)	4180186
4349542	Structure of ligament of head and neck (body structure)	4180186
4349542	Ligament of head and neck	4180186
4349544	Entire lateral ligament of temporomandibular joint (body structure)	4180186
4349544	Entire lateral temporomandibular ligament	4180186
4349545	Entire Sphenomandibular ligament	4180186
4349545	Entire sphenomandibular ligament of temporomandibular joint (body structure)	4180186
4349645	C7/T1 part of supraspinous ligament	4180186
4349645	Cervicothoracic part of supraspinous ligament (body structure)	4180186
4349646	T12/L1 part of supraspinous ligament	4180186
4349646	Thoracolumbar part of supraspinous ligament (body structure)	4180186
4349647	Part of anterior longitudinal ligament (body structure)	4180186
4349648	Entire superior pubic ligament (body structure)	4180186
4349650	Structure of capsular ligament of shoulder joint	4180186
4349650	Structure of capsular ligament of shoulder joint (body structure)	4180186
4349650	Capsular ligament of shoulder joint (body structure)	4180186
4349652	Structure of intercarpal ligament (body structure)	4180186
4349652	Structure of intercarpal ligament	4180186
4349652	Intercarpal ligament (body structure)	4180186
4349654	Structure of collateral ligament of midcarpal joint (body structure)	4180186
4349654	Structure of collateral ligament of midcarpal joint	4180186
4349654	Collateral ligament of midcarpal joint (body structure)	4180186
4349655	Structure of ligament of thumb	4180186
4349655	Structure of ligament of thumb (body structure)	4180186
4349655	Ligament of thumb (body structure)	4180186
4349657	Structure of capsular ligament of knee joint (body structure)	4180186
4349657	Structure of capsular ligament of knee joint	4180186
4349657	Capsular ligament of knee joint (body structure)	4180186
4349658	Structure of intracapsular ligament of knee joint (body structure)	4180186
4349658	Structure of intracapsular ligament of knee joint	4180186
4349658	Intracapsular ligament of knee joint (body structure)	4180186
4349662	Entire ligament of foot (body structure)	4180186
4349663	Entire macula densa (body structure)	4180186
4349665	Entire eighth rib (body structure)	4180186
4349671	Tibial intercondylar tubercle (body structure)	4180186
4349671	Tibial tubercle	4180186
4349672	Entire CC - Costal cartilage	4180186
4349672	Entire costal cartilage (body structure)	4180186
4349677	Entire sixth costal cartilage (body structure)	4180186
4349679	Entire eleventh costal cartilage (body structure)	4180186
4349680	Structure of modiolar muscle group (body structure)	4180186
4349680	Modiolar muscle group	4180186
4349681	Entire cruciate modiolar muscle (body structure)	4180186
4349774	Entire orbicularis oculi (body structure)	4180186
4349775	Entire depressor supercilii muscle (body structure)	4180186
4349775	Entire depressor supercilii	4180186
4349776	Entire depressor septi (body structure)	4180186
4349779	Entire malaris muscle	4180186
4349779	Entire malaris muscle (body structure)	4180186
4349779	Entire Malaris muscle	4180186
4349779	Entire malaris (body structure)	4180186
4349781	Circumoral muscle (body structure)	4180186
4349785	Entire auricularis anterior	4180186
4349785	Entire anterior auricularis muscle (body structure)	4180186
4349787	Entire Tragicus	4180186
4349787	Entire tragicus muscle (body structure)	4180186
4349791	Entire left subclavian artery (body structure)	4180186
4349792	Structure of branch of left coronary artery (body structure)	4180186
4349792	Structure of branch of left coronary artery	4180186
4349792	Branch of left coronary artery (body structure)	4180186
4349794	Entire first obtuse marginal branch of circumflex branch of left coronary artery (body structure)	4180186
4349794	Entire marginal 1 artery	4180186
4349794	Entire m1 - Marginal 1 artery	4180186
4349796	Entire HA - Hepatic artery	4180186
4349796	Entire hepatic artery proper (body structure)	4180186
4349798	Entire right colic artery (body structure)	4180186
4349801	Structure of anterior division of internal iliac artery (body structure)	4180186
4349801	Structure of anterior division of internal iliac artery	4180186
4349801	Anterior division of internal iliac artery (body structure)	4180186
4349802	Entire posterior scrotal branch of internal pudendal artery (body structure)	4180186
4349802	Entire posterior scrotal artery	4180186
4349803	Entire dorsal artery of clitoris (body structure)	4180186
4349804	Entire external pudendal artery (body structure)	4180186
4349808	Entire radialis indicis artery (body structure)	4180186
4349919	Structure of circumflex iliac artery (body structure)	4180186
4349919	Structure of circumflex iliac artery	4180186
4349919	Circumflex iliac artery (body structure)	4180186
4349921	Entire genicular artery (body structure)	4180186
4349923	Entire left (non-mitral) atrioventricular valve (body structure)	4180186
4349925	Structure of anterior mitral chordae	4180186
4349925	Structure of anterior mitral chordae (body structure)	4180186
4349925	Anterior mitral chordae (body structure)	4180186
4349926	Entire tricuspid chordae tendinae	4180186
4349926	Entire chordae tendineae of tricuspid valve (body structure)	4180186
4349927	Entire SFJ - Saphenofemoral junction	4180186
4349927	Entire saphenofemoral junction (body structure)	4180186
4349928	Structure of saphenopopliteal junction	4180186
4349928	Structure of saphenopopliteal junction (body structure)	4180186
4349928	Saphenopopliteal junction (body structure)	4180186
4349931	Structure of petroclival meninges	4180186
4349931	Structure of petroclival meninges (body structure)	4180186
4349931	Petroclival meninges (body structure)	4180186
4349934	Entire subarachnoid space of spinal cord	4180186
4349934	Entire spinal subarachnoid space (body structure)	4180186
4349935	Structure of sacral subarachnoid space	4180186
4349935	Structure of sacral subarachnoid space (body structure)	4180186
4349935	Sacral subarachnoid space (body structure)	4180186
4349938	Optic chiasm	4180186
4349938	Optic chiasma	4180186
4349938	Structure of optic chiasma (body structure)	4180186
4349940	Structure of ulnar digital nerve of thumb (body structure)	4180186
4349940	Structure of ulnar digital nerve of thumb	4180186
4349940	Ulnar digital nerve of thumb (body structure)	4180186
4349941	Structure of ulnar digital nerve of little finger (body structure)	4180186
4349941	Structure of ulnar digital nerve of little finger	4180186
4349941	Ulnar digital nerve of little finger (body structure)	4180186
4349946	Structure of posterior tibial nerve at ankle	4180186
4349946	Structure of posterior tibial nerve at ankle (body structure)	4180186
4349946	Posterior tibial nerve at ankle (body structure)	4180186
4349947	Structure of plantar digital nerve of third web space	4180186
4349947	Structure of plantar digital nerve of third web space (body structure)	4180186
4349947	Plantar digital nerve of third web space (body structure)	4180186
4349948	Entire glomerular urinary pole (body structure)	4180186
4349952	Structure of peripheral cornea (body structure)	4180186
4349952	Structure of peripheral cornea	4180186
4349952	Peripheral cornea (body structure)	4180186
4349953	Entire anterior chamber angle	4180186
4349953	Entire iridocorneal angle (body structure)	4180186
4349957	Entire intervertebral symphysis between T1 and T2 (body structure)	4180186
4349957	Entire intervertebral symphysis between T1 and T2	4180186
4349957	Entire joint between bodies of T1 and T2 (body structure)	4180186
4351712	Entire intervertebral symphysis between T2 and T3 (body structure)	4180186
4351712	Entire intervertebral symphysis between T2 and T3	4180186
4351712	Entire joint between bodies of T2 and T3 (body structure)	4180186
4351723	Entire tibiofibular joint (body structure)	4180186
4351724	Structure of soft tissue joint component	4180186
4351724	Structure of soft tissue joint component (body structure)	4180186
4351724	Soft tissue joint component (body structure)	4180186
4351726	Structure of intervertebral disc of L6 and S1	4180186
4351726	Structure of intervertebral disc of L6 and S1 (body structure)	4180186
4351727	Entire supraspinous ligament (body structure)	4180186
4351728	L5/S1 part of supraspinous ligament	4180186
4351728	Lumbosacral part of supraspinous ligament (body structure)	4180186
4351729	Structure of paired intervertebral syndesmosis	4180186
4351729	Structure of paired intervertebral syndesmosis (body structure)	4180186
4351729	Paired intervertebral syndesmosis (body structure)	4180186
4351732	Entire posterior longitudinal ligament (body structure)	4180186
4351735	Structure of ligament of radioulnar joint (body structure)	4180186
4351735	Structure of ligament of radioulnar joint	4180186
4351735	Ligament of radioulnar joint (body structure)	4180186
4351736	Entire ligament of head of femur	4180186
4351736	Entire ligament of the head of the femur (body structure)	4180186
4351737	Structure of accessory ligament of knee joint (body structure)	4180186
4351737	Structure of accessory ligament of knee joint	4180186
4351737	Accessory ligament of knee joint (body structure)	4180186
4351740	Entire fifth rib (body structure)	4180186
4351741	Entire midtarsal bone of foot (body structure)	4180186
4351742	Entire proximal phalanx of lesser toe (body structure)	4180186
4351743	Entire sesamoid bone of foot (body structure)	4180186
4351748	Structure of lower border of mandible	4180186
4351748	Structure of lower border of mandible (body structure)	4180186
4351748	Lower border of mandible (body structure)	4180186
4351849	Entire proximal femoral epiphysis	4180186
4351849	Entire proximal epiphysis of femur (body structure)	4180186
4351849	Entire upper femoral epiphysis	4180186
4351850	Entire second costal cartilage (body structure)	4180186
4351851	Entire seventh costal cartilage (body structure)	4180186
4351852	Skin structure over instep of foot (body structure)	4180186
4351852	Skin structure over instep of foot	4180186
4351852	Skin over instep of foot (body structure)	4180186
4351856	Skin structure of plantar surface of web of toe	4180186
4351856	Skin structure of plantar surface of web of toe (body structure)	4180186
4351856	Skin of plantar surface of web of toe (body structure)	4180186
4351857	Nail bed of toe	4180186
4351857	Structure of nail bed of toe (body structure)	4180186
4351859	Entire anterior inferior cerebellar artery (body structure)	4180186
4351859	Entire AICA - Anterior inferior cerebellar artery	4180186
4351861	Entire superior thyroid artery (body structure)	4180186
4351863	Structure of spinal artery	4180186
4351863	Structure of spinal artery (body structure)	4180186
4351863	Spinal artery (body structure)	4180186
4351864	Structure of right aortic arch (body structure)	4180186
4351864	Structure of right aortic arch	4180186
4351864	Right aortic arch (body structure)	4180186
4351868	Entire IMA - Internal mammary artery	4180186
4351868	Entire internal thoracic artery (body structure)	4180186
4351868	Entire ITA - Internal thoracic artery	4180186
4351873	Structure of intermediate artery (body structure)	4180186
4351873	Intermediate artery	4180186
4351873	Ramus intermedius artery	4180186
4351874	Entire left dominant posterior descending artery	4180186
4351874	Entire left posterior descending branch of circumflex branch of left coronary artery (body structure)	4180186
4351874	Entire LPDA - Left dominant posterior descending artery	4180186
4351875	Entire left branch of hepatic artery (body structure)	4180186
4351875	Entire left hepatic artery	4180186
4351878	Entire gastroduodenal artery (body structure)	4180186
4351882	Entire superior rectal artery (body structure)	4180186
4351883	Entire testicular artery (body structure)	4180186
4351978	Entire Bowman space	4180186
4351978	Entire Bowman's space (body structure)	4180186
4351979	Entire superior epigastric artery (body structure)	4180186
4351981	Structure of superficial inferior epigastric artery	4180186
4351981	Structure of superficial inferior epigastric artery (body structure)	4180186
4351981	Superficial inferior epigastric artery (body structure)	4180186
4351982	Entire dorsal artery of penis (body structure)	4180186
4351983	Entire deep artery of clitoris (body structure)	4180186
4351986	Structure of circumflex scapular artery	4180186
4351986	Structure of circumflex scapular artery (body structure)	4180186
4351986	Circumflex scapular artery (body structure)	4180186
4351990	Structure of malleolar artery	4180186
4351990	Structure of malleolar artery (body structure)	4180186
4351990	Malleolar artery (body structure)	4180186
4351992	Entire mitral papillary muscle	4180186
4351992	Entire papillary muscles of left ventricle (body structure)	4180186
4351998	Structure of meninges of convexity	4180186
4351998	Structure of meninges of convexity (body structure)	4180186
4351998	Meninges of convexity (body structure)	4180186
4351999	Entire dorsal thalamus	4180186
4351999	Entire thalamus (body structure)	4180186
4352003	Structure of sacral subdural space	4180186
4352003	Structure of sacral subdural space (body structure)	4180186
4352003	Sacral subdural space (body structure)	4180186
4352004	Structure of dorsal subarachnoid space	4180186
4352004	Structure of dorsal subarachnoid space (body structure)	4180186
4352004	Dorsal subarachnoid space (body structure)	4180186
4352005	Entire cranial nerve ganglion (body structure)	4180186
4352006	Structure of glossopharyngeal ganglion	4180186
4352006	Structure of glossopharyngeal ganglion (body structure)	4180186
4352006	Glossopharyngeal ganglion (body structure)	4180186
4352009	Structure of radial digital nerve of thumb (body structure)	4180186
4352009	Structure of radial digital nerve of thumb	4180186
4352009	Radial digital nerve of thumb (body structure)	4180186
4352011	Structure of median nerve at elbow (body structure)	4180186
4352011	Structure of median nerve at elbow	4180186
4352011	Median nerve at elbow (body structure)	4180186
