concept_id	concept_synonym_name	language_concept_id
3537311	Scleritis or episcleritis NOS (disorder)	4180186
3537312	Other scleral degenerative disorders (disorder)	4180186
3537313	Unspecified simple hemorrhoids (disorder)	4180186
3537314	Anal and rectal skin tags NOS (disorder)	4180186
3537317	Kidney/ureter disorder NOS (disorder)	4180186
3537320	Nontraffic accident involving collision, not on public highway, between motor vehicle, except off-road vehicle, and stationary object NOS, driver of motor vehicle injured (event)	4180186
3537322	Pneumonitis due to inhalation of solid or liquid NOS (disorder)	4180186
3537324	Recurrent manic episode NOS (disorder)	4180186
3537326	Acute alcoholic intoxication, unspecified, in alcoholism (disorder)	4180186
3537328	Extirpation of scrotum NOS (procedure)	4180186
3537331	Other specified soft tissue operation on joint of toe (procedure)	4180186
3537334	Total prosthetic replacement of other joint using cement (procedure)	4180186
3537335	Primary cemented total replacement of joint NEC (procedure)	4180186
3537338	Other specified excision or biopsy of lymph node (procedure)	4180186
3537340	Other specified drainage of lesion of lymph node (procedure)	4180186
3537341	Other B-complex deficiency NOS (disorder)	4180186
3537342	Vitamin B deficiency NOS (disorder)	4180186
3537350	Other specified operations on chest wall, pleura or diaphragm (procedure)	4180186
3537351	Chest wall, pleura and diaphragm operations NOS (procedure)	4180186
3537352	Other specified simple excision of inguinal hernial sac (procedure)	4180186
3537354	Primary repair of inguinal hernia NOS (procedure)	4180186
3537356	Repair of recurrent inguinal hernia NOS (procedure)	4180186
3537358	Primary repair of femoral hernia NOS (procedure)	4180186
3537360	Other specified repair of umbilical hernia (procedure)	4180186
3537361	Repair of umbilical hernia NOS (procedure)	4180186
3537363	Primary repair of incisional hernia NOS (procedure)	4180186
3537366	Foot joint operations NOS (procedure)	4180186
3537369	Respiratory obstruction caused by foreign body in esophagus NOS (disorder)	4180186
3537370	Thyroid incision NOS (procedure)	4180186
3537371	Non-surgical endocrine biopsy NOS (procedure)	4180186
3537372	Non-surgical biopsy nervous system NOS (procedure)	4180186
3537373	Inner ear operation NOS (procedure)	4180186
3537375	Malignant neoplasm of laryngeal cartilage NOS (disorder)	4180186
3537378	Monocytic leukemia NOS (disorder)	4180186
3537381	Benign neoplasm of corpus uteri NOS (disorder)	4180186
3537382	Benign neoplasm of other specified site of urinary tract NOS (disorder)	4180186
3537384	Other specified operation on lymphatic duct (procedure)	4180186
3537387	Fixation of bone of face NOS (procedure)	4180186
3537388	Osteotomy of alveolar segment of jaw NEC (procedure)	4180186
3537389	Division of jaw NOS (procedure)	4180186
3537392	Primary intertransverse fusion lumbar spine NEC (procedure)	4180186
3537393	Reduction of fracture of maxilla NOS (procedure)	4180186
3537398	Other specified revisional decompression of cervical spine (procedure)	4180186
3537399	Revisional decompression of cervical spine NOS (procedure)	4180186
3537400	Malignant neoplasm of other specified site of stomach (disorder)	4180186
3537401	Malignant neoplasm of posterior wall of stomach NEC (disorder)	4180186
3537402	Malignant neoplasm of other specified site of stomach NOS (disorder)	4180186
3537404	Malignant neoplasm of small intestine NOS (disorder)	4180186
3537405	Malignant neoplasm of other specified sites of colon (disorder)	4180186
3537407	Malignant neoplasm of connective and soft tissue of pelvis NOS (disorder)	4180186
3537408	Primary malignant neoplasm of liver NOS (disorder)	4180186
3537409	Malignant neoplasm of intrahepatic bile ducts NOS (disorder)	4180186
3537410	Distant fasciocutaneous flap NOS (procedure)	4180186
3537411	Severe pre-eclampsia unspecified (disorder)	4180186
3537413	Stiff subtalar joint NEC (finding)	4180186
3537414	Stiff 1st metatarsophalangeal joint NEC (finding)	4180186
3537416	Other specified mouth and pharynx anomalies (disorder)	4180186
3537417	Other mouth and pharynx anomalies NOS (disorder)	4180186
3537420	Other internal knee derangement NOS (disorder)	4180186
3537422	Hemarthrosis of other tarsal joint (disorder)	4180186
3537424	Villonodular synovitis of unspecified site (disorder)	4180186
3537425	Villonodular synovitis of other specified site (disorder)	4180186
3537426	Villonodular synovitis of other tarsal joint (disorder)	4180186
3537428	Animal-drawn vehicle accident involving being run over by animal-drawn vehicle, other specified person injured (event)	4180186
3537429	Superficial injury of trunk NOS, without major open wound or mention of infection (disorder)	4180186
3537432	Superficial injury of breast NOS, without major open wound (disorder)	4180186
3537434	Superficial injury of buttock NOS, without major open wound (disorder)	4180186
3537435	Oxytocic agent poisoning NOS (disorder)	4180186
3537436	Smooth muscle relaxant poisoning NOS (disorder)	4180186
3537437	Other muscle drug poisoning (disorder)	4180186
3537438	Antitussive poisoning NOS (disorder)	4180186
3537439	Expectorant poisoning NOS (disorder)	4180186
3537447	Insect bite, nonvenomous, of head, infected, NOS (disorder)	4180186
3537448	Splinter of head, without major open wound, infected, NOS (disorder)	4180186
3537450	Superficial injury of neck NOS (disorder)	4180186
3537451	Unspecified cervical cord injury, without bony injury, C5-7 (disorder)	4180186
3537452	Other scapular region injuries (disorder)	4180186
3537453	Other shoulder injuries (disorder)	4180186
3537454	Unspecified thoracic cord injury, without bony injury, T1-6 (disorder)	4180186
3537455	Other upper arm injuries (disorder)	4180186
3537456	Incomplete thoracic cord injury, unspecified, without bony injury, T1-6 (disorder)	4180186
3537463	Other specified peripheral vascular disease NOS (disorder)	4180186
3537472	Female infertility NOS (disorder)	4180186
3537473	Other female genital organ disorder (disorder)	4180186
3537475	Other repair of organ NOC (procedure)	4180186
3537476	Stretching of organ NOC (procedure)	4180186
3537477	Stapling of organ NOC (procedure)	4180186
3537479	Examination of organ NOC (procedure)	4180186
3537484	Other idiopathic peripheral neuropathy (disorder)	4180186
3537486	Acute infective polyneuritis NOS (disorder)	4180186
3537489	Retinal partial arterial occlusion NOS (disorder)	4180186
3537490	Retinal vascular occlusion NOS (disorder)	4180186
3537492	Hemorrhoids NOS (disorder)	4180186
3537494	Other lymphedema NOS (disorder)	4180186
3537495	Other specified removal of skin or subcutaneous tissue (procedure)	4180186
3537498	Other specified split autograft of skin (procedure)	4180186
3537501	Other echinococcus granulosus (disorder)	4180186
3537502	Other echinococcus multilocularis (disorder)	4180186
3537505	Extended excision of right hemicolon NOS (procedure)	4180186
3537508	Other specified other excision of right hemicolon (procedure)	4180186
3537511	Other specified excision of transverse colon (procedure)	4180186
3537512	Excision of transverse colon NOS (procedure)	4180186
3537513	Left hemicolectomy and exteriorization of bowel NEC (procedure)	4180186
3537514	Other specified excision of left hemicolon (procedure)	4180186
3537515	Malignant neoplasm of lip unspecified, inner aspect (disorder)	4180186
3537517	Respiratory conditions due to chemical fumes NOS (disorder)	4180186
3537518	Pneumonitis due to inhalation of food or vomitus NOS (disorder)	4180186
3537519	Other upper respiratory tract diseases NOS (disorder)	4180186
3537521	Feet deformities NOS (disorder)	4180186
3537524	Other nonteratogenic anomalies OS (disorder)	4180186
3537526	Other accessory toe (disorder)	4180186
3537528	Other toe anomalies NOS (disorder)	4180186
3537532	Anomalies of foot NEC NOS (disorder)	4180186
3537535	Specified syndromes involving skin anomalies NEC NOS (disorder)	4180186
3537536	Congenital malformation syndrome involving limbs NOS (disorder)	4180186
3537538	Bone infection NOS, of multiple sites (disorder)	4180186
3537540	Penile disorders NOS (disorder)	4180186
3537541	Seminal vesiculitis NOS (disorder)	4180186
3537542	Torsion of testis unspecified (disorder)	4180186
3537543	Torsion of testis NOS (disorder)	4180186
3537544	Other male genital inflammatory disorders (disorder)	4180186
3537546	Angulatory osteotomy NEC (procedure)	4180186
3537548	Open osteoclasis and external fixation NEC (procedure)	4180186
3537549	Hypoplasia of heart NOS (disorder)	4180186
3537551	Auricular septal defect NOS (disorder)	4180186
3537552	Ectopic digestive organs NOS (disorder)	4180186
3537554	Forced landing while taking off, occupant of other powered aircraft injured (event)	4180186
3537556	Forced landing while landing, other occupant of commercial aircraft in surface to surface transport injured (event)	4180186
3537558	Forced land on landing - other person injured (event)	4180186
3537559	Spacecraft accidents NOS (event)	4180186
3537563	Accidental poisoning by other psychotropic agents (disorder)	4180186
3537564	Poisoning by carbon monoxide from aircraft while in transit, without accident to aircraft, other person injured (disorder)	4180186
3537565	Sucked into aircraft jet, without accident to aircraft, other occupant of commercial aircraft in surface to surface transport injured (event)	4180186
3537567	Sucked into aircraft jet, without accident to aircraft, other person injured (event)	4180186
3537571	Arthropathy NOS (disorder)	4180186
3537572	Arthropathy NOS, of the upper arm (disorder)	4180186
3537575	Arthropathy NOS, of the lower leg (disorder)	4180186
3537576	Arthropathy NOS, of the ankle and foot (disorder)	4180186
3537577	Meniscus derangement NEC (disorder)	4180186
3537578	Other internal knee derangement (disorder)	4180186
3537579	Bone spur NOS (disorder)	4180186
3537580	Other tenosynovitis of the hand (disorder)	4180186
3537581	Agenesis of part of brain NEC (disorder)	4180186
3537582	Other ear tag (disorder)	4180186
3537583	Other ear appendage (disorder)	4180186
3537588	Other male genital organ diseases NOS (disorder)	4180186
3537589	Fibroadenosis of breast NOS (disorder)	4180186
3537590	Benign mammary dysplasia NOS (disorder)	4180186
3537591	Other elbow, forearm and wrist injuries (disorder)	4180186
3537592	Collision between animal being ridden and other object, fixed, movable or moving, not set in motion by motor vehicle, railway train or aircraft (event)	4180186
3537593	Intravenous anesthetic poisoning NOS (disorder)	4180186
3537594	Other general anesthetic agent poisoning (disorder)	4180186
3537596	Topical or infiltration anesthetic poisoning NOS (disorder)	4180186
3537600	Prosthetic reinforcement of intra-articular ligament NEC (procedure)	4180186
3537601	Replantation of finger NEC (procedure)	4180186
3537603	Other specified plastic excision of skin tissue of other site (procedure)	4180186
3537604	Other specified clearance of pelvis (procedure)	4180186
3537606	Compensation for renal failure NOS (procedure)	4180186
3537607	Other specified placement of ambulatory apparatus for compensation for renal failure (procedure)	4180186
3537611	Injection of therapeutic inclusion substance into organ NOC, NOS (procedure)	4180186
3537612	Other injection of radiocontrast substance into organ NOC (procedure)	4180186
3537616	Other specified harvest of random pattern flap of skin from limb (procedure)	4180186
3537617	Epidural anesthetic NEC (procedure)	4180186
3537618	Other specified spinal anesthetic (procedure)	4180186
3537619	Methyl salicylate BP	4180186
3537620	Other specified acute respiratory infections (disorder)	4180186
3537621	Acute respiratory infection NOS (disorder)	4180186
3537623	Excessive physical exercise, unspecified (event)	4180186
3537624	Overexertion NOS (event)	4180186
3537625	Other environmental and accidental causes (event)	4180186
3537630	Hypnotic or anxiolytic dependence NOS (disorder)	4180186
3537631	Other and unspecified peripheral vertigo (disorder)	4180186
3537633	Labyrinthitis NOS (disorder)	4180186
3537640	Parathyroid disorder NOS (disorder)	4180186
3537641	Disorders of growth hormone excess NOS (disorder)	4180186
3537642	Vitamin A deficiency with other ocular manifestation NOS (disorder)	4180186
3537644	Other anterior pituitary disorder (disorder)	4180186
3537645	Autoimmune disease NOS (disorder)	4180186
3537648	Injection of other substance into organ NOC NOS (procedure)	4180186
3537649	Endoscopic dilatation NOC (procedure)	4180186
3537650	Microvascular repair of organ NOC NOS (procedure)	4180186
3537651	Food poisoning NOS (disorder)	4180186
3537657	Bone internal fixation NOS (procedure)	4180186
3537658	Free skin graft - other (procedure)	4180186
3537661	Maternal chronic respiratory/cardiovascular system NOS (situation)	4180186
3537662	Endoscopic destruction of lesion of prostate NEC (procedure)	4180186
3537665	Abdominal hysterocolpectomy NEC (procedure)	4180186
3537666	Artificial insemination NEC (procedure)	4180186
3537668	Biopsy of lesion of uterus NEC (procedure)	4180186
3537669	Unspecified inevitable abortion with unspecified complication (disorder)	4180186
3537669	Unspecified inevitable miscarriage with unspecified complication	4180186
3537673	Other disorder of lactation with antenatal complication (disorder)	4180186
3537675	Deletions with other complex rearrangements (disorder)	4180186
3537678	Problems affecting labor NOS unspecified (disorder)	4180186
3537682	Other uterine inertia with antenatal problem (disorder)	4180186
3537683	Other uterine inertia NOS (disorder)	4180186
3537684	Precipitate labor NOS (disorder)	4180186
3537685	Hypertonic uterine inertia unspecified (disorder)	4180186
3537686	Hypertonic uterine inertia NOS (disorder)	4180186
3537688	Retained products with no hemorrhage unspecified (disorder)	4180186
3537689	Retained products with no hemorrhage NOS (disorder)	4180186
3537690	Breech extraction NOS (finding)	4180186
3537691	Retained placenta or membranes with no hemorrhage NOS (disorder)	4180186
3537694	Erythema multiforme NOS (disorder)	4180186
3537696	Diaphragm anomalies NOS (disorder)	4180186
3537698	Anomaly of thymus gland NOS (disorder)	4180186
3537699	Unspecified anomaly of tendon (disorder)	4180186
3537700	Situs inversus NOS (disorder)	4180186
3537701	Pathological fracture NOS (disorder)	4180186
3537703	Other tranquilizer poisoning (disorder)	4180186
3537705	Motor vehicle nontraffic accident involving fall while boarding or alighting from motor vehicle, except off-road motor vehicle, not on public highway, other specified person injured (event)	4180186
3537706	Nontraffic accident involving accidental poisoning from carbon monoxide generated by moving motor vehicle, except off-road motor vehicle, not on public highway, other specified person injured (disorder)	4180186
3537708	Non-fatal submersion, unspecified (disorder)	4180186
3537712	Bladder contents evacuation NOS (procedure)	4180186
3537715	Spinal traction NEC (procedure)	4180186
3537716	Other dislocation reduction (procedure)	4180186
3537717	Neuroplasty NOS (procedure)	4180186
3537719	Heart septum operation NOS (procedure)	4180186
3537721	Plague unspecified (disorder)	4180186
3537723	Other specified tularemia (disorder)	4180186
3537725	Tularemia NOS (disorder)	4180186
3537726	Other uterine disorders NOS (disorder)	4180186
3537729	Essential and other specified forms of tremor NOS (finding)	4180186
3537730	Other choreas (disorder)	4180186
3537731	Other acute rheumatic heart disease NOS (disorder)	4180186
3537733	Other specified acute rheumatic fever (disorder)	4180186
3537736	Mitral valve disease NOS (disorder)	4180186
3537737	Rheumatic aortic valve disease NOS (disorder)	4180186
3537738	Mitral and aortic valve disease NOS (disorder)	4180186
3537739	Other and unspecified acute pericarditis (disorder)	4180186
3537741	Tricuspid stenosis, cause unspecified (disorder)	4180186
3537743	Other specified cerebrovascular disease (disorder)	4180186
3537744	Other venous embolism and thrombosis (disorder)	4180186
3537746	Other and unspecified diseases of capillaries (disorder)	4180186
3537747	Disease of capillaries NOS (disorder)	4180186
3537748	Other specified arterial, arteriole or capillary disease (disorder)	4180186
3537749	Cardiomyopathy due to drugs and other external agents (disorder)	4180186
3537750	Hereditary peripheral neuropathy NOS (disorder)	4180186
3537754	Hyperostosis of skull NOS (disorder)	4180186
3537755	Acquired knee deformity NOS (finding)	4180186
3537756	Other acquired ankle and foot deformity (disorder)	4180186
3537758	Kyphosis secondary to other treatment (disorder)	4180186
3537759	Acquired kyphosis NOS (disorder)	4180186
3537760	Unspecified abortion with shock (disorder)	4180186
3537762	Unspecified abortion with complication NOS (disorder)	4180186
3537763	Unspecified abortion with no mention of complication (disorder)	4180186
3537764	Unspecified abortion NOS (disorder)	4180186
3537766	Unspecified illegal abortion with renal failure (disorder)	4180186
3537767	Secondary and delayed postpartum hemorrhage NOS (disorder)	4180186
3537768	Other vulval and perineal trauma during delivery with postnatal problem (disorder)	4180186
3537773	Other specified intramuscular injection (procedure)	4180186
3537775	Injection of steroid for local action NEC (procedure)	4180186
3537776	Injection of hormone for local action NEC (procedure)	4180186
3537778	Other specified compensation for renal failure (procedure)	4180186
3537783	Donation of organ NOS (procedure)	4180186
3537784	Attention to prosthesis NOC OS (procedure)	4180186
3537785	Punch biopsy of organ NEC (procedure)	4180186
3537787	Fine needle aspiration biopsy for cytology NOC (procedure)	4180186
3537788	Other specified introduction of non-removable material into organ NOC (procedure)	4180186
3537790	Other specified approach through abdominal cavity (qualifier value)	4180186
3537792	Approach to organ through artificial opening into gastrointestinal tract NOS (qualifier value)	4180186
3537794	Other specified late operation NOC (procedure)	4180186
3537795	Denervation of spinal facet joint of vertebra NOS (procedure)	4180186
3537798	Old laceration or scar of vulva NOS (disorder)	4180186
3537800	Other noninflammatory cervical disorders (disorder)	4180186
3537802	Unspecified spontaneous abortion with shock (disorder)	4180186
3537806	Malignant neoplasm of unspecified site NOS (disorder)	4180186
3537809	Visual defect - remedial therapy NOS (regime/therapy)	4180186
3537819	Other specified implantation of prosthesis for limb (procedure)	4180186
3537820	Implantation of prosthesis for limb NOS (procedure)	4180186
3537823	Neoplasm of unspecified nature (disorder)	4180186
3537824	Obesity and other hyperalimentation (disorder)	4180186
3537832	Alcoholic liver damage NOS (disorder)	4180186
3537834	Nephritis and nephropathy unspecified (disorder)	4180186
3537835	Nephritis unspecified with other specified lesion of membranoproliferative glomerulonephritis (disorder)	4180186
3537838	Legal execution NOS (event)	4180186
3537841	Joint excision NOS (procedure)	4180186
3537842	Joint incision NOS (procedure)	4180186
3537844	Facial bone excision/repair NOS (procedure)	4180186
3537845	Bone graft NOS (procedure)	4180186
3537846	Hormone implant operation NOS (procedure)	4180186
3537847	Hand muscle operation NOS (procedure)	4180186
3537850	Superficial injury of hand NOS, without mention of infection (disorder)	4180186
3537855	Noncollision motor vehicle traffic accident involving accidental poisoning from exhaust gas generated by motor vehicle while in motion, unspecified person injured (disorder)	4180186
3537856	Noncollision motor vehicle traffic accident involving breakage of any part of motor vehicle while in motion, other specified person injured (event)	4180186
3537858	Fall in train, other specified person injured (event)	4180186
3537860	Deep full thickness burn of the hand unspecified, without loss of body part (disorder)	4180186
3537862	Deep full thickness burn of the hand unspecified, with loss of body part (disorder)	4180186
3537863	Closed fracture of skull NOS with intracranial injury (disorder)	4180186
3537864	Other specified diseases of circulatory system (disorder)	4180186
3537867	Non-infective jejunitis NOS (disorder)	4180186
3537868	Rectal ulcer unspecified (disorder)	4180186
3537870	Operation on varicocele NOS (procedure)	4180186
3537871	Other operations on spermatic cord (procedure)	4180186
3537873	Other specified excision of urethra (procedure)	4180186
3537874	Other open operations on urethra (procedure)	4180186
3537878	Spinal anesthetic NOS (procedure)	4180186
3537879	Cholera NOS (disorder)	4180186
3537880	Hemostasis of unspecified organ (procedure)	4180186
3537881	Other specified other operation on unspecified organ (procedure)	4180186
3537882	Curettage of organ NOC (procedure)	4180186
3537884	Other specified anesthetic without surgery (procedure)	4180186
3537885	Anesthetic without surgery NOS (procedure)	4180186
3537886	Inject of sclerosing substance into organ NOC (procedure)	4180186
3537887	Other appendicitis (disorder)	4180186
3537888	Sciatic hernia NOS (disorder)	4180186
3537890	Other specified diseases of appendix (disorder)	4180186
3537891	Spigelian hernia NOS (disorder)	4180186
3537892	Other specified hernias of abdominal cavity (disorder)	4180186
3537893	Inguinal hernia with gangrene NOS (disorder)	4180186
3537894	Obstructed inguinal hernia NOS (disorder)	4180186
3537895	Irreducible inguinal hernia NOS (disorder)	4180186
3537896	Unspecified thickness burn of ankle (disorder)	4180186
3537898	Unspecified thickness burn of thigh (disorder)	4180186
3537904	Other therapeutic endoscopic operations on colon (procedure)	4180186
3537906	Diagnostic endoscopic examination of sigmoid colon using rigid sigmoidoscope NOS (procedure)	4180186
3537907	Other specified therapeutic transluminal operation on vein (procedure)	4180186
3537909	Diagnostic endoscopy of the kidney NOS (procedure)	4180186
3537910	Other specified other abdominal operation for rectal prolapse (procedure)	4180186
3537912	Pedal cycle accident involving collision between pedal cycle and other object, fixed, movable or moving, not set in motion by motor vehicle, railway train or aircraft (event)	4180186
3537913	Fracture of other facial bones, closed, NOS (disorder)	4180186
3537915	Burn of other internal organ (disorder)	4180186
3537917	Train accident involving explosion, other specified person injured (event)	4180186
3537922	Train accident involving explosion, fire or burning NOS (event)	4180186
3537923	Train accident involving explosion, fire or burning NOS, railway employee injured (event)	4180186
3537924	Deep full thickness burn, without loss of body part, of the leg NOS (disorder)	4180186
3537927	Corrosion of second degree, body region unspecified (disorder)	4180186
3537929	Burn of the vagina or uterus NOS (disorder)	4180186
3537933	Disorder of mineral metabolism NOS (disorder)	4180186
3537934	Other specified acidosis (disorder)	4180186
3537935	Acidaemia NOS	4180186
3537935	Acidosis NOS (disorder)	4180186
3537936	Anodontia NOS (finding)	4180186
3537939	Amputation of penis NOS (procedure)	4180186
3537942	Reconstruction of organ NOC (procedure)	4180186
3537943	Cryotherapy to organ NOC (procedure)	4180186
3537947	Other teeth hard tissue disease (disorder)	4180186
3537948	Other teeth hard tissue disease NOS (disorder)	4180186
3537949	Hard tissue teeth disease NOS (disorder)	4180186
3537950	Other specified panhypopituitarism (disorder)	4180186
3537953	Other disorder of neurohypophysis NOS (disorder)	4180186
3537954	Iatrogenic pituitary disorder NOS (disorder)	4180186
3537955	Other pituitary disorders and diencephalohypophyseal syndromes (disorder)	4180186
3537957	Other specified thymus disease (disorder)	4180186
3537958	Unspecified vitamin deficiency (disorder)	4180186
3537959	Mineral deficiency NEC (disorder)	4180186
3537960	Female infertility of uterine origin NOS (disorder)	4180186
3537963	Hypoglycemia unspecified (disorder)	4180186
3537968	Unspecified gastrojejunal ulcer with hemorrhage and perforation (disorder)	4180186
3537971	Unspecified spontaneous abortion with damage to pelvic organs or tissues (disorder)	4180186
3537974	Other female genital organ disorder OS (disorder)	4180186
3537977	Hemorrhage NOS (disorder)	4180186
3537980	Polyarteritis nodosa and allied conditions NOS (disorder)	4180186
3537982	Other disorders of arteries and arterioles (disorder)	4180186
3537984	Disorders of arteries and arterioles NOS (disorder)	4180186
3537985	Vein, lymphatic and other circulatory diseases NOS (disorder)	4180186
3537987	Post-abortion problem NOS (disorder)	4180186
3537990	Other joint symptoms of the pelvic region and thigh (finding)	4180186
3537991	Other joint symptoms of the lower leg (finding)	4180186
3537993	Disc displacement, site unspecified, without myelopathy (disorder)	4180186
3537994	Torticollis unspecified (disorder)	4180186
3537995	Backache, unspecified (finding)	4180186
3537997	Other back symptoms (disorder)	4180186
3537999	Operation complication NEC (disorder)	4180186
3538000	Encephalomyelitis NOS (disorder)	4180186
3538003	Accidental poisoning by skin, mucous membrane, ophthalmological, otorhinolaryngological and dental drugs, NOS (disorder)	4180186
3538004	Accidental poisoning by other drugs NOS (disorder)	4180186
3538006	Accidental poisoning by other solid and liquid substances, gases and vapours (disorder)	4180186
3538008	Accidental poisoning by isopropyl alcohol NOS (disorder)	4180186
3538010	Accidental poisoning by alcohol NOS (disorder)	4180186
3538011	Accidental poisoning by other cleaning agents (event)	4180186
3538015	Failure of sterile precautions during perfusion NOS (event)	4180186
3538018	Failure of sterile precautions during other procedure (event)	4180186
3538021	Accidental poisoning by central nervous system depressants NOS (disorder)	4180186
3538022	Accidental poisoning by local anesthetics NOS (disorder)	4180186
