concept_id	concept_synonym_name	language_concept_id
3554378	Impedance phlebography	4180186
3554378	Vascular impedance determination	4180186
3554432	In-house chiropody discharge	4180186
3554544	Impedance phlebography	4180186
3554544	Vascular impedance determination	4180186
3554559	BC - Breathing control technique	4180186
3554559	Control of respiration	4180186
3554561	Mini-sleep study	4180186
3554561	Overnight oximetry	4180186
3554565	Carbon monoxide diffusing capacity measurement	4180186
3554566	Distribution of ventilation test	4180186
3554568	BGA - Blood gas analysis	4180186
3554572	Lung function tests	4180186
3554572	Measurement of respiratory function	4180186
3554572	PFT - Pulmonary function tests	4180186
3554572	Respiratory measurements	4180186
3554572	Respiratory tests	4180186
3554572	RFT Respiratory function test	4180186
3554575	Determination of resistance to airflow by plethysmographic method	4180186
3554578	Measurement of respiratory muscle strength	4180186
3554582	BPT - Bronchial provocation test	4180186
3554582	Bronchial allergy challenge	4180186
3554582	Bronchial challenge	4180186
3554588	Heaf testing	4180186
3554609	H-BT - Hydrogen breath test	4180186
3554609	H2BT - Hydrogen breath test	4180186
3554620	Glucose tolerance test, 2 hours	4180186
3554620	GTT - Glucose tolerance test	4180186
3554620	OGTT - Oral glucose tolerance test	4180186
3554704	Phlebotomy D.V. requested	4180186
3554735	In-house chiropody discharge	4180186
3554736	In-house chiropody follow-up appointment	4180186
3554765	RVHB Maxamum powder	4180186
3554789	Right leg prosthesis (physical object)	4180186
3554875	Seen in community respiratory clinic (finding)	4180186
3554882	Respiratory flow volume loop measurement (procedure)	4180186
3554887	Ferret epithelium RAST test (procedure)	4180186
3554898	Cultivated wheat (pollen) RAST test (procedure)	4180186
3554901	Serum pregnancy associated plasma protein-A mean of median measurement (procedure)	4180186
3554905	Serum unconjugated oestriol mean of median measurement (procedure)	4180186
3554910	Plasma inhibin-A mean of median measurement (procedure)	4180186
3554926	Willow pollen RAST test (procedure)	4180186
3554929	Corn pollen RAST test (procedure)	4180186
3554933	Gerbil epithelium RAST test (procedure)	4180186
3554936	Person not available (finding)	4180186
3554973	Feeding problem in child (finding)	4180186
3554981	History of two hepatitis B vaccinations (situation)	4180186
3555004	History of three hepatitis B vaccinations (situation)	4180186
3555042	Bowel cancer screening status (finding)	4180186
3555066	Posterior tibial pulse rate (observable entity)	4180186
3555067	Dorsalis pedis pulse rate (observable entity)	4180186
3555077	Liaising with police (procedure)	4180186
3555078	Transfer of care to a hospital (procedure)	4180186
3555081	ECG (electrocardiogram) shows ectopic beats equal to or more than six per minute	4180186
3555081	Electrocardiogram shows ectopic beats equal to or more than six per minute (finding)	4180186
3555082	ECG shows inferior myocardial infarction	4180186
3555082	Electrocardiogram shows inferior myocardial infarction (finding)	4180186
3555084	ECG shows ventricular escape rhythm	4180186
3555084	Electrocardiogram shows ventricular escape rhythm (finding)	4180186
3555087	Short catheter	4180186
3555087	Short rigid urethral catheter (physical object)	4180186
3555093	Did not attend for community disease modifying antirheumatic drug monitoring (finding)	4180186
3555093	Did not attend for community DMARD monitoring	4180186
3555093	DNA community DMARD monitoring	4180186
3555097	Intensive nursing & (care)	4180186
3555097	Intensive nursing (procedure)	4180186
3555100	Child health assessment (regime/therapy)	4180186
3555111	Coriander RAST test (procedure)	4180186
3555114	American beech RAST test (procedure)	4180186
3555117	Boiled milk RAST test (procedure)	4180186
3555127	Trout RAST test (procedure)	4180186
3555148	Lupin pollen RAST test (procedure)	4180186
3555183	Newborn blood spot screening programme, cystic fibrosis further sample required (finding)	4180186
3555183	Newborn blood spot screening programme - cystic fibrosis repeat screening with further sample required	4180186
3555184	Newborn blood spot screening programme, phenylketonuria not suspected further follow up required (finding)	4180186
3555184	Newborn blood spot screening programme - phenylketonuria (PKU) not suspected and other disorders follow up required	4180186
3555184	PKU not suspected, further follow up required	4180186
3555185	Newborn blood spot screening programme - sickle cell not suspected and other disorders follow up required	4180186
3555185	Newborn blood spot screening programme, sickle cell not suspected further follow up required (finding)	4180186
3555188	Child psychotherapy (regime/therapy)	4180186
3555203	No religious affiliation (finding)	4180186
3555218	Lipoprotein (a) level (procedure)	4180186
3555223	Norclomipramine level (procedure)	4180186
3555233	Cortisol binding globulin leve	4180186
3555233	Cortisol binding globulin measurement (procedure)	4180186
3555233	Transcortin measurement	4180186
3555235	Alpha-glucosidase level (procedure)	4180186
3555235	alpha-Glucosidase measurement	4180186
3555256	Ampicillin RAST test	4180186
3555256	Ampicilloyl RAST test (procedure)	4180186
3555259	Rat serum proteins RAST test (procedure)	4180186
3555268	Newborn hearing screening (procedure)	4180186
3555296	Cobalt/creatinine ratio	4180186
3555296	Cobalt/creatinine ratio measurement (procedure)	4180186
3555298	Chromium/creatinine ratio measurement (procedure)	4180186
3555301	N-telopeptide cross link/creatinine ratio	4180186
3555301	N-telopeptide cross link/creatinine ratio measurement(procedure)	4180186
3555308	Chronic large plaque psoriasis (disorder)	4180186
3555309	Psoriasis vulgaris (disorder)	4180186
3555310	Alcohol intake exceeds recommended daily limits (finding)	4180186
3555373	Seen by health coach (finding)	4180186
3555376	Father with parental responsibility	4180186
3555376	Legal father (person)	4180186
3555377	U	4180186
3555377	Upper case Roman letter U (qualifier value)	4180186
3555391	Specimen unsatisfactory for evaluation (finding)	4180186
3555392	Increased tyrosine (finding)	4180186
3555409	Child health screening of vision (procedure)	4180186
3555413	Fluoroscopic guidance for pressure measurement of hepatic vein	4180186
3555413	Fluoroscopy guided pressure measurement of hepatic vein (procedure)	4180186
3555415	Radionuclide red cell mass and plasma volume study (procedure)	4180186
3555415	Red cell mass and plasma volume study	4180186
3555416	Bereavement support visit (regime/therapy)	4180186
3555419	Independent sector residential care (regime/therapy)	4180186
3555449	Care of patient following local anaesthesia (regime/therapy)	4180186
3555454	Care of ileal conduit (regime/therapy)	4180186
3555460	Genitourinary medicine clinic (environment)	4180186
3555460	GUM - genitourinary medicine clinic	4180186
3555462	Adenovirus group F PCR	4180186
3555462	Polymerase chain reaction test for adenovirus group F (procedure)	4180186
3555484	Brussel sprout RAST test (procedure)	4180186
3555487	Cauliflower RAST test (procedure)	4180186
3555493	Referral to endodontic service (procedure)	4180186
3555496	Referral to periodontic service (procedure)	4180186
3555504	Information system - National Public Health Classification (administrative concept)	4180186
3555505	Able to heat home - Common Assessment Framework (finding)	4180186
3555506	Does not heat home - Common Assessment Framework (finding)	4180186
3555512	Seen in mental health clinic (finding)	4180186
3555521	Referral to specialist alcohol treatment service (procedure)	4180186
3555524	Protamine sulphate thrombin time (procedure)	4180186
3555528	Human leucocyte antigen (HLA) DR antigen typing (procedure)	4180186
3555529	Transvaginal obstetric ultrasound scan for cervical length (procedure)	4180186
3555529	TV obstetric US for cervical length	4180186
3555567	Referral to respiratory physician (procedure)	4180186
3555569	Referral to sleep clinic (procedure)	4180186
3555570	Knee height (observable entity)	4180186
3555571	Ulna length (observable entity)	4180186
3555577	JAK2 V617F mutation analysis (procedure)	4180186
3555578	Antibody to nuclease level	4180186
3555578	Antibody to nuclease measurement (procedure)	4180186
3555581	240 minute plasma glucose level	4180186
3555581	240 minute plasma glucose measurement (procedure)	4180186
3555587	Temperature of toe (observable entity)	4180186
3555588	Oesophageal temperature (observable entity)	4180186
3555589	Peripheral oxygen saturation (observable entity)	4180186
3555589	SpO2 - oxygen saturation at periphery	4180186
3555590	Pulse waveform amplitude using pulse oximetry (observable entity)	4180186
3555593	WHO FRAX 10 year osteoporotic fracture probability score	4180186
3555593	World Health Organisation FRAX 10 year osteoporotic fracture probability score (assessment scale)	4180186
3555596	Anchovy RAST test (procedure)	4180186
3555614	Received vocational training (finding)	4180186
3555615	Literacy level: can write own name (finding)	4180186
3555617	Numeracy level (finding)	4180186
3555619	Seen by family therapist (finding)	4180186
3555628	Hepatitis C PCR negative	4180186
3555628	Hepatitis C viral ribonucleic acid polymerase chain reaction negative (finding)	4180186
3555652	Surveillance of community population (InPS+developmental)	4180186
3555652	Surveillance of community population (regime/therapy)	4180186
3555654	Storage of graft tissue (InPS+developmental)	4180186
3555654	Storage of graft tissue (procedure)	4180186
3555656	School health periodic inspection	4180186
3555656	School health surveillance (regime/therapy)	4180186
3555657	Consent given for counselling (finding)	4180186
3555660	Immediate protection of child (InPS+developmental)	4180186
3555660	Immediate protection of child (regime/therapy)	4180186
3555663	Stucco keratosis (morphologic abnormality)	4180186
3555668	Development of coping strategies through play (InPS+developmental)	4180186
3555668	Development of coping strategies through play (regime/therapy)	4180186
3555671	Pain relief in labour (InPS+developmental)	4180186
3555672	Partnership in pain control (InPS+developmental)	4180186
3555674	Child health opportunistic screening (InPS+developmental)	4180186
3555682	Storytelling (InPS+developmental)	4180186
3555683	Preparation play (InPS+developmental)	4180186
3555690	Child accommodated (finding)	4180186
3555690	Child accommodated (InPS+developmental)	4180186
3555690	Entry into accommodation	4180186
3555691	Home visit for access (InPS+developmental)	4180186
3555691	Home visit for access (regime/therapy)	4180186
3555691	HV - Home visit for access	4180186
3555694	DEXA scan T score	4180186
3555694	Dual energy X-ray photon absorptiometry scan T score (finding)	4180186
3555695	Organised play	4180186
3555695	Organized games therapy (regime/therapy)	4180186
3555698	Moral support (InPS+developmental)	4180186
3555698	Moral support (regime/therapy)	4180186
3555701	Recreational play	4180186
3555701	Recreational play (regime/therapy)	4180186
3555702	Social integration therapy (regime/therapy)	4180186
3555712	History of insertion of endotracheal tube (situation)	4180186
3555712	History of tracheal intubation	4180186
3555715	In paid employment (finding)	4180186
3555722	Main spoken language Slovak (finding)	4180186
3555725	Copy of letter from specialist to patient (procedure)	4180186
3555747	Seen in genetic clinic (finding)	4180186
3555757	Seen in community paediatric clinic (finding)	4180186
3555763	Seen in community anticoagulation clinic (finding)	4180186
3555765	Seen in hospital anticoagulation clinic	4180186
3555765	Seen in hospital anticoagulation clinic (finding)	4180186
3555772	Main spoken language Oromo (finding)	4180186
3555775	Main spoken language Afar (finding)	4180186
3555780	Main spoken language Armenian (finding)	4180186
3555784	Main spoken language Aymara (finding)	4180186
3555786	Main spoken language Bashkir (finding)	4180186
3555794	Main spoken language Bislama (finding)	4180186
3555802	Main spoken language Belarusian (finding)	4180186
3555809	Main spoken language Esperanto (finding)	4180186
3555818	Main spoken language Finnish (finding)	4180186
3555826	Main spoken language Greenlandic	4180186
3555826	Main spoken language Kalaallisut (finding)	4180186
3555828	Main spoken language Guarani (finding)	4180186
3555831	Main spoken language Hungarian (finding)	4180186
3555834	Main spoken language Indonesian (finding)	4180186
3555853	Main spoken language Lao (finding)	4180186
3555855	Main spoken language Latvian (finding)	4180186
3555857	Main spoken language Macedonian (finding)	4180186
3555859	Main spoken language Malay (finding)	4180186
3555863	Main spoken language Maori (finding)	4180186
3555867	Main spoken language Occitan (finding)	4180186
3555870	Main spoken language Quechua (finding)	4180186
3555877	Main spoken language Southern Sotho (finding)	4180186
3555880	Main spoken language Sindhi (finding)	4180186
3555886	Main spoken language Tajik (finding)	4180186
3555888	Main spoken language Tatar (finding)	4180186
3555889	Main spoken language Telugu (finding)	4180186
3555896	Main spoken language Turkmen (finding)	4180186
3555898	Main spoken language Twi (finding)	4180186
3555900	Main spoken language Uzbek (finding)	4180186
3555911	Main spoken language N - Z (finding)	4180186
3555912	Main spoken language A - M (finding)	4180186
3555914	Interpreter needed for language N-Z (finding)	4180186
3555968	INR (international normalised ratio) derived warfarin dose	4180186
3555968	International normalised ratio derived warfarin dose (regime/therapy)	4180186
3555969	Lupin seed RAST test (procedure)	4180186
3556042	Hepatitis B screening negative	4180186
3556043	Hepatitis B screening negative	4180186
3556118	Specimen collection by device (procedure)	4180186
3556122	Non-tunnelled central venous catheter in situ (finding)	4180186
3556123	Tunnelled central venous catheter in situ (finding)	4180186
3556130	Quinidine measurement (procedure)	4180186
3556134	Mantle cell lymphoma (morphologic abnormality)	4180186
3556134	Mantle zone lymphoma	4180186
3556135	Campylobacter serology (procedure)	4180186
3556160	Urine neisseria gonorrhoeae test positive	4180186
3556170	Refer to contact tracing nurse	4180186
3556189	International normalised ratio within target range	4180186
3556190	Patient held anticoagulant therapy record updated	4180186
3556192	Syphilis screen 6 months post treatment	4180186
3556198	Group O neg	4180186
3556199	Group A pos	4180186
3556200	Group A neg	4180186
3556201	Group B pos	4180186
3556202	Group B neg	4180186
3556203	Group AB pos	4180186
3556207	Quinidine measurement	4180186
3556209	Admission to SCBU	4180186
3556214	Refer to contact tracing nurse	4180186
3556229	Syphilis screen 6 months post treatment	4180186
3556231	Dermatology management plan given	4180186
3556234	Hepatitis B screening positive	4180186
3556235	Urine neisseria gonorrhoeae test positive	4180186
3556236	Urine neisseria gonorrhoeae test negative	4180186
3556252	Group A neg	4180186
3556254	Group B neg	4180186
3556258	JAK2 V617F mutation analysis	4180186
3556259	Quinidine measurement	4180186
3556276	In therapeutic work - Common Assessment Framework (finding)	4180186
3556278	Able to prepare snack - Common Assessment Framework (finding)	4180186
3556279	Graded exercise therapy (regime/therapy)	4180186
3556281	Able to manage payment of bill - Common Assessment Framework (finding)	4180186
3556282	Does not manage payment of bill - Common Assessment Framework (finding)	4180186
3556284	Difficulty managing payment of bill - Common Assessment Framework (finding)	4180186
3556287	Smoke alarm in home - Common Assessment Framework (finding)	4180186
3556288	No smoke alarm in home - Common Assessment Framework (finding)	4180186
3556293	Able to adjust stoma bag - Common Assessment Framework (finding)	4180186
3556294	Does change stoma bag - Common Assessment Framework (finding)	4180186
3556295	Does adjust stoma bag - Common Assessment Framework (finding)	4180186
3556297	Difficulty changing stoma bag - Common Assessment Framework (finding)	4180186
3556300	Assistance needed to adjust stoma bag - Common Assessment Framework (finding)	4180186
3556301	Own finance managed using electronic banking - Common Assessment Framework (finding)	4180186
3556309	Individual budget applied for - Common Assessment Framework (finding)	4180186
3556313	Heating appliance unsuitable for living environment - Common Assessment Framework (finding)	4180186
3556316	Unable to use personal computer - Common Assessment Framework (finding)	4180186
3556327	Referral to oral surgeon (procedure)	4180186
3556329	Referral to maxillofacial surgeon (procedure)	4180186
3556330	Difficulty dressing appropriately - Common Assessment Framework (finding)	4180186
3556331	Able to perform work based activity - Common Assessment Framework (finding)	4180186
3556332	Manages own care plan	4180186
3556332	Manages own support plan - Common Assessment Framework (finding)	4180186
3556335	Does not cool home - Common Assessment Framework (finding)	4180186
3556341	Regular attendance at dentist - Common Assessment Framework (finding)	4180186
3556344	Does not attend dentist - Common Assessment Framework (finding)	4180186
3556346	Blue Badge permit holder	4180186
3556346	Disabled parking permit holder - Common Assessment Framework (finding)	4180186
3556352	HPV (human papillomavirus) vaccination invitation first letter	4180186
3556352	Human papillomavirus vaccination invitation first letter (finding)	4180186
3556464	Other specified preparation for external beam radiotherapy (regime/therapy)	4180186
3556465	Preparation for brachytherapy NOS (regime/therapy)	4180186
3556466	Other specified preparation for brachytherapy (regime/therapy)	4180186
3556479	Chlamydia trachomatis screening (procedure)	4180186
3556490	Excepted from cardiovascular disease quality indicators: patient unsuitable (finding)	4180186
3556497	Seen by palliative care service (finding)	4180186
3556510	CF20 (cystic fibrosis 20) common mutation test	4180186
3556510	Cystic fibrosis 20 common mutation test (procedure)	4180186
3556535	Targeted gene mutation analysis (procedure)	4180186
3556536	Tryptase level (procedure)	4180186
3556539	Seen in surgical clinic (finding)	4180186
3556572	[V]Presence of coronary artery bypass graft (situation)	4180186
3556578	[M]Fibroxanthosarcoma (disorder)	4180186
3556580	[X]Megaloblastic anaemia NOS (disorder)	4180186
3556581	[V]Problems in relationship with parents and in-laws (situation)	4180186
3556583	[D]Abnormal faeces NOS (situation)	4180186
3556583	[D]Abnormal feces NOS	4180186
3556588	[D]Abnormal liver function test NOS (situation)	4180186
3556589	[X]Lipid-lowering drug adverse reaction (event)	4180186
3556592	[X]Adverse drug reaction: [ENT] or [dental] or [NOS] or [unspecified topical agents] (event)	4180186
3556592	[X] Adverse reaction to skin, eye, ENT and dental drugs NOS	4180186
3556592	[X]Unspecified topical agents causing adverse effects in therapeutic use	4180186
3556594	[X]Acne, unspecified (disorder)	4180186
3556600	Keratometry Flat Axis (observable entity)	4180186
3556602	Keratometry Steep Axis (observable entity)	4180186
3556605	Yersenia species not isolated (finding)	4180186
3556607	[V]Admission for instruction in the use of a nebuliser (situation)	4180186
3556607	[V]Admission for instruction in the use of a nebulizer	4180186
3556608	History of correction of congenital deformity of heart (situation)	4180186
3556608	History of surgical repair of congenital deformity of heart	4180186
3556610	History of repair of Tetralogy of Fallot (situation)	4180186
3556610	History of Tetralogy of Fallot, surgically corrected	4180186
3556614	Chronic kidney disease due to hypertension	4180186
3556614	Hypertensive chronic kidney disease (disorder)	4180186
3556615	History of phacoemulsification of cataract with intraocular lens implantation (situation)	4180186
3556616	History of secondary intraocular lens	4180186
3556616	History of secondary intraocular lens implant (situation)	4180186
3556617	Chronic total occlusion catheter (physical object)	4180186
3556617	CTO - Chronic total occlusion catheter	4180186
3556619	Paternal aunt (person)	4180186
3556621	[M]Subacute lymphoid leukaemia (disorder)	4180186
3556621	[M]Subacute lymphoid leukemia	4180186
3556625	Underweight in childhood (finding)	4180186
3556626	Long-term current use of non-steroidal anti-inflammatory drug (situation)	4180186
3556627	Not in labor force (finding)	4180186
3556629	Clinical pharmacist (occupation)	4180186
3556632	[V]Admitted for conversion to insulin (situation)	4180186
3556638	[M]Leukaemia NOS (disorder)	4180186
3556638	[M]Leukemia NOS	4180186
3556641	[X]Bupropion causing adverse effects in therapeutic use (event)	4180186
3556643	[V]Procedure cancelled due to non-availability of anaesthetist (situation)	4180186
3556643	[V]Procedure cancelled due to non-availability of anesthetist	4180186
3556645	[D]Abnormal semen NOS (situation)	4180186
3556649	[X] Adverse reaction peripheral nerve/plexus-blocking anaesthetic	4180186
3556649	[X] Adverse reaction peripheral nerve/plexus-blocking anesthetic	4180186
3556649	[X] Adverse reaction to bupivacaine hydrochloride	4180186
3556649	[X] Adverse reaction to cocaine	4180186
3556649	[X] Adverse reaction to lignocaine hydrochloride	4180186
3556649	[X] Adverse reaction to local anaesthetics NOS	4180186
3556649	[X] Adverse reaction to local anesthetics NOS	4180186
3556649	[X] Adverse reaction to other local anaesthetics	4180186
3556649	[X] Adverse reaction to other local anesthetics	4180186
3556649	[X] Adverse reaction to prilocaine hydrochloride	4180186
3556649	[X] Adverse reaction to procaine hydrochloride	4180186
3556649	[X] Adverse reaction to spinal anaesthetic	4180186
3556649	[X] Adverse reaction to spinal anesthetic	4180186
3556649	[X] Adverse reaction to surface and infiltration anaesthetic	4180186
3556649	[X] Adverse reaction to surface and infiltration anesthetic	4180186
3556649	[X] Adverse reaction to tetracaine	4180186
3556649	[X]Deoxybarbiturates causing adverse effects in therapeutic use	4180186
3556649	([X]Deoxybarbiturates causing adverse effects in therapeutic use) or ([X]Adverse reaction to named anaesthetic agents) (event)	4180186
3556649	([X]Deoxybarbiturates causing adverse effects in therapeutic use) or ([X]Adverse reaction to named anesthetic agents)	4180186
3556650	[X] Adverse reaction to anti-infective NOS	4180186
3556650	[X] Adverse reaction to anti-infective substance	4180186
3556650	[X]Adverse reaction to anti-infective: [unspecified systemic &/or antiparasitics - therapeutic] or [NOS] (event)	4180186
3556650	[X]Unspecified systemic anti-infectives and antiparasitics causing adverse effects in therapeutic use	4180186
3556657	[M]Malignant lymphoma, mixed lymphocytic-histiocytic NOS	4180186
3556657	[M]Malignant lymphoma, mixed lymphocytic - histiocytic NOS (& [diffuse reticulolymphosarcoma]) (disorder)	4180186
3556657	[M]Reticulolymphosarcoma, diffuse	4180186
3556657	[M]Reticulolymphosarcoma NOS	4180186
3556659	[D]Nonspecific abnormal Papanicolaou cervical smear NOS (situation)	4180186
3556661	[D]Incontinence of urine NOS (situation)	4180186
3556669	Illegal tennant	4180186
3556669	Squatter	4180186
3556690	Activity management for myalgic encephalopathy	4180186
3556690	Actvty managm for myalg enceph	4180186
3556724	Illegal tennant	4180186
3556724	Squatter	4180186
3556741	Radiotherapy preparation	4180186
3556741	Volume definition for superficial or deep X-ray, electron or megavoltage radiotherapy with simple calculation	4180186
3556754	Short synacthen test	4180186
3556754	Short tetracosactrin test	4180186
3556754	SST - Short synacthen test	4180186
3556768	Activity management for myalgic encephalopathy	4180186
3556768	Actvty managm for myalg enceph	4180186
3556801	Non-coeliac gluten intolerance	4180186
3556804	Community alarm service device fitted (finding)	4180186
3556805	Home telecommunications device for the deaf fitted (finding)	4180186
3556806	Haemoglobin A1c level (observable entity)	4180186
3556806	HBA1c (Haemoglobin A1c) level	4180186
3556809	Cochineal extract RAST test (procedure)	4180186
3556813	Anticipatory palliative care (regime/therapy)	4180186
3556830	Discharge by podiatric surgeon (procedure)	4180186
3556831	Podiatric surgeon (occupation)	4180186
3556838	Simple lymphatic drainage (regime/therapy)	4180186
3556867	Completed clinical trial (finding)	4180186
3556873	Stemmer sign (finding)	4180186
3556883	Monoclonal protein concentration	4180186
3556883	Monoclonal protein concentration measurement (procedure)	4180186
3556889	Referral to sleep apnoea clinic (procedure)	4180186
3556936	Alpha-1-antitrypsin genotyping	4180186
3556936	Alpha-1-antitrypsin genotype determination (procedure)	4180186
3556946	Dill RAST test (procedure)	4180186
3556953	Estimated average glucose level	4180186
3556953	Estimated average glucose measurement (procedure)	4180186
3556954	Kell blood group phenotype determination (procedure)	4180186
3556954	Kell blood group phenotyping	4180186
3556955	Factor V (F5) Leiden screening test	4180186
3556955	Factor V Leiden screening test (procedure)	4180186
3556956	Bristol stool form score (observable entity)	4180186
3556959	Rhesus blood group phenotype determination (procedure)	4180186
3556959	Rhesus blood group phenotyping	4180186
3556963	Mirena coil check (finding)	4180186
3556974	Refused consent for electronic record sharing (finding)	4180186
3556981	Alcohol measurement, breath	4180186
3556981	Ethanol measurement, breath (procedure)	4180186
3556987	Does manage to perform all activities of daily living without assistance (finding)	4180186
3556990	Nebivolol therapy refused (situation)	4180186
3556995	Myelocyte level (procedure)	4180186
3557038	History of pneumococcal vaccination (situation)	4180186
3557039	History of measles, mumps and rubella vaccination (situation)	4180186
3557039	History of MMR (measles, mumps and rubella) vaccination	4180186
