concept_id	concept_synonym_name	language_concept_id
706163	2019 Novel Coronavirus; 2019-nCoV; 3 Self-Sustaining Sequence Replication; 3SR SR; Amplif; Amplification; Amplified; Breathing; Corona virus; COVID19; COVID-19; DNA NUCLEIC ACID PROBE; DNA probe; ID; II; Infectious Disease; InfectiousDisease; LAT; LCR; Ligase chain reaction; Ligation-activated transcription; Lungs; Microbiology; NAA+probe; NAAT; NASBA; Nucleic acid sequence based analysis; Ordinal; PCR; Point in time; Polymerase chain reaction; PR; Probe amp; Probe with ampification; Probe with target amplification; QBR; QL; Qual; Qualitative; Random; Ribonucleic acid; RS; SARS Coronavirus 1; SARS-CoV; SARS-CoV-1; SARS-CoV-2; Screen; SDA; Severe Acute Respiratory Syndrome; Spec; Strand Displacement Amplification; TMA; Transcription mediated amplification; Viral Pneumonias; Wuhan coronavirus	4180186
706166	3 Self-Sustaining Sequence Replication; 3SR SR; Amplif; Amplification; Amplified; Corona virus; DNA NUCLEIC ACID PROBE; DNA probe; ID; Infectious Disease; InfectiousDisease; LAT; LCR; Ligase chain reaction; Ligation-activated transcription; Microbiology; Misc; Miscellaneous; NAA+probe; NAAT; NASBA; Nucleic acid sequence based analysis; Other; PCR; Point in time; Polymerase chain reaction; Probe amp; Probe with ampification; Probe with target amplification; QBR; QNT; Quan; Quant; Quantitative; Random; SARSr-CoV; SARS-rel CoV E gene; SDA; Severe Acute Respiratory Syndrome; Spec; Strand Displacement Amplification; TMA; To be specified in another part of the message; Transcription mediated amplification; Unspecified	4180186
706166	SARS-rel CoV E gene Ct Spec Qn NAA+probe	4180186
706166	SARS  2 E :::XXX::..	4182948
706167	2019 Novel Coronavirus; 2019-nCoV; 3 Self-Sustaining Sequence Replication; 3SR SR; Amplif; Amplification; Amplified; Corona virus; COVID19; COVID-19; DNA NUCLEIC ACID PROBE; DNA probe; ID; II; Infectious Disease; InfectiousDisease; LAT; LCR; Ligase chain reaction; Ligation-activated transcription; Microbiology; Misc; Miscellaneous; NAA+probe; NAAT; NASBA; Nucleic acid sequence based analysis; Other; PCR; Point in time; Polymerase chain reaction; Probe amp; Probe with ampification; Probe with target amplification; QBR; QNT; Quan; Quant; Quantitative; Random; SARS Coronavirus 1; SARS-CoV; SARS-CoV-1; SARS-CoV-2; SARS-CoV-2 N gene; SDA; Severe Acute Respiratory Syndrome; Spec; Strand Displacement Amplification; TMA; To be specified in another part of the message; Transcription mediated amplification; Unspecified; Viral Pneumonias; Wuhan coronavirus	4180186
706167	SARS-CoV-2 N gene Ct Spec Qn NAA+probe	4180186
706167	SARS  2 N :::XXX::..	4182948
706168	2019 Novel Coronavirus; 2019-nCoV; 3 Self-Sustaining Sequence Replication; 3SR SR; Amplif; Amplification; Amplified; Corona virus; COVID19; COVID-19; DNA NUCLEIC ACID PROBE; DNA probe; ID; II; Infectious Disease; InfectiousDisease; LAT; LCR; Ligase chain reaction; Ligation-activated transcription; Microbiology; Misc; Miscellaneous; NAA+probe; NAAT; NASBA; Nucleic acid sequence based analysis; Other; PCR; Point in time; Polymerase chain reaction; Probe amp; Probe with ampification; Probe with target amplification; QBR; QNT; Quan; Quant; Quantitative; Random; SARS Coronavirus 1; SARS-CoV; SARS-CoV-1; SARS-CoV-2; SARS-CoV-2 ORF1ab; SDA; Severe Acute Respiratory Syndrome; Spec; Strand Displacement Amplification; TMA; To be specified in another part of the message; Transcription mediated amplification; Unspecified; Viral Pneumonias; Wuhan coronavirus	4180186
706168	SARS-CoV-2 ORF1ab Ct Spec Qn NAA+probe	4180186
706168	SARS  2 ORF1ab :::XXX::..	4182948
706169	2019 Novel Coronavirus; 2019-nCoV; 3 Self-Sustaining Sequence Replication; 3SR SR; Amplif; Amplification; Amplified; Corona virus; COVID19; COVID-19; DNA NUCLEIC ACID PROBE; DNA probe; ID; II; Infectious Disease; InfectiousDisease; LAT; LCR; Ligase chain reaction; Ligation-activated transcription; Microbiology; Misc; Miscellaneous; NAA+probe; NAAT; NASBA; Nucleic acid sequence based analysis; Other; Pan; PANEL.MICROBIOLOGY; Panl; PCR; PH; Pnl; Point in time; Polymerase chain reaction; Probe amp; Probe with ampification; Probe with target amplification; Public Health; PublicHealth; QBR; Random; Ribonucleic acid; SARS Coronavirus 1; SARS-CoV; SARS-CoV-1; SARS-CoV-2; SARS-CoV-2 RNA Pnl; SDA; Severe Acute Respiratory Syndrome; Spec; Strand Displacement Amplification; TMA; To be specified in another part of the message; Transcription mediated amplification; Unspecified; Viral Pneumonias; Wuhan coronavirus	4180186
706169	SARS-CoV-2 RNA Pnl Spec NAA+probe	4180186
706169	SARS  2 RNA :-::XXX:-:..	4182948
706171	SARS-related CoV N Spec Ql NAA N3	4180186
706171	3 Self-Sustaining Sequence Replication; 3SR SR; Amplif; Amplification; Amplified; Centers for Disease Control and Prevention; Corona virus; DNA NUCLEIC ACID PROBE; DNA probe; ID; Infectious Disease; InfectiousDisease; LAT; LCR; Ligase chain reaction; Ligation-activated transcription; Microbiology; Misc; Miscellaneous; NAA N3; NAA+probe; NAAT; NASBA; Nucleic acid sequence based analysis; Ordinal; Other; PCR; PH; Point in time; Polymerase chain reaction; PR; Probe amp; Probe with ampification; Probe with target amplification; Public Health; PublicHealth; QBR; QL; Qual; Qualitative; Random; SARSr-CoV; SARS-related CoV N; Screen; SDA; Severe Acute Respiratory Syndrome; Spec; Strand Displacement Amplification; TMA; To be specified in another part of the message; Transcription mediated amplification; Unspecified	4180186
706171	SARS- N :::XXX::...CDC - N3	4182948
706172	SARS-related CoV N Ct Spec Qn NAA N3	4180186
706172	3 Self-Sustaining Sequence Replication; 3SR SR; Amplif; Amplification; Amplified; Centers for Disease Control and Prevention; Corona virus; DNA NUCLEIC ACID PROBE; DNA probe; ID; Infectious Disease; InfectiousDisease; LAT; LCR; Ligase chain reaction; Ligation-activated transcription; Microbiology; Misc; Miscellaneous; NAA N3; NAA+probe; NAAT; NASBA; Nucleic acid sequence based analysis; Other; PCR; PH; Point in time; Polymerase chain reaction; Probe amp; Probe with ampification; Probe with target amplification; Public Health; PublicHealth; QBR; QNT; Quan; Quant; Quantitative; Random; SARSr-CoV; SARS-related CoV N; SDA; Severe Acute Respiratory Syndrome; Spec; Strand Displacement Amplification; TMA; To be specified in another part of the message; Transcription mediated amplification; Unspecified	4180186
706172	SARS- N :::XXX::...CDC - N3	4182948
706175	2019 Novel Coronavirus; 2019-nCoV; 3 Self-Sustaining Sequence Replication; 3SR SR; Amplif; Amplification; Amplified; Corona virus; COVID19; COVID-19; DNA NUCLEIC ACID PROBE; DNA probe; ID; II; Infectious Disease; InfectiousDisease; LAT; LCR; Ligase chain reaction; Ligation-activated transcription; Microbiology; Misc; Miscellaneous; NAA+probe; NAAT; NASBA; Nucleic acid sequence based analysis; Ordinal; Other; PCR; PH; Point in time; Polymerase chain reaction; PR; Probe amp; Probe with ampification; Probe with target amplification; Public Health; PublicHealth; QBR; QL; Qual; Qualitative; Random; SARS Coronavirus 1; SARS-CoV; SARS-CoV-1; SARS-CoV-2; SARS-CoV-2 N gene; Screen; SDA; Severe Acute Respiratory Syndrome; Spec; Strand Displacement Amplification; TMA; To be specified in another part of the message; Transcription mediated amplification; Unspecified; Viral Pneumonias; Wuhan coronavirus	4180186
706175	SARS-CoV-2 N gene Spec Ql NAA+probe	4180186
706175	SARS  2 N :::XXX::..	4182948
706177	2019 Novel Coronavirus; 2019-nCoV; ABS; Aby; Antby; Anti; Antibodies; Antibody; Arbitrary concentration; Autoantibodies; Autoantibody; Corona virus; COVID19; COVID-19; EIA; ELFA; ELISA; Enzyme immunoassay; IAA; ID; II; Immune globulin G; Immunoglobulin G; Infectious Disease; InfectiousDisease; MEIA; Microbiology; Pl; Plasma; Plsm; Point in time; QNT; Quan; Quant; Quantitative; Random; SARS Coronavirus 1; SARS-CoV; SARS-CoV-1; SARS-CoV-2; SerP; SerPl; SerPlas; Serum; Serum or plasma; Severe Acute Respiratory Syndrome; SR; SUDS; Viral Pneumonias; Wuhan coronavirus	4180186
706177	SARS-CoV-2 IgG SerPl IA-aCnc	4180186
706177	SARS  2 .IgG:::/::	4182948
706180	2019 Novel Coronavirus; 2019-nCoV; ABS; Aby; Antby; Anti; Antibodies; Antibody; Autoantibodies; Autoantibody; Blood; Corona virus; COVID19; COVID-19; EIA; ELFA; ELISA; Enzyme immunoassay; IAA; ID; II; Immune globulin M; Immunoglobulin M; Infectious Disease; InfectiousDisease; MEIA; Microbiology; Ordinal; Pl; PlasBld; Plasma; Plsm; Point in time; PR; QL; Qual; Qualitative; Random; SARS Coronavirus 1; SARS-CoV; SARS-CoV-1; SARS-CoV-2; Screen; SerP; SerPl; SerPlas; SerPlBld; Serum; Serum or plasma; Serum, plasma or whole blood; Severe Acute Respiratory Syndrome; SR; SUDS; Viral Pneumonias; WB; Whole blood; Wuhan coronavirus	4180186
706180	SARS-CoV-2 IgM SerPlBld Ql IA.rapid	4180186
706180	SARS  2 .IgM::://::.	4182948
706181	2019 Novel Coronavirus; 2019-nCoV; ABS; Aby; Antby; Anti; Antibodies; Antibody; Autoantibodies; Autoantibody; Blood; Corona virus; COVID19; COVID-19; EIA; ELFA; ELISA; Enzyme immunoassay; IAA; ID; II; Immune globulin G; Immunoglobulin G; Infectious Disease; InfectiousDisease; MEIA; Microbiology; Ordinal; Pl; PlasBld; Plasma; Plsm; Point in time; PR; QL; Qual; Qualitative; Random; SARS Coronavirus 1; SARS-CoV; SARS-CoV-1; SARS-CoV-2; Screen; SerP; SerPl; SerPlas; SerPlBld; Serum; Serum or plasma; Serum, plasma or whole blood; Severe Acute Respiratory Syndrome; SR; SUDS; Viral Pneumonias; WB; Whole blood; Wuhan coronavirus	4180186
706181	SARS-CoV-2 IgG SerPlBld Ql IA.rapid	4180186
706181	SARS  2 .IgG::://::.	4182948
715260	2019 Novel Coronavirus; 2019-nCoV; 3 Self-Sustaining Sequence Replication; 3SR SR; Amplif; Amplification; Amplified; Corona virus; COVID19; COVID-19; DNA NUCLEIC ACID PROBE; DNA probe; ID; II; Infectious Disease; InfectiousDisease; LAT; LCR; Ligase chain reaction; Ligation-activated transcription; Microbiology; NAA+probe; NAAT; NASBA; Nucleic acid sequence based analysis; Oral fluid; Ordinal; PCR; Point in time; Polymerase chain reaction; PR; Probe amp; Probe with ampification; Probe with target amplification; QBR; QL; Qual; Qualitative; Random; Ribonucleic acid; Sal; SARS Coronavirus 1; SARS-CoV; SARS-CoV-1; SARS-CoV-2; Screen; SDA; Severe Acute Respiratory Syndrome; Strand Displacement Amplification; TMA; Transcription mediated amplification; Viral Pneumonias; Wuhan coronavirus	4180186
715260	SARS-CoV-2 RNA Sal Ql NAA+probe	4180186
715260	SARS  2 RNA:::::..	4182948
715261	2019 Novel Coronavirus; 2019-nCoV; Corona virus; COVID19; COVID-19; high-throughput sequencing; HTS; ID; II; Infectious Disease; InfectiousDisease; Microbiology; Next generation sequencing; NGS; Oral fluid; Ordinal; Point in time; PR; QL; Qual; Qualitative; Random; Ribonucleic acid; Sal; SARS Coronavirus 1; SARS-CoV; SARS-CoV-1; SARS-CoV-2; Screen; Severe Acute Respiratory Syndrome; Viral Pneumonias; Wuhan coronavirus	4180186
715261	SARS-CoV-2 RNA Sal Ql Seq	4180186
715261	SARS  2 RNA:::::	4182948
715262	2019 Novel Coronavirus; 2019-nCoV; 3 Self-Sustaining Sequence Replication; 3SR SR; Amplif; Amplification; Amplified; Corona virus; COVID19; COVID-19; DNA NUCLEIC ACID PROBE; DNA probe; ID; II; Infectious Disease; InfectiousDisease; LAT; LCR; Ligase chain reaction; Ligation-activated transcription; Log NCNC; Log#; Microbiology; Misc; Miscellaneous; NAA+probe; NAAT; NASBA; Nucleic acid sequence based analysis; Other; PCR; Point in time; Polymerase chain reaction; Probe amp; Probe with ampification; Probe with target amplification; QBR; QNT; Quan; Quant; Quantitative; Random; Ribonucleic acid; SARS Coronavirus 1; SARS-CoV; SARS-CoV-1; SARS-CoV-2; SDA; Severe Acute Respiratory Syndrome; Spec; Strand Displacement Amplification; TMA; To be specified in another part of the message; Transcription mediated amplification; Unspecified; Viral load; Viral Pneumonias; Wuhan coronavirus	4180186
715262	SARS  2 RNA:::XXX::..	4182948
715262	SARS-CoV-2 RNA Spec NAA+probe-Log#	4180186
715263	2019 Novel Coronavirus; 2019-nCoV; Consult note; Coronavirus disease 2019; COVID19; COVID-19 Intub+Consult; DOC.ONT; Document; Encounter; Evaluation and management; Evaluation and management note; Finding; Findings; notes; Point in time; Random; SARS Coronavirus; SARS-CoV-2; SARS-Related Coronavirus; Visit note	4180186
715263	COVID-19 Intub+Consult	4180186
715263	COVID-19++:::{}::{}	4182948
715268	2019 Novel Coronavirus; 2019-nCoV; Coronavirus disease 2019; COVID19; COVID-19 Intub Proced; DOC.ONT; Document; Encounter; Evaluation and management; Evaluation and management note; Finding; Findings; notes; Point in time; Random; SARS Coronavirus; SARS-CoV-2; SARS-Related Coronavirus; Visit note	4180186
715268	COVID-19 Intub Proced	4180186
715268	COVID-19++:::{}::{}	4182948
715270	2019 Novel Coronavirus; 2019-nCoV; Conf eval note; Coronavirus disease 2019; COVID19; COVID-19 Intub Conference; DOC.ONT; Document; Encounter; Evaluation and management; Evaluation and management note; Finding; Findings; notes; Point in time; Random; SARS Coronavirus; SARS-CoV-2; SARS-Related Coronavirus; Visit note	4180186
715270	Team COVID-19 Intub Conference	4180186
715270	COVID-19++:::{}::	4182948
715271	2019 Novel Coronavirus; 2019-nCoV; CCM; Consult note; Continuity assessment record and evaluation; Coronavirus disease 2019; COVID19; COVID-19 Consult note; DOC.ONT; Document; Encounter; Evaluation and management; Evaluation and management note; Finding; Findings; notes; Point in time; Random; SARS Coronavirus; SARS-CoV-2; SARS-Related Coronavirus; Visit note	4180186
715271	CCM COVID-19 Consult note	4180186
715271	COVID-19+:::{}::	4182948
723459	2019 Novel Coronavirus; 2019-nCoV; ABS; Aby; Antby; Anti; Antibodies; Antibody; Arbitrary concentration; Autoantibodies; Autoantibody; Corona virus; COVID19; COVID-19; EIA; ELFA; ELISA; Enzyme immunoassay; IAA; ID; II; Immune globulin A; Immunoglobulin A; Infectious Disease; InfectiousDisease; MEIA; Microbiology; Pl; Plasma; Plsm; Point in time; QNT; Quan; Quant; Quantitative; Random; SARS Coronavirus 1; SARS-CoV; SARS-CoV-1; SARS-CoV-2; SerP; SerPl; SerPlas; Serum; Serum or plasma; Severe Acute Respiratory Syndrome; SR; SUDS; Viral Pneumonias; Wuhan coronavirus	4180186
723459	SARS-CoV-2 IgA SerPl IA-aCnc	4180186
723459	SARS  2 .IgA:::/::	4182948
723464	2019 Novel Coronavirus; 2019-nCoV; 3 Self-Sustaining Sequence Replication; 3SR SR; Amplif; Amplification; Amplified; Corona virus; COVID19; COVID-19; DNA NUCLEIC ACID PROBE; DNA probe; ID; II; Infectious Disease; InfectiousDisease; LAT; LCR; Ligase chain reaction; Ligation-activated transcription; Microbiology; Misc; Miscellaneous; NAA+probe; NAAT; NASBA; Nucleic acid sequence based analysis; Ordinal; Other; PCR; Point in time; Polymerase chain reaction; PR; Probe amp; Probe with ampification; Probe with target amplification; QBR; QL; Qual; Qualitative; Random; SARS Coronavirus 1; SARS-CoV; SARS-CoV-1; SARS-CoV-2; SARS-CoV-2 ORF1ab; Screen; SDA; Severe Acute Respiratory Syndrome; Spec; Strand Displacement Amplification; TMA; To be specified in another part of the message; Transcription mediated amplification; Unspecified; Viral Pneumonias; Wuhan coronavirus	4180186
723464	SARS-CoV-2 ORF1ab Spec Ql NAA+probe	4180186
723464	SARS  2 ORF1ab :::XXX::..	4182948
723466	2019 Novel Coronavirus; 2019-nCoV; 3 Self-Sustaining Sequence Replication; 3SR SR; Amplif; Amplification; Amplified; Corona virus; COVID19; COVID-19; DNA NUCLEIC ACID PROBE; DNA probe; ID; II; Infectious Disease; InfectiousDisease; LAT; LCR; Ligase chain reaction; Ligation-activated transcription; Microbiology; Misc; Miscellaneous; NAA+probe; NAAT; NASBA; Nucleic acid sequence based analysis; Ordinal; Other; PCR; Point in time; Polymerase chain reaction; PR; Probe amp; Probe with ampification; Probe with target amplification; QBR; QL; Qual; Qualitative; Random; S prime; SARS Coronavirus 1; SARS-CoV; SARS-CoV-1; SARS-CoV-2; SARS-CoV-2 S gene; SARS-Related Coronavirus; Screen; SDA; Severe Acute Respiratory Syndrome; Spec; Strand Displacement Amplification; TMA; To be specified in another part of the message; Transcription mediated amplification; Unspecified; Viral Pneumonias; Wuhan coronavirus	4180186
723466	SARS-CoV-2 S gene Spec Ql NAA+probe	4180186
723466	SARS  2 S :::XXX::..	4182948
723467	SARS-CoV-2 S gene Ct Resp Qn NAA+probe	4180186
723467	SARS  2 S :::::..	4182948
723467	2019 Novel Coronavirus; 2019-nCoV; 3 Self-Sustaining Sequence Replication; 3SR SR; Amplif; Amplification; Amplified; Breathing; Corona virus; COVID19; COVID-19; DNA NUCLEIC ACID PROBE; DNA probe; ID; II; Infectious Disease; InfectiousDisease; LAT; LCR; Ligase chain reaction; Ligation-activated transcription; Lungs; Microbiology; NAA+probe; NAAT; NASBA; Nucleic acid sequence based analysis; PCR; Point in time; Polymerase chain reaction; Probe amp; Probe with ampification; Probe with target amplification; QBR; QNT; Quan; Quant; Quantitative; Random; RS; S prime; SARS Coronavirus 1; SARS-CoV; SARS-CoV-1; SARS-CoV-2; SARS-CoV-2 S gene; SARS-Related Coronavirus; SDA; Severe Acute Respiratory Syndrome; Spec; Strand Displacement Amplification; TMA; Transcription mediated amplification; Viral Pneumonias; Wuhan coronavirus	4180186
723468	2019 Novel Coronavirus; 2019-nCoV; 3 Self-Sustaining Sequence Replication; 3SR SR; Amplif; Amplification; Amplified; Corona virus; COVID19; COVID-19; DNA NUCLEIC ACID PROBE; DNA probe; ID; II; Infectious Disease; InfectiousDisease; LAT; LCR; Ligase chain reaction; Ligation-activated transcription; Microbiology; Misc; Miscellaneous; NAA+probe; NAAT; NASBA; Nucleic acid sequence based analysis; Other; PCR; Point in time; Polymerase chain reaction; Probe amp; Probe with ampification; Probe with target amplification; QBR; QNT; Quan; Quant; Quantitative; Random; S prime; SARS Coronavirus 1; SARS-CoV; SARS-CoV-1; SARS-CoV-2; SARS-CoV-2 S gene; SARS-Related Coronavirus; SDA; Severe Acute Respiratory Syndrome; Spec; Strand Displacement Amplification; TMA; To be specified in another part of the message; Transcription mediated amplification; Unspecified; Viral Pneumonias; Wuhan coronavirus	4180186
723468	SARS-CoV-2 S gene Ct Spec Qn NAA+probe	4180186
723468	SARS  2 S :::XXX::..	4182948
723472	3 Self-Sustaining Sequence Replication; 3SR SR; Amplif; Amplification; Amplified; Corona virus; DNA NUCLEIC ACID PROBE; DNA probe; ID; Infectious Disease; InfectiousDisease; LAT; LCR; Ligase chain reaction; Ligation-activated transcription; Microbiology; Misc; Miscellaneous; NAA+probe; NAAT; NASBA; Nucleic acid sequence based analysis; Ordinal; Other; PCR; Point in time; Polymerase chain reaction; PR; Probe amp; Probe with ampification; Probe with target amplification; QBR; QL; Qual; Qualitative; Random; Ribonucleic acid; SARSr-CoV; Screen; SDA; Severe Acute Respiratory Syndrome; Spec; Strand Displacement Amplification; TMA; To be specified in another part of the message; Transcription mediated amplification; Unspecified	4180186
723472	SARSr-CoV RNA Spec Ql NAA+probe	4180186
723472	SARS- RNA:::XXX::..	4182948
723477	SARS-CoV-2 Ag Resp Ql IA.rapid	4180186
723477	SARS  2 :::::.	4182948
723477	2019 Novel Coronavirus; 2019-nCoV; Antigen; Antigens; Breathing; Corona virus; COVID19; COVID-19; EIA; ELFA; ELISA; Enzyme immunoassay; IAA; ID; II; Infectious Disease; InfectiousDisease; Lungs; MEIA; Microbiology; Ordinal; PH; Point in time; PR; Public Health; PublicHealth; Ql; Qual; Qualitative; Random; RS; SARS Coronavirus 1; SARS-CoV; SARS-CoV-1; SARS-CoV-2; Screen; Severe Acute Respiratory Syndrome; Spec; SUDS; Viral Pneumonias; Wuhan coronavirus	4180186
723478	SARS-CoV-2 ORF1ab Resp Ql NAA+probe	4180186
723478	SARS  2 ORF1ab :::::..	4182948
723478	2019 Novel Coronavirus; 2019-nCoV; 3 Self-Sustaining Sequence Replication; 3SR SR; Amplif; Amplification; Amplified; Breathing; Corona virus; COVID19; COVID-19; DNA NUCLEIC ACID PROBE; DNA probe; ID; II; Infectious Disease; InfectiousDisease; LAT; LCR; Ligase chain reaction; Ligation-activated transcription; Lungs; Microbiology; NAA+probe; NAAT; NASBA; Nucleic acid sequence based analysis; Ordinal; PCR; Point in time; Polymerase chain reaction; PR; Probe amp; Probe with ampification; Probe with target amplification; QBR; QL; Qual; Qualitative; Random; RS; SARS Coronavirus 1; SARS-CoV; SARS-CoV-1; SARS-CoV-2; SARS-CoV-2 ORF1ab; Screen; SDA; Severe Acute Respiratory Syndrome; Spec; Strand Displacement Amplification; TMA; Transcription mediated amplification; Viral Pneumonias; Wuhan coronavirus	4180186
723479	2019 Novel Coronavirus; 2019-nCoV; ABS; Aby; Antby; Anti; Antibodies; Antibody; Autoantibodies; Autoantibody; Corona virus; COVID19; COVID-19; EIA; ELFA; ELISA; Enzyme immunoassay; IAA; ID; II; Immune globulin G; Immune globulin M; Immunoglobulin G; Immunoglobulin M; Infectious Disease; InfectiousDisease; MEIA; Microbiology; Ordinal; Pl; Plasma; Plsm; Point in time; PR; QL; Qual; Qualitative; Random; SARS Coronavirus 1; SARS-CoV; SARS-CoV-1; SARS-CoV-2; Screen; SerP; SerPl; SerPlas; Serum; Serum or plasma; Severe Acute Respiratory Syndrome; SR; SUDS; Viral Pneumonias; Wuhan coronavirus	4180186
723479	SARS-CoV-2 IgG+IgM SerPl Ql IA	4180186
723479	SARS  2 .IgG+IgM:::/::	4182948
723480	2019 Novel Coronavirus; 2019-nCoV; ABS; Aby; Antby; Anti; Antibodies; Antibody; Autoantibodies; Autoantibody; Corona virus; COVID19; COVID-19; ID; II; Impression; Impression/interpretation of study; Impressions; Infectious Disease; InfectiousDisease; Interp; Interpretation; Microbiology; Nominal; Pl; Plasma; Plsm; Point in time; Random; SARS Coronavirus 1; SARS-CoV; SARS-CoV-1; SARS-CoV-2; SerP; SerPl; SerPlas; Serum; Serum or plasma; Severe Acute Respiratory Syndrome; SR; Viral Pneumonias; Wuhan coronavirus	4180186
723480	SARS-CoV-2 Ab SerPl-Imp	4180186
723480	SARS  2 :::/:	4182948
723481	Date contact confirmed as case	4180186
723481	Point in time; Public Health; PUBLICHEALTH; QNT; Quan; Quant; Quantitative; Random	4180186
723481	:::^:	4182948
723485	Exp; Exposure pnl; H+P; P prime; Pan; PANEL.H&P; Panl; Pnl; Point in time; Random	4180186
723485	Exposure pnl	4180186
723485	:-::^:-	4182948
723487	ADMIN; Ident; Identifier; Nominal; PH; Point in time; Public Health; PublicHealth; Random	4180186
723487	Case ID	4180186
723487	:::^:	4182948
723488	ADMIN; Ident; Identifier; Intradermal; Nominal; Point in time; Random	4180186
723488	Contact ID Contact	4180186
723488	:::^:	4182948
733569	XX Sex Reversals	4180186
733569	XX Sex Reversal	4180186
733569	XX Male Syndromes	4180186
733569	XX Male Syndrome	4180186
733569	Syndrome, XX Male	4180186
733569	Syndromes, XX Male	4180186
733569	Sex Reversal, XX	4180186
733569	Sex Reversals, XX	4180186
733569	Sex Reversal, Gonadal, 46, XX	4180186
733569	Reversal, XX Sex	4180186
733569	Reversals, XX Sex	4180186
733569	Gonadal Sex Reversal, 46, XX	4180186
733569	46, XX Testicular DSD	4180186
733569	46, XX Testicular Disorder of Sex Development	4180186
733569	46, XX Gonadal Sex Reversal	4180186
733570	Syndrome, Anarchic Hand	4180186
733570	Syndrome, Alien Limb	4180186
733570	Syndrome, Alien Leg	4180186
733570	Syndrome, Alien Hand	4180186
733570	Phenomenon, Alien Limb	4180186
733570	Phenomenon, Alien Hand	4180186
733570	Anarchic Hand Syndromes	4180186
733570	Anarchic Hand Syndrome	4180186
733570	Alien Limb Syndromes	4180186
733570	Alien Limb Syndrome	4180186
733570	Alien Limb Phenomenons	4180186
733570	Alien Leg Syndromes	4180186
733570	Alien Leg Syndrome	4180186
733570	Alien Hand Syndromes	4180186
733570	Alien Hand Syndrome	4180186
733570	Alien Hand Phenomenons	4180186
733570	Alien Hand Phenomenon	4180186
733572	Arch Aneurysm, Aortic	4180186
733572	Aortic Arch Aneurysms	4180186
733572	Aortic Arch Aneurysm	4180186
733574	Vasculitis, Pauci-Immune	4180186
733574	Vasculitis, ANCA-Associated	4180186
733574	Vasculitides, Pauci-Immune	4180186
733574	Vasculitides, ANCA-Associated	4180186
733574	Vasculitide, ANCA-Associated	4180186
733574	Pauci-Immune Vasculitis	4180186
733574	Pauci Immune Vasculitis	4180186
733574	Pauci-Immune Vasculitides	4180186
733574	Anti Neutrophil Cytoplasmic Antibody Associated Vasculitis	4180186
733574	ANCA-Associated Vasculitis	4180186
733574	ANCA Associated Vasculitis	4180186
733574	ANCA-Associated Vasculitides	4180186
733574	ANCA Associated Vasculitides	4180186
733574	ANCA-Associated Vasculitide	4180186
733575	Receptor Encephalitis, Anti-NMDA	4180186
733575	Receptor Encephalitides, Anti-NMDA	4180186
733575	Paraneoplastic Anti-N-Methyl-D-Aspartate Receptor Encephalitis	4180186
733575	Paraneoplastic Anti N Methyl D Aspartate Receptor Encephalitis	4180186
733575	Paraneoplastic Anti-NMDAR Encephalitis	4180186
733575	Paraneoplastic Anti NMDAR Encephalitis	4180186
733575	Paraneoplastic Anti-NMDAR Encephalitides	4180186
733575	Paraneoplastic Anti-NMDA Receptor Encephalitis	4180186
733575	Paraneoplastic Anti NMDA Receptor Encephalitis	4180186
733575	Non-paraneoplastic Anti-N-Methyl-D-Aspartate Receptor Encephalitis	4180186
733575	Non paraneoplastic Anti N Methyl D Aspartate Receptor Encephalitis	4180186
733575	Non-paraneoplastic Anti-NMDAR Encephalitis	4180186
733575	Non paraneoplastic Anti NMDAR Encephalitis	4180186
733575	Non-paraneoplastic Anti-NMDAR Encephalitides	4180186
733575	Non-paraneoplastic Anti-NMDA Receptor Encephalitis	4180186
733575	Non paraneoplastic Anti NMDA Receptor Encephalitis	4180186
733575	Encephalitis, Paraneoplastic Anti-NMDAR	4180186
733575	Encephalitis, Non-paraneoplastic Anti-NMDAR	4180186
733575	Encephalitis, Anti-N-Methyl-D-Aspartate Receptor	4180186
733575	Encephalitis, Anti-NMDA Receptor	4180186
733575	Encephalitis, Anti-NMDAR	4180186
733575	Encephalitides, Paraneoplastic Anti-NMDAR	4180186
733575	Encephalitides, Non-paraneoplastic Anti-NMDAR	4180186
733575	Encephalitides, Anti-N-Methyl-D-Aspartate Receptor	4180186
733575	Encephalitides, Anti-NMDA Receptor	4180186
733575	Encephalitides, Anti-NMDAR	4180186
733575	Anti N Methyl D Aspartate Receptor Encephalitis	4180186
733575	Anti-N-Methyl-D-Aspartate Receptor Encephalitides	4180186
