concept_id	concept_synonym_name	language_concept_id
4084157	Rust remover causing toxic effect (disorder)	4180186
4084160	Rooting compound causing toxic effect (disorder)	4180186
4084166	Crayon causing toxic effect (disorder)	4180186
4084168	Drug-induced anaphylaxis (disorder)	4180186
4084172	Chemical-induced angioedema-urticaria	4180186
4084172	Chemical-induced angio-oedema-urticaria	4180186
4084172	Chemical-aggravated angio-oedema-urticaria	4180186
4084172	Chemical-aggravated angioedema-urticaria (disorder)	4180186
4084179	Fine needle biopsy of large intestine (procedure)	4180186
4084179	Fine needle aspiration biopsy of large intestine	4180186
4084180	Muscular re-education NOS (procedure)	4180186
4084183	Physical exercise NOS (regime/therapy)	4180186
4084184	Continuous passive mobilisation of shoulder	4180186
4084184	Continuous passive mobilization of shoulder (regime/therapy)	4180186
4084186	Antenatal exercises (regime/therapy)	4180186
4084187	Bleached hair (finding)	4180186
4084188	Recreational therapy NOS (regime/therapy)	4180186
4084190	Domestic task rehabilitation (regime/therapy)	4180186
4084191	Use of aids for daily life (regime/therapy)	4180186
4084193	Mobilising	4180186
4084193	Mobilizing (regime/therapy)	4180186
4084194	Functional psychotherapy NOS (regime/therapy)	4180186
4084195	Provocative therapy (regime/therapy)	4180186
4084198	Stimulative psychotherapy NOS (regime/therapy)	4180186
4084200	Oxychlorosene	4180186
4084200	Product containing oxychlorosene (medicinal product)	4180186
4084201	Samaritans advisory service (regime/therapy)	4180186
4084202	Anti-criminal psychotherapy (regime/therapy)	4180186
4084203	Care of potential criminal (regime/therapy)	4180186
4084205	Algid malaria - malarial shock	4180186
4084205	Algid malaria (disorder)	4180186
4084207	Social care (regime/therapy)	4180186
4084209	Care of disabled (regime/therapy)	4180186
4084210	Application to foster a child (procedure)	4180186
4084212	Psycho./socio.- therapy NOS (regime/therapy)	4180186
4084213	Referral for further care (procedure)	4180186
4084214	Admission to cardiac intensive care unit (procedure)	4180186
4084215	Admission to respiratory intensive care unit (procedure)	4180186
4084217	Gynaecological emergency hospital admission	4180186
4084217	Gynecological emergency hospital admission (procedure)	4180186
4084218	Orthopaedic emergency hospital admission	4180186
4084218	Orthopedic emergency hospital admission (procedure)	4180186
4084220	Ophthalmological emergency hospital admission (procedure)	4180186
4084223	Lumbosacral part of anterior longitudinal ligament (body structure)	4180186
4084228	Entire posterior meniscofemoral ligament (body structure)	4180186
4084237	Structure of T5/T6 interspinous ligament (body structure)	4180186
4084237	Structure of T5/T6 interspinous ligament	4180186
4084237	T5/T6 interspinous ligament (body structure)	4180186
4084240	Entire venulae rectae (body structure)	4180186
4084241	Structure of T11/T12 interspinous ligament (body structure)	4180186
4084241	Structure of T11/T12 interspinous ligament	4180186
4084241	T11/T12 interspinous ligament (body structure)	4180186
4084242	Structure of L2/L3 interspinous ligament (body structure)	4180186
4084242	Structure of L2/L3 interspinous ligament	4180186
4084242	L2/L3 interspinous ligament (body structure)	4180186
4084245	Entire obliquus capitis muscle (body structure)	4180186
4084246	Obliquus capitis inferior (body structure)	4180186
4084248	Structure of T1-T2 rotator thoracis (body structure)	4180186
4084248	Structure of T1-T2 rotator thoracis	4180186
4084248	T1-T2 rotator thoracis (body structure)	4180186
4084248	First rotator thoracis	4180186
4084251	Structure of L2-L3 interspinalis lumborum	4180186
4084251	Structure of L2-L3 interspinalis lumborum (body structure)	4180186
4084251	Second interspinalis lumborum	4180186
4084251	L2-L3 interspinalis lumborum (body structure)	4180186
4084252	Entire C2-C3 intertransversarius cervicis anterior (body structure)	4180186
4084252	Entire second intertransversarius cervicis anterior	4180186
4084253	Entire C4-C5 intertransversarius cervicis anterior (body structure)	4180186
4084253	Entire fourth intertransversarius cervicis anterior	4180186
4084255	Entire sixth intertransversarius cervicis posterior	4180186
4084255	Entire C6-C7 intertransversarius cervicis posterior (body structure)	4180186
4084259	Insufficient clinical detail given (finding)	4180186
4084263	Structure of lymphatic system of trunk (body structure)	4180186
4084263	Lymphatic structure of trunk	4180186
4084264	Structure of peroneal tendon (body structure)	4180186
4084264	Structure of peroneal tendon	4180186
4084264	Peroneal tendon (body structure)	4180186
4084265	Arthritis due to bleeding disorder (disorder)	4180186
4084267	System involvement status (attribute)	4180186
4084268	Idiopathic dermatomyositis (disorder)	4180186
4084269	Primary synovial ostechondromatosis (disorder)	4180186
4084271	Spontaneous joint effusion (disorder)	4180186
4084272	Spontaneous hemarthrosis (disorder)	4180186
4084272	Spontaneous haemarthrosis	4180186
4084275	SAPS - simplified acute physiology score	4180186
4084275	Simplified acute physiology score (observable entity)	4180186
4084276	Structure of upper zone of lung (body structure)	4180186
4084276	Structure of upper zone of lung	4180186
4084276	Upper zone of lung (body structure)	4180186
4084279	Accelerating waveform (qualifier value)	4180186
4084283	Brainstem death criteria not fulfilled (finding)	4180186
4084285	Structure of radial nerve of wrist region (body structure)	4180186
4084285	Structure of radial nerve of wrist region	4180186
4084285	Radial nerve at wrist (body structure)	4180186
4084287	Infection of cartilage graft (disorder)	4180186
4084291	Loosening of femoral component of total knee replacement (disorder)	4180186
4084292	Infection of bone wire (disorder)	4180186
4084292	Infected wire	4180186
4084302	Structure of Krause's end bulb (body structure)	4180186
4084302	Structure of Krause's end bulb	4180186
4084302	Krause end bulb	4180186
4084302	Krause's end bulb (body structure)	4180186
4084303	Magnetic resonance imaging of neck vessels	4180186
4084303	Magnetic resonance imaging of neck vessels (procedure)	4180186
4084306	MRS of body	4180186
4084306	Magnetic resonance spectroscopy of body (procedure)	4180186
4084308	Thermography of scrotum (procedure)	4180186
4084309	Intramuscular induction of general anaesthesia	4180186
4084309	IM - Intramuscular induction	4180186
4084309	Intramuscular induction of general anesthesia (procedure)	4180186
4084311	Entire right ankle (body structure)	4180186
4084312	SV - Spontaneous ventilation	4180186
4084312	SR - Spontaneous respiration	4180186
4084312	Spontaneous respiration (finding)	4180186
4084312	Spontaneous ventilation	4180186
4084315	Protection of patient (procedure)	4180186
4084318	Tourniquet release (procedure)	4180186
4084318	Tourniquet off	4180186
4084319	Bronchoscope, device	4180186
4084319	Bronchoscope, device (physical object)	4180186
4084323	Poisoning caused by sodium valproate	4180186
4084323	Poisoning caused by sodium valproate (disorder)	4180186
4084324	Poisoning caused by bronchodilator drug (disorder)	4180186
4084324	Poisoning caused by bronchodilator drug	4180186
4084325	Vaccine poisoning (disorder)	4180186
4084326	Pentavalent arsenic compound causing toxic effect (disorder)	4180186
4084329	Liberty cap causing toxic effect (disorder)	4180186
4084329	Magic mushroom causing toxic effect	4180186
4084330	Argemone oil causing toxic effect (disorder)	4180186
4084330	Epidemic dropsy	4180186
4084331	Isocyanate causing toxic effect (disorder)	4180186
4084332	Phenoxyacid derivative herbicide causing toxic effect (disorder)	4180186
4084335	4,6-dinitro-o-cresol (DNOC) causing toxic effect	4180186
4084335	4,6-dinitro-o-cresol causing toxic effect (disorder)	4180186
4084335	4,6-dinitro-o-cresol causing toxic effect	4180186
4084336	Rheumatology emergency hospital admission (procedure)	4180186
4084337	Dermatology emergency hospital admission (procedure)	4180186
4084338	Radiotherapy emergency hospital admission (procedure)	4180186
4084339	Diabetic emergency hospital admission (procedure)	4180186
4084345	Non-urgent dermatology admission (procedure)	4180186
4084347	Non-urgent respiratory admission (procedure)	4180186
4084349	Neurological referral	4180186
4084349	Referral to neurology service (procedure)	4180186
4084351	Referral to psychiatrist for the elderly mentally ill (procedure)	4180186
4084351	Referral to psychogeriatrician	4180186
4084354	Referral to general surgical service (procedure)	4180186
4084354	General surgical referral	4180186
4084356	Referral to cardiothoracic surgeon (procedure)	4180186
4084358	Referral to general practitioner (procedure)	4180186
4084358	Referral to GP (general practitioner)	4180186
4084360	Referral to hematologist (procedure)	4180186
4084360	Referral to haematologist	4180186
4084363	Blood group antibody Fedor (substance)	4180186
4084364	Refer for terminal care (procedure)	4180186
4084366	Refer to other health worker (procedure)	4180186
4084367	Follow-up 2-3 days (finding)	4180186
4084368	Follow-up 3 weeks (finding)	4180186
4084369	Follow-up 2-3 months (finding)	4180186
4084374	Long-term assistance (qualifier value)	4180186
4084375	Entire second intertransversarius thoracis	4180186
4084375	Entire T11-T12 intertransversarius thoracis (body structure)	4180186
4084378	Focal origin (attribute)	4180186
4084379	Causative agent (attribute)	4180186
4084381	Electrical mechanism (attribute)	4180186
4084382	Bifidobacterium globosum (organism)	4180186
4084386	Sigmoidorectal intussusception (disorder)	4180186
4084388	Presentation (attribute)	4180186
4084389	Control of induction (attribute)	4180186
4084392	Rhonchus	4180186
4084392	Wheeze - rhonchi (finding)	4180186
4084393	Size of suction catheter (qualifier value)	4180186
4084398	Type of oxygenator (attribute)	4180186
4084401	Extent of removal (attribute)	4180186
4084402	Nodes removed (attribute)	4180186
4084403	Extent of disease (attribute)	4180186
4084404	Extent of reflux (attribute)	4180186
4084405	Mycobacterium gilvum (organism)	4180186
4084411	Affected	4180186
4084411	Affecting (qualifier value)	4180186
4084414	Entire pancreatic acinus (body structure)	4180186
4084416	Cannot remember reigning monarch	4180186
4084416	Unable to remember name of current monarch	4180186
4084416	Unable to remember name of reigning monarch (finding)	4180186
4084417	Expansive ideation (finding)	4180186
4084418	Preoccupation with compensation (finding)	4180186
4084419	Preoccupation with appearance (finding)	4180186
4084421	Loud thoughts (finding)	4180186
4084422	Thought echo (finding)	4180186
4084423	Entire thoracic vein	4180186
4084423	Entire vein of thorax (body structure)	4180186
4084425	Acquired valgus deformity of joint of upper limb (disorder)	4180186
4084426	Entire LRT - Lower respiratory tract	4180186
4084426	Entire lower respiratory tract (body structure)	4180186
4084429	Luxatio erecta (disorder)	4180186
4084430	Hypoxic-ischaemic coma	4180186
4084430	Hypoxic-ischemic coma (disorder)	4180186
4084431	Traumatic haemarthrosis of the knee joint	4180186
4084431	Traumatic hemarthrosis of the knee joint (disorder)	4180186
4084432	Fracture of the medial humeral epicondyle (disorder)	4180186
4084433	Fracture of posterior malleolus (disorder)	4180186
4084434	Rupture of tendon of lower limb (disorder)	4180186
4084436	Drainage of middle ear (procedure)	4180186
4084437	Abdominothoracic neuroblastoma (disorder)	4180186
4084439	Fetal heart monitoring (regime/therapy)	4180186
4084441	Parent unemployed (situation)	4180186
4084442	Perinatal asphyxia (disorder)	4180186
4084444	Vascular cannula insertion (procedure)	4180186
4084448	Unit of blood corpuscle analysis (qualifier value)	4180186
4084454	equivalents per unit volume (qualifier value)	4180186
4084455	%w/v	4180186
4084455	Weight/volume ratio (qualifier value)	4180186
4084455	Weight/volume ratio	4180186
4084459	yd2	4180186
4084459	Square yard	4180186
4084459	Square yard (qualifier value)	4180186
4084460	Unit of physiological rate (qualifier value)	4180186
4084461	Volume per unit time per unit area (qualifier value)	4180186
4084463	Polyester fume causing toxic effect	4180186
4084463	Toxic effect of polyester fumes (disorder)	4180186
4084464	Poisoning caused by puff adder venom (disorder)	4180186
4084464	Poisoning caused by puff adder venom	4180186
4084467	Bite of unidentified snake with neurological signs (disorder)	4180186
4084467	Poisoned bite of unidentified snake with neurological signs	4180186
4084468	Bite of unidentified snake with coagulopathy (disorder)	4180186
4084468	Poisoned bite of unidentified snake with coagulopathy	4180186
4084471	Leiperenia leiperi (organism)	4180186
4084472	Poisoning by cone shell venom (disorder)	4180186
4084475	Poisoning by sea wasp	4180186
4084475	Poisoning by box jellyfish sting (disorder)	4180186
4084477	Household product causing toxic effect (navigational concept)	4180186
4084478	Kitchen cleaning material causing toxic effect (disorder)	4180186
4084479	Dishwashing liquid causing toxic effect (disorder)	4180186
4084479	Washing-up liquid causing toxic effect	4180186
4084484	Solid air freshener causing toxic effect (disorder)	4180186
4084486	Decorative product causing toxic effect	4180186
4084486	Decorative product causing toxic effect (navigational concept)	4180186
4084487	Paint causing toxic effect (disorder)	4180186
4084488	Liquid paint causing toxic effect (disorder)	4180186
4084490	Sugar soap causing toxic effect (disorder)	4180186
4084492	Sealant causing toxic effect (disorder)	4180186
4084497	Cyanoacrylate causing toxic effect (disorder)	4180186
4084499	Refer to hospital casualty NOS (procedure)	4180186
4084500	Discharged from inpatient care (finding)	4180186
4084502	Arrange care by relative (regime/therapy)	4180186
4084506	Orthopedic self-referral (procedure)	4180186
4084506	Orthopaedic self-referral	4180186
4084507	Dermatology self-referral (procedure)	4180186
4084508	Paediatric D.V. requested	4180186
4084508	Pediatric D.V. requested	4180186
4084508	Pediatric domiciliary visit requested (finding)	4180186
4084508	Paediatric domiciliary visit requested	4180186
4084510	Geriatric domiciliary visit requested (finding)	4180186
4084510	Geriatric D.V. requested	4180186
4084512	Diabetology D.V. requested	4180186
4084512	Diabetology domiciliary visit requested (finding)	4180186
4084514	Neurosurgical domiciliary visit requested (finding)	4180186
4084514	Neurosurgical D.V. requested	4180186
4084515	Gynecological domiciliary visit requested (finding)	4180186
4084515	Gynaecological D.V. requested	4180186
4084515	Gynaecological domiciliary visit requested	4180186
4084515	Gynecological D.V. requested	4180186
4084520	Neurosurgical D.V. done	4180186
4084520	Neurosurgical domiciliary visit done (finding)	4180186
4084521	Obstetric domiciliary visit done (finding)	4180186
4084521	Obstetric domiciliary visit done	4180186
4084526	Listed for Oncology admission (finding)	4180186
4084529	Listed for hosp admission NOS (finding)	4180186
4084532	Inpatient stay 1 day (finding)	4180186
4084533	Blood group antibody K^w^	4180186
4084533	Blood group antibody K^w^ (substance)	4180186
4084533	Blood group antibody K8	4180186
4084533	Blood group antibody K w	4180186
4084533	Blood group antibody K<sup>w</sup>	4180186
4084535	Inpatient stay 5 days (finding)	4180186
4084536	Voluntary social agency (regime/therapy)	4180186
4084538	Diversion of thought	4180186
4084538	Loss of direction of thought (finding)	4180186
4084538	Sidetracked from flow of thought	4180186
4084540	Delusion of grandeur	4180186
4084540	Grandiose delusions (finding)	4180186
4084541	Delusion of special mission (finding)	4180186
4084544	Delusion associated with sexual hallucinations (finding)	4180186
4084545	Arterial fistula	4180186
4084545	Fistula of artery (disorder)	4180186
4084546	Hypochondriacal delusion (finding)	4180186
4084547	Depressive hypochondriacal delusion (finding)	4180186
4084548	Delusion of control of voice (finding)	4180186
4084550	Perception that things appear colorless (finding)	4180186
4084550	Perception that things appear colourless	4180186
4084551	Perception that things appear gray (finding)	4180186
4084551	Perception that things appear grey	4180186
4084552	Heightened perception (finding)	4180186
4084560	Withdrawn (finding)	4180186
4084564	Integrated attention for short spells (finding)	4180186
4084569	Excessive feelings of mental efficiency (finding)	4180186
4084571	Disseminated actinomycosis (disorder)	4180186
4084576	P - Portal vein marker (tumor staging)	4180186
4084577	M - Metastatic marker (tumor staging)	4180186
4084581	Entire third costochondral joint	4180186
4084581	Entire third costochondral junction (body structure)	4180186
4084582	Entire fourth costochondral junction (body structure)	4180186
4084582	Entire fourth costochondral joint	4180186
4084584	Unit of antibody assay (qualifier value)	4180186
4084585	Maxillectomy (procedure)	4180186
4084585	Excision of maxilla	4180186
4084587	Entire adductor space	4180186
4084587	Entire thenar space (body structure)	4180186
4084588	Laceration of pharynx (disorder)	4180186
4084589	Corrosion of pharynx (disorder)	4180186
4084590	Laceration of trachea (disorder)	4180186
4084591	Suicide intent score subscale - risk (assessment scale)	4180186
4084592	Ability to tiptoe (observable entity)	4180186
4084593	Unit of currency (qualifier value)	4180186
4084594	Runs	4180186
4084594	Does run (finding)	4180186
4084596	Does not attempt to run (finding)	4180186
4084599	Unable to run on flat (finding)	4180186
4084600	Runs on flat	4180186
4084600	Does run on flat (finding)	4180186
4084601	Unable to run up a slope (finding)	4180186
4084602	Runs up a slope	4180186
4084602	Does run up a slope (finding)	4180186
4084607	Unable to run up steps (finding)	4180186
4084608	Does run up steps (finding)	4180186
4084608	Runs up steps	4180186
4084610	Ability to run down stairs (observable entity)	4180186
4084613	Difficulty initiating running (finding)	4180186
4084614	Ability to stop running (observable entity)	4180186
4084617	Unable to tiptoe (finding)	4180186
4084618	pence (qualifier value)	4180186
4084619	Enlargement annuloplasty (procedure)	4180186
4084622	Solid adhesive causing toxic effect (disorder)	4180186
4084623	Polystyrene cement causing toxic effect (disorder)	4180186
4084624	Adhesive stick causing toxic effect (disorder)	4180186
4084625	Shoe dye causing toxic effect (disorder)	4180186
4084627	Shoe waterproofer causing toxic effect (disorder)	4180186
4084628	Battery causing toxic effect (disorder)	4180186
4084629	Button battery causing toxic effect (disorder)	4180186
4084630	Toy or novelty causing toxic effect (disorder)	4180186
4084631	Firework causing toxic effect (disorder)	4180186
4084632	Aquarium or pond product causing toxic effect (disorder)	4180186
4084634	Wasp sting-induced anaphylaxis (disorder)	4180186
4084634	Anaphylactic shock due to wasp sting	4180186
4084635	Egg white-induced anaphylaxis (disorder)	4180186
4084639	Idiopathic anaphylaxis (disorder)	4180186
4084639	Syndrome of idiopathic anaphylaxis	4180186
4084641	Revision of joint replacement (procedure)	4180186
4084643	Extreme insulin resistance with acanthosis nigricans, hirsutism AND abnormal insulin receptors (disorder)	4180186
4084643	Extreme insulin resistance type A	4180186
4084649	Corrected transposition (morphologic abnormality)	4180186
4084651	Bupivacaine hydrochloride (substance)	4180186
4084652	Arginine aminopeptidase (substance)	4180186
4084653	Paratonia	4180186
4084653	Counter-pull	4180186
4084653	Gegenhalten	4180186
4084653	Diffuse rigidity (finding)	4180186
4084657	Esophagoscopy for removal of polypoid lesion (procedure)	4180186
4084657	Oesophagoscopy for removal of polypoid lesion	4180186
4084658	Transverse process of fifth thoracic vertebra	4180186
4084658	Structure of transverse process of fifth thoracic vertebra (body structure)	4180186
4084660	Holiday relief admission (procedure)	4180186
4084661	Foster care (regime/therapy)	4180186
4084662	2,4-dichlorophenoxyacetic acid (substance)	4180186
4084662	2,4-D - 2,4-dichlorophenoxyacetic acid	4180186
4084662	2,4-D	4180186
4084663	Admission to neurological intensive care unit (procedure)	4180186
4084668	Admit hospital emergency NOS (procedure)	4180186
4084671	Non-urgent psychiatric admission (procedure)	4180186
4084672	Entire posterior branch of superior right pulmonary vein (body structure)	4180186
4084674	Non-urgent gynecological admission (procedure)	4180186
4084674	Non-urgent gynaecological admission	4180186
4084676	Non-urgent ear, nose and throat admission (procedure)	4180186
4084676	Non-urgent ear, nose and throat admission	4180186
4084677	Non-urgent neurology admission (procedure)	4180186
4084680	Non-urgent oral surgical admission (procedure)	4180186
4084681	Other hospital admission NOS (procedure)	4180186
4084682	Referral to physician (procedure)	4180186
4084683	Referral to clinical immunology service (procedure)	4180186
4084683	Immunological referral	4180186
4084685	Referral to gastroenterology service (procedure)	4180186
4084685	Gastroenterological referral	4180186
4084688	Referred to endocrinologist (finding)	4180186
4084692	Neurosurgical referral	4180186
4084692	Referral to neurosurgical service (procedure)	4180186
4084693	Obstetric referral	4180186
4084693	Referral to obstetrics service (procedure)	4180186
4084698	Glass eye, device	4180186
4084698	Glass eye, device (physical object)	4180186
4084698	Prosthetic eye	4180186
4084699	Anxiety about body function or health (finding)	4180186
4084699	Anxiety about health	4180186
4084701	Fear of choking (finding)	4180186
4084701	Phobia of choking	4180186
4084702	Fear of swallowing (finding)	4180186
4084705	Fear of appearing ridiculous (finding)	4180186
4084705	Fear of appearing foolish	4180186
4084706	Fear of going out (finding)	4180186
4084707	Fear of empty streets (finding)	4180186
4084709	Social fear (finding)	4180186
4084710	Fear of using public toilets (finding)	4180186
4084712	Fear of animals (finding)	4180186
4084713	Fear of feathers (finding)	4180186
4084714	Fear of enclosed spaces (finding)	4180186
4084714	Fear of confined spaces	4180186
4084715	Fear of phone boxes (finding)	4180186
4084716	Fear of problem after anesthetic (finding)	4180186
4084716	Fear of problem after anaesthetic	4180186
4084719	Obsessional thoughts of being robbed (finding)	4180186
4084720	Obsessional thoughts of poisoning (finding)	4180186
4084721	Obsessional thoughts of contamination (finding)	4180186
4084729	Exenteration of orbit without skin graft, with temporalis muscle transplant (procedure)	4180186
4084730	Fidgety	4180186
4084730	Fidgeting (finding)	4180186
4084731	Aimless overactivity (finding)	4180186
4084732	Destructive motor activity (finding)	4180186
4084735	Repetitive touching of objects (finding)	4180186
4084739	Does not skip on one foot (finding)	4180186
4084740	Difficulty skipping on one foot (finding)	4180186
4084748	Unable to roll (finding)	4180186
4084749	Unable to roll on to side (finding)	4180186
4084750	Ability to roll over (observable entity)	4180186
4084751	Does roll over (finding)	4180186
4084751	Rolls over	4180186
4084752	Unable to crouch (finding)	4180186
4084758	Date sample received in laboratory (observable entity)	4180186
4084759	No obvious clot in sample (finding)	4180186
4084760	Sample grossly haemolysed	4180186
4084760	Sample grossly hemolyzed (finding)	4180186
4084761	Sample slightly icteric (finding)	4180186
4084762	Sample grossly icteric (finding)	4180186
4084763	Analyte not detected (qualifier value)	4180186
4084763	Analyte below detection limit	4180186
4084765	Above reference range (qualifier value)	4180186
4084766	Within therapeutic range (qualifier value)	4180186
4084768	Query viability of pregnancy	4180186
4084768	Uncertain viability of pregnancy (finding)	4180186
4084769	Type of contaminant (attribute)	4180186
4084770	Clotted (qualifier value)	4180186
4084773	Request details illegible (finding)	4180186
4084773	Request details unreadable	4180186
4084774	No test request given (finding)	4180186
4084775	No contact number given (finding)	4180186
4084777	Awaiting request (finding)	4180186
4084780	Idiopathic polymyositis (disorder)	4180186
4084781	Intra-articular foreign body (finding)	4180186
4084781	Foreign body in joint	4180186
4084781	FB - Intra-artic foreign body	4180186
4084783	Latino virus (organism)	4180186
4084787	Hemorrhagic ovary	4180186
4084787	Oophorrhagia	4180186
4084787	Hemorrhage into ovary (disorder)	4180186
4084787	Haemorrhage into ovary	4180186
4084787	Haemorrhagic ovary	4180186
4084788	Porphyrin measurement, total, plasma (procedure)	4180186
4084789	Injury of abdominal wall (disorder)	4180186
4084794	Cellulitis with lymphangitis of digit (disorder)	4180186
4084798	Mercurous iodide (substance)	4180186
4084800	Antitragus structure (body structure)	4180186
4084800	Antitragus	4180186
4084801	Lanicides (organism)	4180186
4084803	Closed fracture intermediate cuneiform	4180186
4084803	Closed fracture of intermediate cuneiform bone of foot (disorder)	4180186
4084806	Maximum phonation time (observable entity)	4180186
4084809	Prostaglandin F>1<	4180186
4084809	Prostaglandin PGF1 (substance)	4180186
4084809	Prostaglandin F1	4180186
4084811	ECLT - Euglobulin clot lysis time	4180186
4084811	Euglobulin lysis time (procedure)	4180186
4084811	Euglobulin clot lysis time	4180186
4084812	Structure of costal arch (body structure)	4180186
4084812	Costal arch	4180186
4084813	Bone marrow aspiration procedure, anterior iliac crest (procedure)	4180186
4084814	Uronate dehydrogenase (substance)	4180186
4084818	Coxsackie virus exanthem (disorder)	4180186
4084819	Coxsackie muscle infection (disorder)	4180186
4084820	Hutchinson triad	4180186
4084820	Hutchinson's triad (disorder)	4180186
4084821	Papular syphilide (disorder)	4180186
4084822	Corona veneris (disorder)	4180186
4084823	Pustular syphilide (disorder)	4180186
4084828	Refer to partner (procedure)	4180186
